,date,newsSource,newsLink,newsText
87,2019-03-26,머니투데이,https://news.naver.com/main/read.nhn?mode=LSD&mid=shm&sid1=105&oid=008&aid=0004194461,"[머니투데이 류준영 기자] [국과심, ‘제4차 여성과학기술인 육성‧지원 기본계획’ 등 3개 안건 심의·의결] /자료=과기정통부정부가 2023년까지 AI(인공지능)·빅데이터·바이오 등 미래 신산업 분야를 이끌 여성전문인력 3000명을 육성한다. 또 ‘깃털처럼 가벼운 금속체’처럼 성공 가능성은 낮지만 시장의 패러다임을 바꿀 파괴적 기술에 집중 투자하는 이른바 ‘알키미스트 프로젝트’도 추진한다.  과학기술정보통신부는 26일 국가과학기술자문회의 대회의실에서 염한웅 부의장 주재로 ‘국가과학기술자문회의 제5회 심의회의’를 열어 이 같은 내용을 담은 ‘제4차 여성과학기술인 육성‧지원 기본계획(2019∼2023년)’과 ‘제7차 산업기술혁신계획’, ‘제4차 과학관 육성 기본계획’ 등 3개 안건을 심의·의결했다고 밝혔다. /자료=과기정통부우선 ‘제4차 여성과학기술인 육성‧지원 기본계획’에선 여성과학기술인의 질적 성장과 과학기술분야 양성평등 실현에 초점을 두고, 100대 중점 추진과제를 도출했다. 이중 핵심 계획으로 AI‧빅데이터‧바이오 등 4차 산업혁명 핵심 분야 여성 인재 3000명을 양성하고, 출산‧육아기 여성연구자의 안정적 연구수행을 지원키로 했다. 또 여성 연구자들을 위한 유연한 근로환경을 확대하고, 젠더혁신 신규 사업 발굴·추진하는 한편, 연구계획서에 성·젠더 분석 항목을 추가하기로 했다.   향후 5년간의 산업기술 R&D;(연구개발) 중장기 정책 방향을 설정한 산업통상자원부의 ‘제7차 산업기술혁신계획’에서는 △편리한 수송 △건강 △고편의 생활환경 △친환경 에너지 △맞춤형·스마트 제조 등 5대 영역을 전략투자 분야로 도출하고, 분야별 투자전략을 수립하는 한편, 100대 핵심기술을 선정했다.또 4차 산업혁명에 대응해 ‘알키미스트 프로젝트’, ‘플러스(Plus) R&D;’ 등도 추진키로 했다. ‘알키미스트 프로젝트’는 성공 가능성은 낮지만 시장의 패러다임을 바꿀 수 있는 파괴적 기술개발에 도전하는 사업으로 이를테면 깃털처럼 가벼운 금속체, 발전효율 50% 태양전지 등을 개발하는 내용이다. ‘플러스 R&D;’는 국내외에서 이미 개발된 기술을 최대한 활용해 개발 기간을 단축하고, 성과를 극대화하는 기술개발 체계를 말한다. 이밖에 산업기술 인프라 구축 방향을 플랫폼·표준화·실증 위주로 전환하고, 데이터를 기반으로 신산업을 창출하기 위한 데이터 플랫폼을 구축함과 동시에 전략적 표준화 및 실증 시범사업을 추진키로 했다.산업부는 이를 통해 주력산업 세계시장 점유율(8.5% 2017년 기준)과 신산업 1위 대비 기술수준(80% 2017년)을 각각 12%, 84%까지 끌러올린다는 목표다. 산업부 관계자는 “이번 산업기술혁신계획을 통해 신산업을 창출하고 주력산업의 글로벌 경쟁력을 강화하는 등 산업기술 R&D; 지원시스템을 한 단계 업그레이드 하겠다”고 말했다. /자료=과기정통부‘제4차 과학관 육성 기본계획’에서는 어린이 전용 과학 체험공간 확충, 전시역량 강화를 위한 과학문화 전시서비스 R&D; 추진, 해외 주요과학관과 공동 기획·전시, 과학문화 전문인력 양성과정 신설·운영, 과학해설사 지원 확대, 과학관 에듀케이터 양성 등의 세부 추진과제를 설정해 추진하기로 했다. 염 부의장은 “우수인재들이 과학기술계로 많이 진입해 미래성장동력으로 커나갈 수 있도록 여성과학기술인에 대한 지원과 과학소통 채널인 과학관 육성에도 지속적인 노력을 기울여야 한다”고 강조했다.류준영 기자 joon@▶버닝썬 게이트▶조 변호사의 가정상담소 ▶'청담동 주식부자' 이희진 부모 피살 <저작권자 ⓒ '돈이 보이는 리얼타임 뉴스' 머니투데이, 무단전재 및 재배포 금지>"
88,2019-03-26,연합뉴스,https://news.naver.com/main/read.nhn?mode=LSD&mid=shm&sid1=100&oid=001&aid=0010719955,"與 ""MB정권, 김일성 삼촌에 건국훈장…과거에도 같은 기준으로 서훈""野 ""간첩 혐의자가 독립유공자로 둔갑…보훈처장 물러나야""피우진, '김원봉 서훈' 가능성 언급…보훈처 ""의견수렴 필요하다는 취지"" 해명의원 발언 듣는 피우진 국가보훈처장(서울=연합뉴스) 하사헌 기자 = 피우진 국가보훈처장이 26일 열린 국회 정무위 전체회의에 출석, 의원 발언을 듣고 있다. 2019.3.26 toadboy@yna.co.kr(서울=연합뉴스) 고상민 기자 = 국회 정무위원회의 26일 전체회의에서는 무소속 손혜원 의원의 부친 고(故) 손용우 선생의 독립유공자 선정 문제를 놓고 여야 간 거센 공방이 펼쳐졌다.    자유한국당을 비롯한 야당 의원들은 업무보고차 전체회의에 출석한 피우진 국가보훈처장을 대상으로 '잘못된 독립유공자 지정'이라며 청문회 개최와 피 처장의 사퇴를 촉구했다.    반면 여당인 더불어민주당은 공정한 절차에 따른 결정이었다며 보훈처를 적극적으로 엄호했다. 피 처장도 '변경된 심사기준에 따른 지정'임을 거듭 강조하며 물러서지 않았다.    한국당 김진태 의원은 ""예전 경찰 자료를 보면 손 의원의 부친은 1947년 입북했고, 1948년 남파돼 지하공작을 한 데 이어 6·25 전쟁 때는 북한과 접선해서 활동했다고 나와 있다""며 ""대한민국을 파괴하러 온 간첩 혐의자를 독립유공자로 선정한 것""이라고 주장했다.    김 의원은 ""피 처장은 보훈처장 자격이 없다. 책임지고 당장 사퇴하라""고 목소리를 높인 데 이어 피우진 처장에 대한 정무위 차원의 청문회 개최를 요구했다.    같은 당 정태옥 의원도 ""이는 곧 여당 의원인 '손혜원 봐주기'라는 의심이 든다""고 가세했다. 건국훈장 애족장 포상하는 문 대통령(서울=연합뉴스) 김인철 기자 = 문재인 대통령이 15일 오전 서울 용산구 국립중앙박물관 열린마당에서 열린 제73주년 광복절과 정부수립 70주년 경축식에서 독립유공자 故 손용우 씨 배우자 김경희 씨에게 건국훈장 애족장을 포상하고 있다. 2018.8.15    이에 피 처장은 ""김 의원이 말한 경찰 자료는 신빙성을 담보할 수 없어서 인정하지 않았다""며 ""입북, 남파 등도 사실이 아닌 것으로 판단해 (독립유공자로) 지정된 것으로 안다""고 설명했다.    피 처장은 ""선정 기준이 완화돼 예전과는 달리 북한의 정권수립에 기여하지 않으면 사회주의 활동 경력자도 독립유공자 인정이 된다""며 ""(손 의원 부친도) 새로운 기준에 따라 지정된 것""이라고 했다.    앞서 손 선생은 광복 후 조선공산당에서 활동한 이력 때문에 보훈심사에서 6차례 탈락했으나, 7번째 신청 만에 독립유공자로 선정됐다.    그러나 7번째 신청을 앞두고 당시 민주당 소속이었던 손 의원이 당시 피 처장을 의원실에서 만난 사실이 드러나면서 특혜 의혹이 불거졌다. 이야기 나누는 한국당 정무위원들(서울=연합뉴스) 하사헌 기자 = 국회 정무위 자유한국당 김성원(왼쪽부터), 성일종, 김진태, 김용태 의원이 26일 오후 열린 국회 정무위 전체회의가 속개되기에 앞서 대화하고 있다. 2019.3.26 toadboy@yna.co.kr    바른미래당 이태규 의원은 ""주무장관인 보훈처장이 직접 이해당사자 (손 의원)를 만나 독립유공자 지정 선점 기회를 줬다""며 ""이는 전형적인 불공정한 행정이자 특혜행정""이라고 비판했다.    정의당 추혜선 의원은 ""손 선생의 독립유공자 지정의 공정성을 의심하는 것은 아니다""라며 ""문제는 피 처장의 처신에 있다. 선정에 앞선 손 의원과의 면담에 대한 지적에 당장 사과를 했으면 이렇게 정쟁 사안이 되지 않았을 것""이라고 말했다.     그러자 피 처장은 ""문의가 오면 (보훈처 관계자들이) 직접 가서 설명도 드리고 한다""며 ""당시 면담은 (손 의원 측의) 요청에 따른 것이었으며 당시 심사 진행 상황을 '보고'한 것은 아니었다""고 해명했다.     이어 ""면담에서 (손 의원이) 그런(독립유공자 신청) 이야기를 하기에 지금 심사기준을 완화하고 있다. 신청을 해보시라는 이야기를 드렸다""고 설명했다.답변준비하는 피우진과 노형욱(서울=연합뉴스) 하사헌 기자 = 피우진 국가보훈처장(왼쪽 두번째)과 노형욱 국무조정실장(왼쪽 세번째)이 26일 열린 국회 정무위 전체회의에서 답변준비를 하고 있다. 2019.3.26 toadboy@yna.co.kr    피 처장이 야당 의원들의 집중포화를 맞자 민주당 의원들은 방어막을 쳤다.    민주당 김병욱 의원은 ""이명박 정부 때 보훈처는 김일성 북한 주석의 삼촌 김형권에 건국훈장을, 외삼촌인 강진석에게는 애국장을 추서했다""며 ""과거에도 이런 서훈이 있었다. 특정인을 염두에 뒀다는 해석을 경계해야 한다""고 주장했다.    같은 당 유동수 의원은 ""손 선생이 좌익분자가 아니라 오히려 경찰의 사찰계 정보원으로 활동하며 부역자를 색출하는 데 도움을 줬다는 인우보증인(隣友保證人)의 증언도 있었다""고 강조했다.     한편, 피 처장은 해방 후 월북해 북한에서 최고위직을 지낸 의열단장 김원봉 선생의 독립유공자 서훈 여부에 대해 ""의견을 수렴 중이고 (서훈 수여) 가능성은 있다""고 발언해 또 다른 논란을 일으켰다.    이에 한국당 정태옥 의원은 ""북한 정권수립에 직접 기여한 사람도 보훈 대상자가 되면 김일성도 독립운동 때 큰 역할을 했으니 훈장을 줘야 하고, 그 손자인 김정은 북한 국무위원장한테는 보훈연금을 줘야 한다""고 지적했다.    논란이 확산하자 보훈처는 공식 입장을 내고 ""김원봉 선생은 1948년 월북 후 북한 정권수립에 참여했기 때문에 현행 심사기준으로는 포상이 어려운 상황""이라며 ""보훈처장의 답변은 각계의 다양한 의견 수렴 과정이 필요하다는 취지였다""고 해명했다.    한편, 보훈처가 손 선생의 과거 행적과 관련한 원본자료 제출을 하지 않은 데 대한 야당 의원들의 반발로, 정무위는 오후 한 차례 정회에 이어 곧바로 산회했다.  이에 따라 정무위는 내달 4일 보훈처에 대한 현안 질의를 이어가기로 했다.     gorious@yna.co.kr▶네이버 홈에서 [연합뉴스] 채널 구독하기▶뭐 하고 놀까? #흥  ▶쇼미더뉴스! 오늘 많이 본 뉴스영상"
89,2019-03-26,뉴시스,https://news.naver.com/main/read.nhn?mode=LSD&mid=shm&sid1=102&oid=003&aid=0009135886,"협의 위해 만났지만 각자 입장 피력에 그쳐…기존 입장 유지자사고는 지표 관련해 문제제기…교육청은 보고서 제출 설득평가 위한 보고서 제출 기한은 29일…추가 협의 가능성 남아【서울=뉴시스】김선웅 기자 = 자율형 사립고 교장단이 26일 오후 서울 종로구 서울시교육청에서 박건호 교육정책국장과 자사고 재지정 평가기준 관련 면담을 하고 있다. 2019.03.26. mangusta@newsis.com【서울=뉴시스】구무서 기자 = 재지정평가를 앞두고 서울시교육청과 서울지역 자율형사립고(자사고)가 26일 협의에 나섰지만 평행선만 달린 끝에 합의를 이루지 못했다. 서울지역 자사고들은 여전히 평가를 위한 보고서 제출 거부 기조를 유지할 전망이어서 교육당국과 자사고 간 갈등은 더 깊어질 전망이다.서울시교육청 자사고 관련 실무진들과 서울지역 22개교 자사고 학교장들은 이날 오후 서울시교육청에서 만났다. 올해 재지정평가를 받는 13개교 외에 모든 자사고가 참석한 것이다. 25일 서울지역 자사고 학교장들이 ""보고서 제출 거부""를 밝힌 이후 하루 만이다.약 1시간30분 가량 이어진 협의에서는 서울시교육청과 자사고가 서로의 입장을 피력하는데 그친 것으로 알려졌다. 협의종료 후 한 자사고 학교장은 기자들에게 ""(협의)된 게 한 개도 없다""고 말했다.서울시교육청 관계자는 ""지표에 대해 자사고에서는 불편한 점들을 이야기 했고 교육청에서는 그때 그때 설명을 하고 법령이나 지침에 의해 (변경)할 수 없는 것들을 이야기했다""고 말했다. 그러면서도 ""이해를 하거나 납득을 했다고는 못한다""고 말해 사실상 협의가 결렬됐음을 밝혔다.이 관계자는 ""보고서 제출 거부는 옳은 방향이 아니기 때문에 보고서를 제출하라고 권유했다""고 전했다. 자사고 학교장들이 조희연 교육감과의 면담을 요청하는 것에 대해서는 ""그것까지도 열려있다""며 ""실무진들과 논의를 한 뒤 계속적으로 만남을 요청한다면 가능하다""고 말했다. 서울자율형사립고학교장연합회는 전날인 25일 오후 입장문을 내고 지표를 수정하지 않으면 일체의 운영성과평가보고서 제출을 거부하겠다고 밝혔다. 서울 지역 22개 자사고 중 올해 재지정평가를 받는 13개교는 오는 29일까지 평가를 위한 보고서를 서울시교육청에 제출해야 한다. 올해 재지정평가의 32개 평가지표 중 정량평가는 15개, 43점인데 반해 정성평가는 10개, 34점이다. 정량평가와 정성평가가 합쳐진 지표는 7개, 23점이다. 재지정 통과 기준점이 70점이어서 정성평가 34점과 정량+정성평가 23점에서 감점을 얼마나 받느냐에 따라 재지정여부가 갈리게 된다.   nowest@newsis.com▶ 네이버에서 뉴시스 채널 구독하기▶ 뉴시스 빅데이터 MSI 주가시세표 바로가기 <저작권자ⓒ 공감언론 뉴시스통신사. 무단전재-재배포 금지.>"
90,2019-03-26,파이낸셜뉴스,https://news.naver.com/main/read.nhn?mode=LSD&mid=shm&sid1=105&oid=014&aid=0004200070,"""발표 블록버스터급 못미쳐""   애플이 25일(현지시간) 아이폰 판매에 대한 의존을 줄이고 새로운 수익 창출을 위한 야심찬 디지털 서비스를 발표했다.파이낸셜타임스(FT)와 경제전문방송 CNBC를 비롯한 외신들은 애플이 할리우드, 월가와 손잡고 유료 제공 서비스를 강화함으로써 예측이 불가능해지고 있는 아이폰 판매 감소분을 메우는 새로운 성장 전략을 내놨다고 보도했다.이날 미국 캘리포니아주 쿠퍼티노 애플 본사내 스티브 잡스 극장에서 거행된 행사에서 애플이 공개한 서비스들은 외부와 자체 제작 동영상 콘텐츠를 모두 스트리밍하는 'TV+,' 온라인 신문과 잡지 수백개를 제공하는 앱인 '뉴스+,' 게임서비스 '아케이드,' 신용카드인 '애플 카드'가 핵심이다. 가장 큰 관심을 모았던 TV+를 통해 넷플릭스와 아마존프라임, 훌루와 한판 겨루겠다는 채비를 하고 있다. 팀 쿡 애플 최고경영자(CEO)는 ""우리는 TV를 사랑한다""며 기대감을 드러냈다.애플은 유료 시청자를 확보하기 위해 삼성과 LG, 소니, 비지오의 스마트TV, 로쿠와 아마존 파이어TV 같은 경쟁사의 기기에서도 TV+ 시청이 가능하도록하는 파격적인 결정을 내렸다. 애플 뉴스+는 월 10달러에 월스트리트저널과 로스앤젤레스타임스를 포함해 300여개 매체를 제공받을 수 있게 되나 뉴욕타임스와 워싱턴포스트는 참여하지 않을 것으로 전해졌다.세가와 코나미, 레고, 디즈니 같은 업체에서 제작한 100여개 기존과 신규 게임을 무제한으로 즐길 수 있는 '아케이드'는 올해 하반기 중 이용이 가능할 것으로 보인다.이번 애플의 발표에도 이날 장중 애플 주가는 떨어져 전거래일 대비 1.21% 하락하며 거래를 마쳤다. CNBC의 방송 진행자 짐 크레이머는 이번 애플 발표가 ""애널리스트들이 기대했던 블록버스터급에 못미쳤다""며 주가가 떨어진 원인으로 내용들이 ""주로 보행자용 앱이라서 그런 것 같다""라고 말했다.jjyoon@fnnews.com 윤재준 기자     ▶ 세상의 모든 골 때리는 이야기 'fn파스'▶ 속보이는 연예뉴스 fn스타  ※ 저작권자 ⓒ 파이낸셜뉴스. 무단 전재-재배포 금지"
91,2019-03-26,파이낸셜뉴스,https://news.naver.com/main/read.nhn?mode=LSD&mid=shm&sid1=102&oid=014&aid=0004200030,"전문직종도 현금 거래 매년 늘어.. 현금결제 유도 직원에겐 인센티브카드·현금 결제 차등 대우는 불법.. 성숙한 납세의식 갖춰야 탈세 막아   #. 직장인 천모씨(30)는 서울 강남구 압구정동의 한 이태리 레스토랑에서 황당한 경험을 했다. 천씨가 파스타 2그릇과 샐러드를 주문하고 나온 금액은 11만원. 그가 테이블에서 결제를 요청하자 종업원은 그에게 나즈막히 '현금 결제'를 제안했다. 계좌 결제를 할 경우 10%인 만원을 할인해 준다는 것이다. 종업원은 그에게 계좌번호가 적힌 명함까지 건넸다.                   소규모 자영업자 뿐만 아니라 고급 레스토랑, 전문직까지 불법 현금거래의 온상지가 되고 있다. 현금결제를 할 경우 할인을 해주기도 하며 현금결제를 유도한 직원에게 인센티브를 주기도 한다는 것이다.현금결제를 유도하는 원인으로 업체 및 가게 사장들은 높은 '카드 수수료'를 꼽고 있다.■현금 결제 유도시 인센티브 제공26일 여신금융업전문법에 따르면 카드 결제와 현금 결제에 차등 대우하는 것을 금지하고 있다. 신용카드 가맹점은 신용카드로 거래한다는 이유로 카드 결제를 거절하거나 카드 회원을 불리하게 대우하지 못한다. 이를 위반할 경우 1년 이하 징역 또는 1000만원 이하의 벌금에 처할 수 있다.그러나 현금 결제를 종용하는 경우가 비일비재하다. 서울 강서구에 위치한 한 헬스클럽에서는 1년 회원권을 '현금 완납'할 경우에만 할인 혜택을 받을 수 있다. 이 헬스클럽에서는 현금영수증 발급이 불가능하다.현금결제를 유도한 직원에게 일종의 '인센티브'가 부여되기도 했다. 한 레스토랑에서 근무하는 강모씨(35)는 ""현금결제를 유도하는 경우 건당 소정의 금액을 받았다""며 ""현금 결제에 너그러워 보이는 사람을 보면 넌지시 제안한다""고 털어놨다.변호사나 의사 등 전문직들의 꼼수도 해마다 늘고 있다. 박명재 자유한국당 의원이 국세청에서 받은 자료에 따르면, 현금영수증 발급 의무 위반으로 전문직에 부과된 과태료는 2017년 6억6900만원을 기록했다. 2016년 2억2200만원에 비하면 3배 이상으로 급증했다. 국세청으로의 현금영수증 미발행 신고 건수도 2012년 2501건에서 2017년 8180건으로 6년간 3배 이상으로 늘었다.■""카드 수수료 높아 어쩔 수 없어""현금영수증 의무 발행 업종 사업자는 거래 건당 10만원 이상인 현금 거래에 대해 소비자 요구가 없더라도 현금영수증을 발급해야 하며, 위반 사실이 적발되면 영수 금액(부가가치세 포함)의 50%가 과태료로 부과된다.또 국세청은 카드결제 거부 사실이 확인되면 해당 업체에 경고조치를 내리고 결제 거부 금액의 5%를 가산세로 부과한다. 같은 업체가 2회 이상 적발되면 가산세 5%에 과태료 20%를 추가 부과한다.가게 및 가게 사장들도 할 말이 많다. 카드 수수료 등이 높아 어쩔 수 없는 선택이라는 것이다. 현재 신용카드 평균 수수료율은 약 2% 정도로 추산된다. 강서구에서 헬스클럽을 운영하는 김모씨는 ""카드 수수료가 인하됐다고 하지만 여전히 부담스럽다""고 토로했다.이와 관련, 정지선 서울시립대 교수(세무학)는 ""소비자 입장에서는 현금결제로 가격을 할인 받고, 사업자는 부가세와 소득세까지 깎을 수 있어 이해관계가 맞다""며 ""결국 소비자들의 성숙한 납세의식이 선행돼야 탈세를 막을 수 있다""고 말했다.beruf@fnnews.com 이진혁 기자     ▶ 세상의 모든 골 때리는 이야기 'fn파스'▶ 속보이는 연예뉴스 fn스타  ※ 저작권자 ⓒ 파이낸셜뉴스. 무단 전재-재배포 금지"
92,2019-03-26,뉴스1,https://news.naver.com/main/read.nhn?mode=LSD&mid=shm&sid1=102&oid=421&aid=0003902468,"대법원 1부로 배당같은 부 박정화 대법관은 '피해자다움' 부정한 판결 내려권순일 대법관. © News1 안은나 기자(서울=뉴스1) 문창석 기자,서미선 기자 = 비서를 성폭행한 혐의로 2심에서 법정구속된 안희정 전 충남도지사(53)의 상고심 재판 주심이 권순일 대법관으로 결정됐다.대법원은 26일 안 전 지사의 상고심 사건을 대법원 1부에 배당하고 권 대법관을 주심 대법관으로 지정했다고 밝혔다.1부엔 권 대법관 외에 이기택, 박정화, 김선수 대법관이 소속돼 있다.권 대법관은 대법원에서 '성(性)인지 감수성'을 처음 언급한 판결을 내놓은 바 있어 눈길을 끈다.지난해 4월 대법원 2부(주심 권순일 대법관)는 학생을 성희롱해 해임된 대학교수를 복직시키라고 판단한 2심을 깨고 다시 재판하라고 돌려보냈다. '성인지 감수성'이 결여됐고 피해자의 '2차피해'를 고려하지 않은 판결이라는 취지였다.이는 피해자가 처한 사정을 고려해야 한다는 성희롱 소송 심리와 증거판단에 대한 법리를 처음으로 제시한 판결이었다.권 대법관은 각급 법원에서 여러 심급의 재판을 두루 담당하고, 치밀한 재판준비를 바탕으로 당사자들이 승복하는 합리적 결론을 내리는 것으로도 유명하다.대전고법, 서울행정법원, 인천지법 등에서 행정재판을 전문적으로 담당했다. 아파트 건설원가 공개, 산업시설용지 조성원가 공개 판결 등 여러 정보공개청구소송에서 국민의 알권리를 보장하는 판결을 내렸다.서울 가락시장 일용직 인부와 대학교 시간강사도 노동법상 근로자에 해당한다는 판결을 내놔 소수자와 사회적 약자 보호에도 앞장섰다는 평이다.같은 부의 박정화 대법관은 지난해 10월 대법원 1부에서 친구 아내를 성폭행한 혐의로 기소된 30대 남성에게 2심이 내린 '강간 무죄' 판결을 깨고, '성인지 감수성' 결여가 의심된다며 재판을 다시 하라고 결정한 바 있다.당시 재판부는 ""강간 피해자의 대처 양상은 피해자 성정이나 구체적 상황에 따라 달리 나타날 수밖에 없다""면서 성폭력 피해자의 '피해자다움'을 부정한 판결을 내놨다.smith@news1.kr▶ [ 크립토허브 ]  [ 터닝포인트 2019 ] ▶ 네이버 메인에서 [뉴스1] 구독하기![© 뉴스1코리아(news1.kr), 무단 전재 및 재배포 금지]"
