,date,newsSource,newsLink,newsText
74,2019-03-02,머니투데이,https://news.naver.com/main/read.nhn?mode=LSD&mid=shm&sid1=100&oid=008&aid=0004182198,"[머니투데이 김민우  기자] [[the300]""문재인 중재자로서 역할 커져""]유시민 노무현재단 이사장/사진=뉴스1유시민 노무현재단 이사장은 북미정상회담에서 합의가 무산된 것에 대해 ""열매를 맺지 못했지만 열매를 맺을 수 있는 가능성은 더 커진 면도 있다""고 말했다. 또 ""키맨은 여전히 김정은""이라면서도 문재인 대통령의 중재자 역할을 강조했다. 유 이사장은 2일 팟캐스트 방송 '유시민의 알릴레오'에서 북미 정상회담 합의 무산을 주제로 이종석 전 통일부 장관, 김종대 정의당 의원과 이야기를 나눴다. 이 전 장관은 ""결렬 후 나온 발언이 상대방을 배려하고 있고 회담 과정에서 진화된 실무 협상 모습도 보였다""며 ""결렬이지만 미래의 더 큰 합의를 만들어낼 수 있는 자양분을 안고 있는 결렬이었다""라고 평가했다.이에 유 이사장은 ""열매를 맺지 못했지만 열매를 맺을 수 있는 가능성은 더 커진 면도 있다는 것""이라고 공감했다. 김 의원은 회담을 결혼식에 비유했다. 그는 ""결혼식에 비유하자면 파혼은 아닌 상황에서 서로에 대해 더 많이 알게 됐다""며 ""행복한 결합할 수 있는 토대는 강화된 걸로 보인다""라고 말했다. 유 이사장은 ""키맨은 여전히 김정은""이라며 ""미국에 대한 두려움이 70년간 있었겠지만 이걸 떨치고 나왔으면 좋겠다. 담대한 도전이 필요한 시점""이라고 진단하기도 했다. 이들은 문재인 정부의 중재자 역할을 한목소리로 강조하기도 했다. 김 의원은 ""청와대도 사태의 전말을 파악하는 단계기 때문에 다음 행보로 나가기 위한 구상 등 액션 플랜을 짜야 한다""라고 말했다. 이 전 장관은 ""이번 북미 회담 내용을 복기해서 새로운 합의로 나가는 건 남북관계를 푸는 것과도 연동돼 있다. 배전의 노력을 해나가야 한다""라고 말했다. 유 이사장은 ""(문재인 대통령의)중재인으로서 역할이 커지고 있는 상황""이라며 ""이제는 실무선에서 절충은 끝난 것 같고, 정산 간 합의를 또 다른 정상이 나서서 주선하는 역사적으로 찾아보기 어려운 수준의 협상 국면이 열린 것 아닌가 생각한다""라고 전했다. 유 이사장은 ""하노이 회담이 합의에 이르지 못한 결과가 나오고 나서 전세계에서 제일 좋아하는 사람이 아베 총리 아닌가. 각료들도 희색 만면해 잘됐다고 한다""라며 ""3·1절에 그 장면을 보니 화가 난다""라고도 했다. 아울러 ""아베 총리만 기뻐하는 게 아니라 우리 주변에도 그런 분들이 있는 것 같아 마음이 아프다""라며 ""아무리 민족주의가 문명의 대세 아니라고 해도 국민, 국가 단위로 살아가는 상황에서 이 일을 두고 기뻐하는 심리를 이해하기 어렵다""라고 지적했다.김민우  기자 minuk@mt.co.kr▶주식, 나도 더 잘할 수 있을까?▶조 변호사의 가정상담소 ▶머투가 봄맞이 선물 주나봄 <저작권자 ⓒ '돈이 보이는 리얼타임 뉴스' 머니투데이, 무단전재 및 재배포 금지>"
75,2019-03-02,조선일보,https://news.naver.com/main/read.nhn?mode=LSD&mid=shm&sid1=102&oid=023&aid=0003430436,"3·1절 연휴로 나들이 차량이 몰리면서, 전국 고속도로 일부 구간에 정체가 나타나고 있다.2일 한국도로공사는 서울 방향 고속도로의 교통체증이 이날 오후 6~7시에 절정에 이를 것이라고 밝혔다. 밤 10~11시쯤부터 정체가 풀릴 것으로 내다봤다. 지방 방향은 대체로 원활할 전망이다./연합뉴스오후 1시 35분 기준 경부고속도로 서울 방향 대왕판교나들목~금토분기점 0.6㎞ 구간, 양재나들목~서초나들목 2.7㎞ 구간, 부산 방향으로는 경부선입구(한남)~잠원나들목 1.1㎞ 구간, 잠원나들목~반포나들목 1.0㎞ 구간이 정체다.남해고속도로는 순천 방향 창원분기점~북창원나들목 3.8㎞ 구간에서 차량이 가다 서기를 반복하고 있다.서해안고속도로는 서울 방향 소하분기점~금천나들목 3.0㎞ 구간, 중부내륙고속도로는 양평 방향 북충주나들목~충주분기점 5.2km 구간, 제2경인고속도로는 인천 방향 광명나들목~신천나들목 6.6km 구간 등이 혼잡한 상황이다.이날 낮 1시 서울 요금소 기준 주요 도시간 예상 소요 시간은 하행선 ▲서울~부산 4시간30분 ▲서울~대구 3시간10분 ▲서울~광주광역시 3시간 ▲서울~대전 1시간50분 ▲서울~강릉 2시간30분 ▲서울~목포 3시간20분 등이다.상행선은 ▲부산~서울 4시간30분 ▲대구~서울 3시간 ▲광주광역시~서울 3시간10분 ▲대전~서울 1시간40분 ▲강릉~서울 2시간10분 ▲목포~서울 3시간10분 등이다.[권오은 기자 oheun@chosunbiz.com] [네이버 메인에서 조선일보 받아보기][조선닷컴 바로가기][조선일보 구독신청하기] - Copyrights ⓒ 조선일보 & chosun.com, 무단 전재 및 재배포 금지 -"
76,2019-03-02,연합뉴스TV,https://news.naver.com/main/read.nhn?mode=LSD&mid=shm&sid1=103&oid=422&aid=0000363645,"[날씨] 주말에도 초미세먼지 비상…종일 공기 탁해[앵커] 고농도 미세먼지가 기승을 부리면서 전국의 공기질이 무척 나쁩니다. 밤까지도 공기가 탁하겠는데요. 자세한 날씨는 기상캐스터 연결해서 알아보겠습니다. 김민지 캐스터![캐스터]네, 오늘도 공기가 무척 탁합니다.조금 전 1시를 기해서 많은 지역에서 초미세먼지 특보가 해제가 됐지만 여전히 평소보다는 먼지 농도가 높게 나타나고 있기 때문에 계속 주의를 해 주셔야겠습니다.수도권을 포함한 중서부지역에 미세먼지 비상저감조치가 연일 내려져 있습니다.중서부지역을 중심으로는 초미세먼지주의보도 내려져 있는데요.현재 서울은 초미세먼지 농도 세제곱미터당 76, 전북은 81마이크로그램으로 매우 나쁨 수준 보이고 있고요.그밖의 지역들도 공기질 무척 나쁩니다.그래도 답답한 먼지를 해소해 줄 비 소식 들어 있습니다.밤부터 제주에 비가 내리기 시작해서 내일은 충청 이남으로 비구름이 확대될 텐데요.제주에는 최고 40mm, 남해안과 경북 남부동해안은 5~20mm, 그밖에 남부와 충청남도는 5mm 미만 내리겠습니다.비가 한 차례 내리고 동풍까지 불면서 내일 전국에서 보통~좋음 수준의 공기질을 회복하겠습니다.하지만 비가 내리지 않는 수도권 등 서쪽지역을 중심으로는 먼지농도가 높게 나타날 수 있어서 주의해 주셔야겠습니다.당분간 먼지 정보 자주 확인해 주시고요.호흡기 건강에 신경 쓰셔야 하겠습니다.지금까지 날씨 전해드렸습니다.(김민지 기상캐스터)연합뉴스TV 기사문의 및 제보 : 카톡/라인 jebo23 ▶ 연합뉴스TV 네이버 채널 구독   ▶ 생방송 시청 ▶ 대한민국 뉴스의 시작, 연합뉴스TV 앱 다운받기"
77,2019-03-02,뉴시스,https://news.naver.com/main/read.nhn?mode=LSD&mid=shm&sid1=102&oid=003&aid=0009089241,"【부산=뉴시스】 하경민 기자 = 2일 오전 5시 58분께 부산 강서구의 한 건물 지하 빌라에 투숙한 종교단체 친목모임회원 8명(남2, 여6)이 어지럼증과 두통 등 가스 중독증상을 보여 119에 의해 인근 병원으로 옮겨져 치료를 받고 있다. 2019.03.02. (사진=부산경찰청 제공)photo@newsis.com【부산=뉴시스】 하경민 기자 = 부산의 한 건물 지하에서 보일러 배기가스가 실내로 유입된 것으로 추정되는 사고가 발생해 가스중독 증상을 보인 8명이 병원으로 이송돼 치료를 받고 있다. 2일 부산소방재난본부와 강서경찰서에 따르면 이날 오전 5시 58분께 부산 강서구의 한 건물 지하 빌라에 투숙한 종교단체 친목모임회원 8명(남2· 여6)이 두통과 어지럼증 등을 호소한다는 신고가 119에 접수됐다.이들 8명은 119에 의해 인근 병원으로 옮겨져 치료를 받고 있다.  부산소방은 ""LP보일러 배기가스 일부가 실내로 유입돼 이들이 가스에 중독된 것으로 추정된다""고 밝혔다.경찰은 정확한 사고경위를 조사 중이다.yulnetphoto@newsis.com▶ 네이버에서 뉴시스 채널 구독하기▶ 뉴시스 빅데이터 MSI 주가시세표 바로가기 <저작권자ⓒ 공감언론 뉴시스통신사. 무단전재-재배포 금지.>"
78,2019-03-02,연합뉴스TV,https://news.naver.com/main/read.nhn?mode=LSD&mid=shm&sid1=103&oid=422&aid=0000363639,"[날씨] 주말도 초미세먼지 기승…전국 경보ㆍ주의보[앵커] 전국에서 고농도 미세먼지가 기승을 부리고 있습니다. 전국에 초미세먼지 경보와 주의보가 발효 중이어서 주의하셔야겠는데요. 자세한 날씨는 기상캐스터 연결해서 알아보겠습니다. 김민지 캐스터! [캐스터]오늘도 전국 하늘에 먼지가 가득합니다.주말이라 바깥활동 계획하시는 분들 많으시겠지만 되도록이면 외출은 줄이시는 게 좋겠습니다.현재 수도권을 포함한 중서부지역에 미세먼지 비상저감 조치가 연일 내려져 있고요.전국 대부분 지역에 초미세먼지 주의보가 발효 중입니다.특히 충청과 호남은 경보도 내려져 있습니다.현재 서울은 초미세먼지 농도 세제곱미터당 77, 충북은 100마이크로그램으로 매우 나쁨 수준 보이고 있고요.그밖의 지역들도 공기질이 무척 나쁩니다.그래도 답답한 먼지를 해소해 줄 비 소식 들어 있습니다.밤부터 제주에 비가 내리기 시작해서 내일은 충청 이남으로 비구름이 확대될 텐데요.제주에는 최고 40mm, 남해안과 경북 남부 동해안은 5~20mm.그밖의 남부와 충청 남부는 5mm 미만 정도 내리겠습니다.비가 한 차례 내리고 동풍까지 불면서 내일 전국에서 보통~좋음 수준의 공기질을 회복하겠습니다.하지만 비가 내리지 않는 수도권 등 서쪽지역을 중심으로는 먼지농도가 높게 나타날 수 있어서 주의해 주셔야겠습니다.당분간 먼지 정보는 더 부지런히 확인 해주시기 바랍니다.지금까지 날씨 전해드렸습니다.(김민지 기상캐스터)연합뉴스TV 기사문의 및 제보 : 카톡/라인 jebo23 ▶ 연합뉴스TV 네이버 채널 구독   ▶ 생방송 시청 ▶ 대한민국 뉴스의 시작, 연합뉴스TV 앱 다운받기"
79,2019-03-02,뉴시스,https://news.naver.com/main/read.nhn?mode=LSD&mid=shm&sid1=102&oid=003&aid=0009089467,"전화 연결 실패·무응답 합쳐도 가담 14% 미만 집계교육청 홈페이지서 명단 확인…긴급 돌봄 신청 접수【서울=뉴시스】이윤청 수습기자 = 김철 한유총 정책홍보국장이 28일 오후 서울 용산구 한국유치원총연합회 회의실에서 열린 ‘유아교육 정상화를 위한 한유총 입장 발표 기자회견'에서 기자회견문을 낭독하고 있다. 2019.02.28. radiohead@newsis.com【서울=뉴시스】 이연희 구무서 기자 = 서울·인천·경기 수도권 사립유치원 중 개학연기 입장을 밝혔거나 가능성 있는 유치원 수는 최대 246곳(13.2%)으로 나타났다.2일 서울·인천·경기 교육청이 홈페이지에 공개한 개학연기 유치원 현황에 따르면 1864곳 중 개학연기를 표명한 유치원은 83곳(4.4%), 무응답은 163곳(8.75%)로 집계됐다.  교육당국은 '개학연기에 가담하지 않겠다'고 분명히 밝히지 않은 유치원도 개학 연기 가능성이 있다고 보고 준비 중이다.  서울교육청은 총 606개 유치원 중 개학을 무기한 연기하는 유치원이 이날 정오 기준으로 39곳, 무응답은 8곳으로 집계됐다고 밝혔다.무기한 개학을 연기하고 자체돌봄도 제공하지 않는 유치원은▲아이디유치원 ▲원암유치원 ▲효천유치원 ▲우리유치원 ▲사랑샘유치원 ▲선덕유치원 ▲선희유치원 ▲한울유치원 ▲동화나라유치원 ▲예슬유치원 등 10곳이다.또 ▲성실유치원 ▲까치유치원 ▲대원유치원 ▲동화나라유치원 ▲새봄유치원 ▲꿈밭유치원 ▲보나유치원 ▲유화유치원 ▲햇살유치원 ▲한별유치원 ▲청아유치원 ▲한성유치원 ▲초안유치원 ▲아랑유치원 ▲강동유정유치원 ▲강일늘사랑유치원 ▲송파유정유치원 ▲우일유치원 ▲위례우일유치원 ▲유정유치원 ▲가람유치원 ▲녹원유치원 ▲돌샘유치원 ▲준현유치원 ▲준현유치원 ▲하늘빛유치원 등 25곳은 개학 연기에 참여하지만 수업만 하지 않고 자체돌봄서비스는 제공한다. 하지만 ▲진달래유치원 ▲예진유치원 ▲나래유치원 ▲예랑유치원 ▲지현유치원 ▲솔샘유치원 예일유치원 ▲오즈마법사유치원은 개학 연기 여부에 대해 긍정도 부정도 하지 않았다. 서울교육청은 일부 사립유치원의 허위 보고 등으로 사실과 다르게 접수될 수 있어 확인 즉시 교육청(02-399-9003)에 연락해줄 것을 요청했다. 또한 긴급돌봄이 필요한 학부모들에게 홈페이지에 공지된 임시돌봄 관련 안내문을 참고해 신청해 달라고 안내했다.【서울=뉴시스】이윤청 수습기자 = 25일 오후 서울 여의도 국회 앞에서 한국유치원총연합회 주최 '유아교육 사망선고 교육부 시행령 반대 총궐기대회'가 열리고 있다. 2019.02.25. radiohead@newsis.com경기도는 가장 많은 사립유치원이 포함돼 유아교육 대란 우려가 가장 컸지만 1031곳 중 개학연기는 44곳(4.2%)이었으며, '무응답' 103곳을 합쳐도 총 147곳(14.3%)으로 집계됐다.평택의 예일유치원과 팽성유치원, 행복한아이유치원, 꿈터유치원, 가람유치원, 정민유치원, 한스유치원은 개학 연기에는 가담하지만 자체돌봄 서비스는 제공하기로 했다.인천에서는 한유총의 무기한 개학 연기에 동참한 유치원이 없는 것으로 나타났다. 다만 인천 시내 227개 사립유치원 중 통화가 되지 않았거나 개학 연기에 대해 입장을 밝히지 않은 곳은 52개로 집계됐다. 최근 지회장이 집행부의 무기한 개학 연기 결정에 반대해 사임한 바 있다. 개학연기를 하거나 확실히 가담하지 않는다고 밝히지 않은 유치원 명단은 각 교육청 홈페이지(서울 sen.go.kr, 인천 ice.go.kr, 경기 goe.go.kr)에서 확인할 수 있다.dyhlee@newsis.com nowest@newsis.com▶ 네이버에서 뉴시스 채널 구독하기▶ 뉴시스 빅데이터 MSI 주가시세표 바로가기 <저작권자ⓒ 공감언론 뉴시스통신사. 무단전재-재배포 금지.>"
80,2019-03-02,연합뉴스,https://news.naver.com/main/read.nhn?mode=LSD&mid=shm&sid1=100&oid=001&aid=0010668679,"오전 9시반 호텔나서 호찌민묘 헌화, 바로 동당역으로…동당역서도 환송행사 김정은, 호찌민 묘 방문[연합뉴스TV 제공](하노이=연합뉴스) 민영규 특파원 김효정 기자 = 김정은 북한 국무위원장이 베트남 하노이에서 개최된 2차 북미정상회담과 베트남 공식친선방문 일정을 모두 마치고 2일 귀국길에 올랐다.     김 위원장은 이날 오전 9시 34분께(이하 현지시간) 수행 간부들과 함께 숙소인 하노이 멜리아 호텔을 나섰다.     도착 당시처럼 응우옌 득 쭝 하노이 시장(인민위원장)의 환송을 받으며 전용차에 탑승한 그는 오전 9시 40분께 하노이 바딘광장에 도착했다.    김 위원장은 리수용·김평해·오수용 노동당 부위원장, 김여정·김성남 노동당 제1부부장, 리용호 외무상, 최선희 외무성 부상 등 수행 간부들과 함께 '베트남의 국부'인 호찌민 전 베트남 국가주석 묘소를 방문해 헌화했다.    호 전 주석은 김 위원장의 조부인 김일성 주석이 1958년과 1964년에 베트남을 각각 공식, 비공식 방문했을 때 하노이에서 정상회담을 했었다.    김 위원장은 이어 오전 10시가 조금 넘은 시각 전용차로 하노이를 출발, 중국 접경지역인 랑선성 동당역으로 이동한 것으로 알려졌다.김 위원장은 동당역에서 오후 1시를 전후해 전용열차를 타고 중국 국경을 넘을 것으로 전해졌다.     베트남 측은 지난달 26일 김 위원장이 도착했을 당시처럼 동당역에서 레드카펫을 깔고 환송 행사를 할 것으로 알려졌다. 베트남 현지 매체의 영상에는 동당역에 김 위원장의 전용열차가 들어와 있는 모습이 비쳤다.    베트남을 떠난 이후 김 위원장이 중국에서 광저우(廣州) 등 남부의 개혁개방 상징 도시들을 들러볼지, 곧바로 베이징으로 이동해 시진핑(習近平) 중국 국가주석과 만날지, 아니면 평양으로 곧장 돌아갈지는 알려지지 않았다.     동당역에서 평양까지는 3천800㎞가 넘는 장도로 66시간가량 달려야 한다.     김 위원장은 지난 2월 26일 이 길을 따라 전용 열차를 타고 동당역에 도착, 27∼28일 도널드 트럼프 미국 대통령과 2차 핵담판을 벌였지만 아무런 합의에 이르지 못했다.     지난달 28일 트럼프 대통령이 떠난 후 김 위원장은 지난 1일 오후 3시 30분께 베트남 주석궁 앞에서 열린 환영식에 참석하는 것으로 공식친선방문을 시작했다.     북한 최고지도자로서는 55년 만에 베트남을 찾은 김 위원장의 방문 명칭은 '공식친선방문'이지만 최고의 예우를 받는 국빈 방문과 같은 수준이라고 베트남 당국이 밝힌 바 있다.    김 위원장은 환영식에 이어 베트남 권력서열 1∼3위인 응우옌 푸 쫑 베트남 공산당 서기장 겸 국가주석, 응우옌 쑤언 푹 총리, 응우옌 티 낌 응언 국회의장과 잇달아 회담한 뒤 환영 만찬에 참석했다. 환영만찬 건배하는 김정은과 베트남 국가주석(하노이 EPA=연합뉴스) 베트남 공식친선방문 일정에 나선 김정은 북한 국무위원장(왼쪽)이 1일 하노이 국제컨벤션센터(ICC)에서 열린 환영만찬에서 응우옌 푸 쫑 베트남 공산당 서기장 겸 국가주석과 건배하고 있다. ymarshal@yna.co.kr    youngkyu@yna.co.kr▶네이버 홈에서 [연합뉴스] 채널 구독하기▶뭐 하고 놀까? #흥  ▶쇼미더뉴스! 오늘 많이 본 뉴스영상"
81,2019-03-02,뉴시스,https://news.naver.com/main/read.nhn?mode=LSD&mid=shm&sid1=100&oid=003&aid=0009089274,"【하노이=AP/뉴시스】마이크 폼페이오 미 국무장관이 26일 제2차 북미 정상회담 준비를 위해 베트남 하노이 노이바이국제공항에 도착했다. 2019.02.26.【서울=뉴시스】 안호균 기자 = 마이크 폼페이오 미국 국무장관이 2차 북미 정상회담 이후 한국, 중국, 일본 외교장관과 잇따라 전화통화를 하고 북한 비핵화 문제에 대해 협의했다.로버트 팔라디노 미 국무부 대변인은 1일(현지시간) 홈페이지에 게시한 브리핑 자료를 통해 ""폼페이오 장관이 강경화 한국 외교부 장관과 대화를 나눴다""며 ""폼페이오 장관과 강 장관은 하노이에서 열린 북미 정상회담에 대해 논의했다""고 밝혔다. 이어 팔라디노 대변인은 ""양측은 북한의 비핵화에 대해 계속 긴밀하게 조율하기로 했다""고 덧붙였다.폼페이오 장관은 이날 고노 다로(河野太郞) 일본 외무상과도 전화 통화를 갖고 북미 정상회담 대해 협의했다. 국무부는 폼페이오 장관이 일본에 북한 문제에 대한 다음 단계를 소개하고 비핵화에 대한 약속을 재확인했다고 전했다. 폼페이오 장관과 고노 외상은 올해말 미일 2+2 안보협의위원회를 열어 안보 및 방위 협력을 강화하기를 기대한다고 말했다.미중간의 전화 통화도 이뤄졌다. 국무부는 폼페이오 장관이 이날 양제츠(杨洁篪) 중국 외교담당 정치국원과의 대화에서 하노이 북미 정상회담에 대한 통찰력을 제공하고, 북한에 대한 유엔 제재가 평화롭고 안정적이며 핵이 없는 북한을 만들기 위한 중심축으로 남아 있음을 확인했다고 밝혔다. 또 두 사람은 무역 문제를 포함한 양국 관계 현안에 대해서도 논의했다.ahk@newsis.com▶ 네이버에서 뉴시스 채널 구독하기▶ 뉴시스 빅데이터 MSI 주가시세표 바로가기 <저작권자ⓒ 공감언론 뉴시스통신사. 무단전재-재배포 금지.>"
82,2019-03-02,한겨레,https://news.naver.com/main/read.nhn?mode=LSD&mid=shm&sid1=101&oid=028&aid=0002444965,"2일 오전 긴급 관계부처 회의“유치원도 교육기관…개학연기 철회해야”“에듀파인 어제 시행…법령 지키며 투쟁해야”‘유치원 3법’ 철회요구하는 한유총이날 보도자료 내 “정부 대화 대신권력기관 동원해 한유총 협박“ 주장이낙연 총리. <한겨레> 자료사진  이낙연 국무총리가 2일 사립유치원단체 한국유치원총연합회(한유총)의 개학연기 투쟁에 대해 철회를 요구하며 “법령에 따라 엄정 대처하겠다”고 말했다. 이에 대해 한유총은 “정부가 교육공안정국을 조성하고 있다”고 반발했다.  이 총리는 이날 오전 정부서울청사에서 열린 긴급 관계부처·지자체 합동회의에서 “유치원도 교육기관이다. 아이들을 볼모로 잡겠다는 것은 교육기관의 자세가 아니다”라며 “사회 구성원 대부분이 분노하는 것은 당연하다. 사립유치원은 개학연기를 즉각 철회하고 공공성과 투명성을 가진 교육기관으로 돌아오라”고 말했다.  이 총리는 “사립유치원 회계를 좀 더 투명하게 하기 위해 에듀파인(국가관리 회계시스템)이 어제부터 시행됐다”며 “한유총은 에듀파인을 도입하겠다고 하면서도 납득하기 어려운 주장을 계속하고, 유치원 3법도 거부하고 있다”고 말했다. 그는 이어 “교육 당국은 (한유총이) 에듀파인을 수용하지 않겠다는 것이나 사실상 다름없다고 보고 있다”며 ”누구도 법령 위에 있을 수 없다. 뭔가를 주장하고 싶어도 법령을 지키며 주장해야 한다”고 말했다.   이 총리는 교육부에 “법적 조치까지 포함한 단계별 대책을 적극적으로 이행하고, 학부모들이 걱정하지 않도록 정보를 충분히 제공하라”고 지시했다. 또 교육청과 지자체에 “복지부, 여성가족부 등과 협력해 어린이집과 지역기관 같은 현장에서 돌봄이 차질없이 이행되도록 하라”고 주문했다.  이날 회의는 다음 주부터 유치원 개학을 무기한 연기한다는 한유총의 주장과 관련해 정부 대응책을 마련하기 위해 열렸다. 한유총은 ‘유치원 3법’(유아교육법·사립학교법·학교급식법 개정안) 철회 등을 요구하며 “정부의 입장변화가 있을 때까지 올해 1학기 개학을 무기한 연기하는 준법투쟁을 전개하겠다”고 밝히고 있다.  이날 회의에는 유은혜 사회부총리 겸 교육부 장관, 박상기 법무부 장관, 진선미 여성가족부 장관, 김상조 공정거래위원장, 윤종인 행정안전부 차관, 권덕철 보건복지부 차관, 한승희 국세청장, 민갑룡 경찰청장 등이 참석했다. 지자체에서는 김희경 경기도 행정부지사, 윤준병 서울시 행정부시장, 이재정 경기도교육감, 김원찬 서울시교육청 부교육감 등이 참석했다.   한편, ‘유치원 3법’ 철회 등을 요구하며 개학연기를 선언한 한유총은 이날 보도 자료를 통해 정부가 “교욱공안정국을 조성하고 있다”고 반발했다. 한유총은 ”유은혜 부총리 겸 교육부 장관은 취임 후 단 한 번도 법정단체 한유총의 정책건의와 대화요구에 응하지 않았다”며 “대신 습관적으로 엄정·강경 대응, 형사고발을 운운하며 협박과 겁박을 하고 있다”고 주장했다. 한유총은 이어 “국세청장, 경찰청장, 공정거래위원장 등 권력기관을 동원한 사립유치원 탄압정책은 군사독재 시절에도 볼 수 없는 교육공안정국을 조성해 사회불안을 증폭시킨다”며 “매우 부적절하다”고 비판했다. 한유총은 개학 일자 결정이나 학사일정 조정 등은 “법률에 보장된 사립유치원 운영권에 속한다”며 “이를 중대한 불법인 것처럼 호도하며 감사와 형사고발 운운하는 것은 직권남용과 협박죄에 해당할 수 있다”고 반박했다. 최현준 기자 haojune@hani.co.kr  [▶네이버 메인에서 한겨레 받아보기] [▶한겨레 정기구독] [▶영상 그 이상 ‘영상+’][ⓒ한겨레신문 : 무단전재 및 재배포 금지]"
