,date,newsSource,newsLink,newsText
38,2019-03-13,뉴스1,https://news.naver.com/main/read.nhn?mode=LSD&mid=shm&sid1=104&oid=421&aid=0003878552,"11일 (현지시간) 보잉의 '737 맥스 8' 여객기가 플로리디 주 포트로더데일 할리우드 국제공항에 착륙을 하고 있다. 이 항공기는 지난 10일 에티오피아 비쇼프투시 근처에서 추락해 157명 전원이 숨진 에티오피아항공 소속 여객기와 같은 기종이다. © AFP=뉴스1 © News1 우동명 기자(서울=뉴스1) 이창규 기자 = '차세대 주력기'로 꼽혀온 보잉 737 맥스8 기종의 안정성 우려가 제기되면서 잘 나가던 미국 보잉사의 앞날에 짙은 암운이 드리웠다.2017년 첫 취역한 보잉 737맥스 기종은 보잉 역대 최고의 베스트 셀러로 떠올랐다. 양대 항공업체인 에어버스와 대형 기종 경쟁을 끝내고 내놓은 차세대 단중거리 전용기가 항공수요 증가, 저가항공사 증편 등 시대적 상황과 맞물리며 최대 히트작이 됐다. '미국을 다시 위대하게'라는 도널드 트럼프 미국 대통령의 통상 압력도 보잉의 선전에 큰 보탬이 됐다.미 연방항공청(FAA)에 따르면 현재 전세계에서 거의 350대의 보잉 737맥스 기종이 운행중이다. 취역 6개월만에 주문만 4000대를 넘어섰다. 현재 주문량은 4661대에 달하는 것으로 알려졌다.그러나 지난해 10월 인도네시아 라이온에어가 새로 도입한 신형 보잉 737 맥스8기가 첫 추락하며 안정성에 의문이 나왔다. 당시 보잉 737 맥스를 운행하는 조종사들의 사이에서도 오작동 경험 등이 제기됐으나 사고 조사는 '정비 미숙'쪽으로 가닥을 잡으며 운항 중단 등 과격 조치는 이어지지 않았다.하지만 5개월도 안돼 에티오피아 항공 동일기종이 두번째 추락하면서 상황은 달라졌다. 사고기가 도입 4개월된 신형기인데다 조종사도 비행 6000시간이 넘는 베테랑이라 기체 이상의 가능성이 높게 점쳐진다. 라이온에어 때와 마찬가지로 조종사는 추락전 이상 비상신호를 보냈다.미국 항공당국의 '안전 비행 가능' 판단에도 불구 안전성 우려는 커지는 양상이다. 전 FAA청장도 인터뷰에서 ""나라면 조사가 나올 때 까지 보잉737맥스를 타지 않겠다""고 말했다. 운항 중단을 결정하는 국가들도 늘고 있다. 영국은 12일(현지시간) 보잉 737맥스의 영공 통과도 불허한다고 밝혔다. 이에 보잉 737맥스 기종으로 영국 노선을 가진 항공사들의 주가도 흔리는 상황이다.보잉 본사의 주가는 급락세이다. 사고후 첫 거래일인 전날 뉴욕증시 거래에서는 5%대 폭락을 경험했다. 이어 운항 중단 결정이 이어지고 있는 12일 개장전 거래에서도 3%대 하락세다.bello@news1.kr▶ [ 크립토허브 ]  [ 터닝포인트 2019 ] ▶ 네이버 메인에서 [뉴스1] 구독하기![© 뉴스1코리아(news1.kr), 무단 전재 및 재배포 금지]"
39,2019-03-13,연합뉴스,https://news.naver.com/main/read.nhn?mode=LSD&mid=shm&sid1=104&oid=001&aid=0010690629,"베트남 외교부 의전국장, 언론 인터뷰…북미 늑장 통보에 진땀김정은 국무위원장 ""베트남에 다시 와 할롱베이 방문하고 싶다""단독 정상회담 중 심각한 표정의 트럼프-김정은(하노이 AFP=연합뉴스) 도널드 트럼프 미국 대통령(오른쪽)과 김정은 북한 국무위원장이 2월 28일(현지시간) 베트남 하노이의 소피텔 레전드 메트로폴 호텔에서 단독 정상회담 도중 심각한 표정을 하고 있다.  leekm@yna.co.kr(하노이=연합뉴스) 민영규 특파원 = 지난 2월 말 베트남 하노이에서 열린 제2차 북미정상회담은 베트남이 회담 무대로 낙점되는 순간부터 끝날 때까지 베트남 정부를 바짝 긴장시킨 한 편의 드라마였던 것으로 뒤늦게 알려졌다.     이 과정에 처음부터 끝까지 참여했던 마이 프억 중 베트남 외교부 의전국장은 12일 현지 온라인 매체 VN익스프레스와의 인터뷰에서 지난했던 과정을 상세히 설명했다. ◇ 북한과 미국의 늑장 통보     막판까지 손에 땀을 쥐게 한 북미정상회담 드라마는 도널드 트럼프 미국 대통령이 지난 2월 9일 트위터로 하노이가 개최도시임을 공개하면서 막을 열었다.     설(2월 5일) 1주일 전쯤 베트남에서 2차 북미회담이 개최될 것이라는 말을 들은 베트남 정부는 트럼프 대통령이 2017년 아시아태평양경제협력체(APEC) 정상회의 때 방문한 다낭이 개최도시가 될 것으로 보고 필요한 준비를 하고 있었기 때문이다.     당시에는 국내외 유력 언론사도 다낭에 숙소를 예약하느라 분주하게 움직였다.     그런데 갑자기 하노이가 개최도시로 확정되면서 호텔 객실 확보에 비상이 걸렸다. '특별한 사람'인 트럼프 대통령과 '미스테리한 인물'인 김정은 북한 국무위원장의 만남에 대한 언론의 취재 열기도 부담이 됐다.    북측이 김 위원장의 베트남 방문을 공식 통보한 것은 북미정상회담 문제 등을 논의하기 위해 방북한 팜 빈 민 베트남 부총리 겸 외교부 장관이 일정을 마치고 귀국길에 오른 2월 14일 오전 7시 30분이었다.     민 장관이 평양을 떠나기 불과 2시간 전이었다.     그러나 이때도 북한은 김 위원장이 북미정상회담 후 베트남을 공식방문할 것이라고 밝히면서도 구체적인 일정을 알리지 않았다. 또 김 위원장이 비행기나 기차로 베트남에 갈 것이라고만 밝혔다.     북측은 2월 15일 ""선발대가 2월 16일 하노이에 간다""고 통보했고, 다음날 하노이에 도착한 선발대가 ""김 위원장이 기차로 랑선성 동당역으로 갈 것""이라며 역 보수를 요청했다.     이에 따라 북한과 베트남 실무팀은 2월 17일 동당역을 함께 점검했다. 김 위원장이 도착하기 불과 9일 전이다. 양국 정상 확대양자회담…지켜보는 취재진(하노이=연합뉴스) 한종찬 기자 = 2월 28일 베트남 하노이 베트남-소련 우전노동문화궁전에 마련된 국제미디어센터에서 백악관 출입 기자 및 각국 언론사 취재진이 스크린을 통해 중계되는 도널드 트럼프 미국 대통령과 김정은 북한 국무위원장의 확대양자회담 모습을 지켜보고 있다. 2019.2.28 saba@yna.co.kr    ◇ 김정은 위원장 숙소와 회담장     소피텔 레전드 메트로폴 호텔은 2월 16일 북측에 객실 109개를 제공할 수 있다고 밝혔지만, 김 위원장을 위한 방이 북측의 요구에 맞지 않아 숙소에서 배제됐다.    북한 선발대가 다음으로 찾은 곳은 멜리아 호텔. 이 호텔 프레지덴셜 스위트가 김 위원장이 묵기에 적당했지만, 북한 선발대는 가타부타 말이 없었다.     북측은 2월 18일 멜리아 호텔에 객실 120개를 요구했지만, 남아 있는 객실이 적어 진통을 겪었다.    하노이 시장이 나서서 다른 5성급 호텔들에 ""멜리아에 예약한 손님을 받아달라""고 요청해야 했다. 그러나 메트로폴 호텔은 ""이유를 설명할 수 없다""며 거절했다.     중 국장은 이때 '북미 정상이 메트로폴 호텔에서 만날 수도 있겠구나'라고 짐작했다.     2월 22일 레 호아이 쭝 베트남 외교부 차관이 멜리아 호텔 사장에게 직접 전화해 가까스로 90개 객실을 확보하고서야 멜리아 호텔이 김 위원장의 숙소로 확정됐다.     북미는 모두 국립컨벤션센터(NCC)를 회담장으로 원하지 않았다. 미국은 이 건물이 너무 넓어 적합하지 않다고 봤고, 북한은 트럼프 대통령이 묵는 JW메리어트 호텔과 가까운 곳이라 꺼렸다.     다음으로 미국 대표단은 베트남 정부 영빈관이 회담장이 될 수 있도록 베트남 정부가 북한을 설득해주기를 바랐지만, 북측이 받아들이지 않았다.     북미 대표단이 함께 점검한 오페라하우스는 회담할 장소가 부족했고, 경호에 대한 우려도 있어 대상에서 빠졌다.     북한은 김 위원장이 하노이에 도착한 2월 26일에서야 ""2월 27일 메트로폴 호텔에서 만찬이 있을 것""이라고 알려줬고, 미국은 2월 27일 0시에 ""2월 28일 메트로폴 호텔에서 회담이 있을 것""이라고 통보했다.     중 국장은 ""정보를 매우 늦고 급하게 받는 게 준비하는 입장에서는 압박이었다""면서 ""북미 양측이 전체 계획이 아니라 정보를 조금씩 제공했다""고 말했다.  베트남 악기 연주해보는 김정은(하노이 로이터=연합뉴스) 김정은 북한 국무위원장(가운데 왼쪽)이 1일 베트남 하노이 국제컨벤션센터(ICC)에서 열린 환영만찬에서 응우옌 푸 쫑 베트남 공산당 서기장 겸 국가주석(가운데 오른쪽)이 지켜보는 가운데 베트남 악기를 연주해 보고 있다. ymarshal@yna.co.kr    ◇ 김정은 위원장의 취향    멜리아 호텔은 김 위원장이 머무는 동안 호텔 이용과 관련한 전권을 북한에 부여해야 했다. 북측의 요청이 없는 한 호텔 직원들은 접근조차 할 수 없었다.     김 위원장은 호텔 20층에 마련한 전용 식당에서 북한에서 가져온 식재료로 만든 음식을 먹었다.     중 국장은 민 장관과 함께 지난달 12∼14일 방북했을 때 김 위원장의 취향을 알아보려고 했지만, 소용이 없었다. 중국 베이징을 경유해 귀국하는 길에 ""김 위원장이 음식과 문화에 조예가 깊은 사람""이라는 얘기를 들었다.     1차 북미정상회담이 개최됐던 싱가포르 등 다른 소식통을 통해 김 위원장이 커피와 와인을 좋아한다는 정보도 수집했다.     김 위원장은 응우옌 푸 쫑 베트남 국가주석이 마련한 환영 만찬이 끝난 후 베트남 음식과 문화에 대한 애정을 표현했다.     특히 만찬에서 선보인 음악 공연을 녹화하도록 하고 베트남 예술인들을 평양에 초청할 가능성을 내비쳤다.    김 위원장은 또 베트남을 다시 방문해 할롱 베이를 방문하고 싶다는 뜻을 밝히기도 했다고 중 국장은 전했다.     중 국장은 ""김 위원장이 많은 경호원에 둘러싸여 있어 개인적으로 접촉할 시간이 많지는 않았지만, 우호적이고 개방적이라고 느꼈다""고 말했다.     베트남은 김 위원장이 지난 2일 동당역에서 귀국길에 오를 때 평화를 염원하며 레드카펫에 장식한 리본을 빨간색에서 파란색으로 바꾼 것으로 알려졌다.      미국은 트럼프 대통령이 2017년 다낭을 방문했을 때와 크게 다르지 않은 요청을 했으며 특히 경호에 대한 요구가 엄청났다고 중 국장은 전했다.      youngkyu@yna.co.kr▶네이버 홈에서 [연합뉴스] 채널 구독하기▶뭐 하고 놀까? #흥  ▶쇼미더뉴스! 오늘 많이 본 뉴스영상"
40,2019-03-13,KBS,https://news.naver.com/main/read.nhn?mode=LSD&mid=shm&sid1=101&oid=056&aid=0010679789," [앵커]주유소 석유값, 오를 때는 속전속결이지만 내릴 때는  한없이 더디죠.피해는 고스란히 소비자의 몫인데, 이런 속도차이, 이유가 뭘까요,박대기 기자가  취재했습니다. [리포트] 경기도의 한 주유소. 정유사에서 석유를 공급받아 팔지만  원가는 모른다고 합니다. [A 주유소 사장/음성변조 : ""오늘 기름 들어와도 (원가를) 몰라요. 당연히 불합리하지, 가격을 알아야죠.""] 정유사는 원가를 월말에야 알려줍니다. 대부분의 주유소는 원가를 모른 상태에서  이윤을 붙여야하기 때문에  가격 인하에 소극적입니다. [A 주유소 사장/음성변조 : ""오르락내리락 금방 못 하는 거예요. 당연하잖아요? 정유사에서 (원가를) 책정해 줘야지... 뭐 가격을 알아야지 맞춰 주죠.""] 반면 알뜰주유소는 원가를 미리 공개해, 원가가 내리면  반영이 빠른 편입니다. [B 알뜰주유소 사장 : ""좋죠, 확실히. 이 가격(원가)을 기준으로 판매가격을 정하면 그냥 되니까...""] 지난해 유류세 인하 사흘뒤 일반 주유소와 알뜰 주유소 간 판매가격 인하 폭 차이는 20%포인트가 넘었지만 12일 뒤에는 1%포인트 대로 좁혀졌습니다. 원가를 뒤늦게 파악한 주유소가 늦게 내린 걸로 분석됩니다. 결국 피해는 소비자 몫입니다. [이서혜/에너지석유시장 감시단 연구실장 : ""공급받는 가격을 정확히 알지 못한다면 본인들이 손해를 보지 않기 위해서 조금 더 높은 가격에 판매를 할 수 있기 때문에...""] 정유사들은 사후정산을 하면  일정기간 중 최저가로 공급하기때문에  주유소가 사후정산을 선택한 것이라고  주장합니다. 하지만 주유소 측 말은 다릅니다.  [C 주유소 사장/음성변조 : ""정유사에서 하라고 하니까 하는 것이지. 우리가 선택할 권리가 없습니다.""] 정유사들은 사후정산을 선택한 주유소 비율은 공개하지 않는 상황.  실태 조사가 필요해 보입니다.   KBS 뉴스 박대기입니다.박대기 기자 (waiting@kbs.co.kr)▶ [만세 지도] 우리 동네 3.1운동 현장은?▶ 네이버 채널 KBS뉴스 구독! 시원하게 털어드립니다▶ ‘TV보다 ㄹㅇ’ 당신의 진짜 뉴스 ‘케이야’"
41,2019-03-13,KBS,https://news.naver.com/main/read.nhn?mode=LSD&mid=shm&sid1=101&oid=056&aid=0010679788," [앵커]이처럼 규제가 풀리면서 일단, 소비자 선택권은  넓어졌습니다.하지만 시장에서 LPG 차량의 인기는  하향세로,  미세먼지 감축효과를  보기 위해선  LPG 차량의 경쟁력이 중요하겠죠.과제는 무엇인지 정연우 기자가  짚어봤습니다. [리포트] 누구나 LPG차를 살 수 있다는 소식을 반기는 사람도 있고, [김석훈/경기도 고양시 : ""가성비라든가 환경적인 부분을 많이 고려하고 있는 시민들이 많이 계시니까 소비자 입장에서 아무래도 지금보다는 많이 늘어나지 않을까 하는...""] LPG차에 별 매력을 못 느낀다는 반응도 나옵니다. [심승석/서울시 강북구 : ""힘도 없고 굳이 좋다는 느낌이 안 들었거든요. (성능이) 많이 따라오는 느낌도 안 들었고 굳이 많이 팔리지는 않을 것 같아요.""] 그럴만한 이유가 있습니다. LPG 가격이  휘발유 보다 40% 가량 싸지만  상대적으로 연비도, 출력도 떨어집니다.   특히, 주유소에 비해 턱없이 적은 LPG 충전소는 가장 큰 불편입니다. 실제로 LPG차량 등록대 수는  8년 사이 40만 대나 줄었습니다.   시장에는 이미  하이브리드, 전기차, 수소차 등 다양한 친환경차들도 나와 있습니다. 그러다 보니 이런 LPG 차량 판매를 늘리려면 규제 완화에 이어 후속조치가 필요하다는 주장도 나옵니다.  현재 LPG 차종은 10여 가지 뿐. 공간을 차지하는  LPG 탱크는 눈에 거슬립니다. 특정인 수요만 있다보니  신차 개발에 뒤쳐진 건데  얼마나 매력적인 신차가 나올지가 관건입니다. 구매 유인책도 거론됩니다. [김상범/한국LPG산업협회 회장 : ""유럽처럼 다양한 세제 혜택, 인센티브 등을 통한  소비자가 LPG 차량을 보다 많이 선택할 수 있는 그러한 제도가 뒷받침 되어야 하겠습니다.""] 다만 수입이 줄어들 정유업계의  반발은 정부에 부담입니다. 또 LPG 수요가 늘면  경유나 휘발유에서 걷던 세금이 줄기 때문에  향후 LPG 세금 인상 여부도  또 다른 변수가 될 전망입니다. KBS 뉴스 정연우입니다.정연우 기자 (nforyou@kbs.co.kr)▶ [만세 지도] 우리 동네 3.1운동 현장은?▶ 네이버 채널 KBS뉴스 구독! 시원하게 털어드립니다▶ ‘TV보다 ㄹㅇ’ 당신의 진짜 뉴스 ‘케이야’"
42,2019-03-13,SBS,https://news.naver.com/main/read.nhn?mode=LSD&mid=shm&sid1=100&oid=055&aid=0000716799,"재판부, 불출석 이팔성에 구인장 발부<앵커>이명박 전 대통령이 보석으로 풀려난 지 일주일 만에 처음 집에서 나와서 오늘(13일) 재판을 받았습니다. 이명박 전 대통령은 법원 앞에 있던 지지자들에게 인사도 하면서 여유 있는 모습을 보였습니다.이 내용은 전형우 기자입니다.<기자>이명박 전 대통령이 서울고등법원에 모습을 나타내자 지지자들이 연호합니다.이 전 대통령은 기다리고 있던 측근들과 밝은 표정으로 인사를 나눴습니다.구치소에 수감됐을 당시 벽을 짚고 천천히 걷던 것과는 달리 오늘은 비교적 빠른 걸음으로 법정으로 향했습니다.재판을 마치고 나올 때도 지지자들을 향해 주먹을 쥐어 보이거나 손을 흔드는 등 시종일관 여유 있는 모습을 보였습니다.오늘 재판에는 이 전 대통령에게 22억 원의 뇌물을 준 혐의를 받는 이팔성 전 우리금융지주 회장의 증인 신문이 예정돼 있었지만, 이 전 회장은 나오지 않았습니다.재판부는 지병 등을 이유로 든 이 전 회장의 불출석 사유가 정당하지 않다며 4월 5일로 다시 재판 날짜를 정하고 구인장을 발부했습니다.검찰은 이팔성 전 회장으로부터 금품을 받은 혐의를 받고 있는 이 전 대통령의 부인 김윤옥 여사와 사위 이상주 변호사를 증인으로 신청했습니다.검찰은 ""이들이 뇌물 사건의 핵심 인물""이라면서 ""특히 김윤옥 여사의 경우 수사 당시 소환에 불응해 조사를 하지 못한 점도 고려해달라""고 재판부에 설명했습니다.재판부는 이팔성 전 회장이 법정에 출석한 뒤 김 여사와 이상주 씨의 증인 채택 여부를 결정할 방침입니다.(영상취재 : 주용진, 영상편집 : 이승진) 전형우 기자(dennoch@sbs.co.kr)▶[핫이슈] 클럽 '버닝썬' 전방위 수사▶[핫이슈] '최악의 미세먼지' 전국 비상▶네이버 메인에서 SBS뉴스 구독하기※ ⓒ SBS & SBS Digital News Lab. : 무단복제 및 재배포 금지"
43,2019-03-13,KBS,https://news.naver.com/main/read.nhn?mode=LSD&mid=shm&sid1=102&oid=056&aid=0010680226," [앵커]한 대기업의 오랜 무책임과 비윤리성을 고발합니다.가습기 살균제를 만든 SK 케미칼입니다.2013년이었습니다.가습기 살균제 문제가 터지자, 관련 제품을 만든 SK케미칼은 당시에 이 제품의 유해성 여부 실험 보고서가 없어졌다고 밝혀왔습니다. 그러나 이 주장이 거짓이었고, 심지어 유해성 실험도 하기 전에 이미 제품을 팔아온 것으로 확인됐습니다.정새배 기자의 단독 보도입니다. [리포트] '가습기 살균제' 문제가  국민적 관심사로 불거졌던 2013년. 당시 KBS 취재진은 SK케미칼 측에 세계 최초라는 가습기 살균제의  개발 당시 유해성 측정 자료를 요청했습니다. SK가 가습기 살균제에 쓴 원료는 CMIT와 MIT 두 종류. SK 측은  개발 당시 실험 자료를  모두 갖고 있다고 밝혔습니다. [SK케미칼 관계자/시사기획 창/2013년 8월 : ""자체적으로 서울대 수의대와 동물 실험을 했던 자료도 있고요. 이건 계속 연구소에서 관리를 했던 것 같고...""] 그러나 취재가 진행되면서 갑자기 자료가 없다고 말을 바꿉니다. [시사기획 창/2013년 8월 : ""근거자료를 공개해 달라고 거듭 요청했지만 업체 측은 결국 응하지 않았습니다.""] 그런데 최근 검찰이 1995년에 작성된 SK의 가습기 살균제 실험보고서를 찾아냈습니다. 2013년 KBS 취재가 들어오자 SK 측이 가습기 살균제 관련 자료를 숨긴 것으로 검찰은 보고 있습니다. 검찰은 또 최초 실험보고서도 문제라고  보고 있습니다. 제품은 1994년에 출시됐는데 정작 보고서는 그 이듬해에 만들어졌습니다. 다시 말해 유해성 검사를  제대로 실시하지 않은채 제품부터 출시했다는 얘기입니다. 또 당시 검사 결과만으로는 가습기메이트가 무해하다는 것이 충분히 입증되지 않은 것으로  전해졌습니다. 검찰은 이를 토대로 SK케미칼 박 모 부사장 등 4명에 대해 증거인멸 혐의를 적용해 구속영장을 청구했습니다. KBS 뉴스 정새배입니다.정새배 기자 (newboat@kbs.co.kr)▶ [만세 지도] 우리 동네 3.1운동 현장은?▶ 네이버 채널 KBS뉴스 구독! 시원하게 털어드립니다▶ ‘TV보다 ㄹㅇ’ 당신의 진짜 뉴스 ‘케이야’"
44,2019-03-13,연합뉴스,https://news.naver.com/main/read.nhn?mode=LSD&mid=shm&sid1=102&oid=001&aid=0010693321,"북한산 5곳중 4곳 완진…소방당국 ""불씨 날아간 것으로 추정""인명피해 없어…건너편 아파트·상가까지 불씨 날아가 화재밤에도 계속되는 진화작업(서울=연합뉴스) 홍해인 기자 = 13일 서울 은평구 모델하우스 화재의 불씨가 옮겨붙은 북한산 일대에서 야간 화재 진압작업이 진행되고 있다.  hihong@yna.co.kr    (서울=연합뉴스) 최평천 김철선 기자 = 13일 오후 4시 16분께 서울 은평구 지하철 3호선 불광역 인근 모델하우스에서 불이 났다가 약 2시간 만에 꺼졌다.    소방당국에 따르면 2층짜리 모델하우스에 원인을 알 수 없는 불이 나 가건물인 모델하우스 전체가 불에 탔다. 불은 오후 6시 8분께 완전히 꺼졌다.    모델하우스는 형체를 알아볼 수 없을 정도로 불에 타 완전히 무너진 상태다. 모델하우스 직원이 1층에서 연기가 들어오는 것을 보고 119 신고를 한 뒤 대피한 것으로 전해졌다.    해당 모델하우스는 효성중공업이 올해 1월부터 9월까지 임대 중인 철골 구조 건물이다. 2008년 가설건축물축조허가를 받았고, 허가 기간은 2020년 6월까지다. 연면적은 4천9㎡다.출동한 구조대는 모델하우스와 인근 건물 안에 있던 23명을 대피시켰다. 인명피해는 없는 것으로 파악됐다.    모델하우스 전체가 순식간에 불에 휩싸이면서 검은 연기가 일대를 뒤덮었다. 소방진압대가 신고 5분 만에 현장에 도착했지만, 이미 불은 건물 전체로 번진 상태였고 일대는 검은 연기로 뒤덮였다.    현장 인근에 주차된 차 5대가 완전히 불에 탔고 20여대도 일부 불에 탔다. 건너편 가전제품 매장 화단에도 불이 붙었다.    모델하우스 인근 KT 은평지점과 대조동우체국 건물의 유리창도 화재로 일부 손상됐다. KT 은평지점은 유리창 교체 작업 중인 것으로 전해졌다.    불이 나자 경찰은 모델하우스 인근 통일로 일대의 교통을 통제했다. 모델하우스 인근 도로 3차로가 통제돼 퇴근길 극심한 차량 정체가 빚어졌다.화재와 사투 벌이는 소방대원들(서울=연합뉴스) 김도훈 기자 = 13일 오후 서울 은평구의 한 모델하우스에서 화재가 발생, 소방대원들이 화재진압 작업을 벌이고 있다.  superdoo82@yna.co.kr    소방당국에 따르면 바람이 강하게 불면서 불씨가 건너편 아파트로 날아가 작은 화재가 발생하기도 했다. 모델하우스 건너편 아파트 11층과 8층 발코니에 불씨가 떨어져 화재가 발생했다. 인근 상가와 아파트에 발생한 화재도 모두 진압됐다.    모델하우스 옆 서울 서부경찰서도 외벽 일부가 불에 그을렸다. 경찰서 내 250여명은 불이 나자 긴급 대피했다.    소방당국은 776명과 81대의 장비를 투입해 진화 작업을 벌였으며, 굴착기 등 중장비를 동원해 잔불 정리에 들어갔다.    소방당국은 정확한 화재 원인을 조사 중이다.    모델하우스 화재가 난 때와 비슷한 시각 약 2㎞ 떨어진 인근 북한산 곳곳에서도 불이 났다. 북한산 5곳에서 불이 발생했고 소방헬기 4대가 동원돼 진화 작업을 했다.     오후 9시 30분 현재 북한산 5곳 중 4곳은 불이 완전히 꺼졌고, 나머지 1곳도 진화가 거의 마무리되고 있다. 현재 진화 작업 중인 곳은 북한산 족두리봉 5부 능선 부근이다. 해가 지면서 소방헬기는 철수한 상태다.    소방 관계자는 ""불은 거의 꺼졌지만, 낙엽에서 연기가 나는 곳이 있어 잔불을 정리 중""이라며 ""80%는 진화가 됐다. 불이 번질 가능성은 없어 보인다""고 설명했다. 은평구청은 장비 96대와 500여명을 투입해 산불을 진압 중이라고 밝혔다.    소방 관계자는 ""북한산 5곳에서 동시에 불이 나기는 했지만, 모델하우스 화재와 산불의 연관성을 현재는 확실히 말할 수 없다""며 ""다만 불씨가 날아간 것으로 추정되며 정확한 원인은 조사해야 한다""고 말했다.고군분투하는 소방대원들(서울=연합뉴스) 김도훈 기자 = 13일 오후 서울 은평구의 한 모델하우스에서 화재가 발생, 소방대원들이 잔불을 수습하고 있다.  superdoo82@yna.co.kr    pc@yna.co.kr▶네이버 홈에서 [연합뉴스] 채널 구독하기▶뭐 하고 놀까? #흥  ▶쇼미더뉴스! 오늘 많이 본 뉴스영상"
