,date,newsSource,newsLink,newsText
0,2019-03-26,JTBC,https://news.naver.com/main/read.nhn?mode=LSD&mid=shm&sid1=102&oid=437&aid=0000205996,"[앵커]지금 보시는 것은 오늘(26일) 아침 서울의 남산타워입니다. 이제는 익숙한 뿌연 모습이죠. 오늘 오전에 전남 지역을 뺀 전국 모든 지역의 초미세먼지 농도가 나쁨 수준으로 올랐습니다. 오후가 되면서 숨통은 트였지만 내일은 다시 전국이 '나쁨'일 전망입니다. 오늘 동서를 막론하고 농도가 높았던 것은 대기 정체 때문이었습니다.  오전 한반도의 풍속은 초당 1m를 채 넘기지 못했고 대기에 갇힌 먼지 농도가 높아진 것입니다. 이렇게 대기가 정체될 때는 국내에서 발생한 미세먼지가 쌓이고는 합니다. 오늘은 이 국내 요인을 더 심화시키는 부산 이야기입니다.진한 매연을 뿜어내는 화물차 배출가스 단속 현장을, 구석찬 기자가 다녀왔습니다.[기자]카메라가 항만을 오가는 화물차를 향합니다.판독실에서는 촬영된 배기가스 농도를 확인합니다.이렇게 10분에 1대 꼴로 배출기준을 넘긴 차량이 적발됩니다.마을버스 차고지도 비상입니다.[버스업체 관계자 : 우리 정비사도 없는데 조금 봐주세요.]단속을 하려고 하자 갑자기 태도가 바뀝니다.[버스업체 관계자 : 공무집행이 아니라 사업방해죄입니다. 이따위 걸 어디서 하고 있어요?]차량 불법개조도 판치고 있습니다.배기가스를 줄이기 위해 넣어야 하는 요소수를 넣지 않도록 고치는 것입니다.90명 넘게 적발됐습니다.모두 비용을 아끼려면 어쩔 수 없다는 입장입니다.[화물차 기사 : (까만 연기 나오는 거?) 그렇죠. 알죠. 지금 경기가 너무 힘들어요.]매연을 잡기 위한 집중단속은 두달 간 계속되는데요.제대로 된 단속을 하기도 쉽지 않습니다.일부 지자체들이 손을 놓고 있기 때문입니다.[부산 남구청 관계자 : 직원이 많지 않을뿐더러 경험이 없어가지고…]2016년 네이처지는 부산을 세계 10대 초미세먼지 오염 항만으로 꼽았습니다.곳곳에서 '미세먼지 제로'를 외치고 있지만 갈길은 멀어 보입니다.(화면제공 : 부산시청·부산경찰청)구석찬(koo.seogchan@jtbc.co.kr) [영상취재: 강태우 / 영상편집: 오원석]▶ JTBC 기자들의 시청자 미션 수행? [뉴스 미션] / [뉴스룸 다시보기]▶ 확 달라진 '뉴스APP' 이슈부터 라이브까지 한눈에!Copyright by JTBC(http://jtbc.joins.com) and JTBC Content Hub Co., Ltd. All Rights Reserved. 무단 전재 및 재배포 금지"
1,2019-03-26,SBS,https://news.naver.com/main/read.nhn?mode=LSD&mid=shm&sid1=104&oid=055&aid=0000719918,"<앵커>조국의 독립을 꿈꿨던 안중근 의사가 순국한 지 오늘(26일)로 꼭 109년이 됐습니다. 안중근 의사는 자신의 뼈를 중국 하얼빈 공원 곁에 묻었다가 국권을 되찾으면 고국으로 옮겨달라는 말을 남겼었는데 지금까지도 우리는 그 유언을 지키지 못하고 있습니다. 그뿐 아니라 안중근 의사 가족의 유해가 어디 있는지도 지금 알 수 없는 상황입니다.송욱 특파원이 그 현장을 취재했습니다.<기자>뤼순 감옥의 사형대 위에서도 대한국인의 의기를 꺾지 않았던 안중근 의사.109년이 지난 오늘 그곳에는 안 의사에 대한 추모와 유언을 지키지 못한 안타까움이 가득했습니다.안 의사의 유해 발굴은 지난 2008년 실패 이후 답보 상태입니다.유력한 매장지로 뤼순 감옥 공동묘지 터가 지목됐지만 중국은 남북한의 합의와 정확한 근거를 요구하고 있습니다.[김월배/하얼빈이공대 교수 : (유력 매장지) 지역에 일반인의 묘지들이 야금야금 먹어 들어오고 있는 상태입니다. 더 요원하기 전에 지표투과 조사라든지, 그런 형태의 (조사를) 실현해야 (합니다.)]안중근 의사뿐 아니라 안 의사 가족들의 유해도 찾지 못하고 있습니다.사형을 앞둔 아들 안중근 의사에게 목숨을 구걸하지 말라고 했던 조마리아 여사와 독립운동가로 활약한 동생 안정근 선생, 안 의사의 부인 김아려 여사는 중국 상하이에서 눈을 감았고 상하이의 한 외국인 공동묘지에 안장됐습니다.안중근 의사의 가족들이 안장됐던 곳입니다. 하지만 1950년대 상하이 도심 개발 사업으로 이처럼 공원으로 변했습니다.[스위안화/푸단대 교수 : 당시 상하이 정부에서 그 공동묘지에 있는 묘들을 일정 기간을 주고 이장하라고 공고했습니다. 기간이 지나면 정부에서 처리하겠다고 했습니다.]묘지 이장 과정에서 안 의사 가족의 유해는 사라졌고 위치를 파악할 수 있는 관련 서류도 발견되지 않고 있습니다.[쑤즈량/상하이사범대 교수 : (기록보관소, 민정국 등을) 지난 1년여 간 모두 조사했습니다만 정확한 기록을 찾지 못했습니다. 당시 이장 관련 일을 했던 사람을 찾으면 내용을 알 수 있지 않을까 싶습니다.]그동안 정부는 안중근 일가의 유해 봉환을 적극 추진하겠다고 공언해왔습니다.이제는 말이 아닌 외교적 역량과 적극적인 지원이 필요한 때입니다.(영상취재 : 이국진, 영상편집 : 정용화, 자료 : 안중근의사숭모회)  송욱 기자(songxu@sbs.co.kr)▶[핫이슈] '승리·정준영 카톡방' 전방위 수사▶[핫이슈] 김학의·장자연 사건▶네이버 메인에서 SBS뉴스 구독하기※ ⓒ SBS & SBS Digital News Lab. : 무단복제 및 재배포 금지"
2,2019-03-26,SBS,https://news.naver.com/main/read.nhn?mode=LSD&mid=shm&sid1=101&oid=055&aid=0000719919,"<앵커>집값이 소득보다 더 빠르게 오르면서 내 집 마련의 꿈은 갈수록 멀어지고 있습니다. 특히 집값만 오른 것이 아니라 저소득층과 고소득층의 소득 차이가 벌어지면서 서민일수록 내 집 마련은 멀고 먼일이 되어버렸습니다.한승구 기자가 보도합니다.<기자>서울에서 비싸기로 상위 20%에 드는 집들은 평균 얼마일까요, 지난해 12월 기준 16억 7천만 원이었습니다.강남 재건축 단지 은마 아파트 115㎡짜리나 입주한 지 10년 된 반포 지역 84㎡ 아파트 정도 됩니다.버는 돈을 하나도 안 쓰고 모아서 이런 집을 사려면 소득 상위 20%는 14.6년 걸립니다.하지만 소득 하위 20%가 이런 집을 장만하려면 무려 109.3년을 모아야 합니다.반대로 집값이 낮은 하위 20% 평균 가격은 3억 2천만 원 정도인데 소득 상위 20%는 2.8년만 모으면 살 수 있습니다.이렇게까지 소득 수준에 안 맞는 집을 산다는 것은 좀 비현실적일 수 있으니 비슷한 수준의 집으로 한 번 비교해 보겠습니다.소득 상위 20%가 값이 비싼 상위 20% 집을 살 때 14.6년 걸린다고 말씀해 드렸는데, 소득 하위 20%가 하위 20% 집을 살 때 걸릴 시간은 21년이었습니다.소득 수준에 맞춰서 집을 산대도 서민의 내 집 마련에는 6.4년이 더 걸리는 겁니다.이런 차이는 2008년 금융위기 즈음에는 5.2년이었고, 재작년만 해도 2년에 불과했습니다.지난 1년 새 집값이 많이 오르는 와중에 상·하위 소득 격차까지 5.47배로 역대 최대로 벌어지면서 이런 결과가 나왔습니다.내 집 마련의 꿈이 유독 서민에게 더 멀어지고 있는 것은 우려할 만한 부문입니다. 한승구 기자(likehan9@sbs.co.kr)▶[핫이슈] '승리·정준영 카톡방' 전방위 수사▶[핫이슈] 김학의·장자연 사건▶네이버 메인에서 SBS뉴스 구독하기※ ⓒ SBS & SBS Digital News Lab. : 무단복제 및 재배포 금지"
3,2019-03-26,JTBC,https://news.naver.com/main/read.nhn?mode=LSD&mid=shm&sid1=102&oid=437&aid=0000206001,"[앵커]핫팩과 보온병에 휴대용 의자까지 들고 새벽부터 길게 줄 서는 모습. 공영주차장의 '유료 정기주차권'을 사려는 사람들입니다. 그나마 이렇게 줄 서서 주차권 살 수 있는 곳은 나은 편입니다. 길게는 4년을 대기해야 하는 지자체도 있습니다.'도심 속 주차 전쟁'의 실태를 밀착카메라 이선화 기자가 취재했습니다.[기자]동이 트기도 전 하나둘 모여든 사람들이 자리를 잡습니다.담요를 덮기도 하고 신문지를 깔고 앉아 커피를 마시기도 합니다.날이 밝아오자, 줄이 늘어납니다.지금 시간이 6시 반을 조금 넘었습니다.제가 나와있는 곳은 인천 계양구의 한 공영주차장인데요.월요일 이른 아침부터 많은 사람들이 보시는 것처럼 줄을 서서 기다리고 있습니다.[김현순/인천 작전동 : 다섯 시에 왔어요 여기. 맨 첫 번째로 왔어. 집이 빌라니까 주차장이 없잖아요. 그러니까 여기를 사용해야지.]공영주차장의 정기권을 구입할 수 있는 것은 1년에 4번, 선착순으로 판매하다보니 일찍 오는 수밖에는 없습니다.[김경우/경기 부천시 : (회사) 직원들이 돌아가면서 일찍 나와서 주차 끊고 있어요. 사다리나 가위바위보 해서 직원 한 명씩 고르는데. 제가 지난번에 이어서 두 번 연속으로 걸려서요.]핫팩은 기본, 곳곳에 휴대용 의자도 등장했습니다.순위 안에 들지 못할까 부랴부랴 달려오기도 합니다.[오늘 늦잠 자가지고. 깜빡 잊었어요. (깜빡 잊으셨어요? 매번 이렇게 일찍 나오세요?) 매번. 한번도 안 잊어버리고.][신중열/인천 청라동 : 오늘 깜빡했어요. 근데 전화가 왔더라고. 빨리 나오래서 7시에 그냥 튀어왔어요. (구입) 못 하면 전쟁이죠.]아침 8시를 넘기자 정기권을 구입한 사람들이 가벼운 발걸음으로 주차장을 나옵니다.[두 시간 섰어 두 시간. 인간적으로. 46번이에요.]인증샷을 찍기도 합니다.[이현숙/인천 작전동 : 오늘 못 끊을 줄 알고 왔는데 56번을 타서, 오늘은 행운이에요 진짜로.]서울의 다른 공영주차장들도 상황은 비슷합니다.[여의도 공영주차장 관계자 : 현재 대기자분이 많으셔서 최소 1년에서 길면 3~4년 대기하셔야지 이용 가능하세요.][광진구 공영주차장 관계자 : 대기하셔도 상관없는데요. 지금 대기자들이 많아서 몇 년 기다리셔야 해요.]사정이 이런데, 주차 공간의 10% 가량이 항상 차 있는 곳도 있습니다.이곳은 한 달에 7만 원을 내고 이용하는 공영 주차장입니다.평일 낮인데도 보시는 것처럼 차량들이 빼곡히 주차가 되어있는데요.그런데 여기 번호판을 보시면 '하'나 '허' 같은 렌터카 번호판이 붙어있고요.이쪽에는 아예 번호판이 없는 차량도 있습니다.시설관리공단에서 렌터카 업체와 계약을 맺고 장기 임대를 해주고 있는 것입니다.[시설관리공단 관계자 : 저희하고 상관없어요. 정기권으로 사용하고 계시는 거예요. (업체에서 정기권 구입해서요?) 네.]한 자리가 아쉬운 주민들은 불만을 터뜨립니다.[똑같이 그들도 새벽 네 시 반에 나와서 공간 할당을 받아서 하면 괜찮은데. 신규 진입에 대한 제한을 두면서 그 사람들한테 공간을 주는 건…]공영 주차장이 아예 없어 갈등을 빚는 곳도 있습니다.수원 광교의 법조타운으로 들어가는 길목입니다.이처럼 곳곳에는 공영주차장을 설치하라는 현수막이 붙어있는데요.실제로 주차난이 얼마나 심각한지 확인해보러 가겠습니다.정문 앞에 청사로 들어가려는 차량이 늘어서 있습니다.방문객이 주차할 수 있는 공간은 150대뿐.[지금 만차라서 못 대는 거예요. (아니 지하주차장 없어요?) 지하주차장 있는데 저희 직원들한테만…]앞서 들어간 차가 나올 때까지 기다려야 합니다.[강덕희/경기 화성시 : 같이 왔어요. (같이요?) 집사람하고. 업무 볼 사람은 가고. 차 대기가 좀 불편해서.]도심과 주택가의 주차 문제는 어제 오늘의 일은 아닙니다.그렇다고 언제까지 손 놓고 지켜볼 수만은 없겠죠.실질적인 대책이 마련되기까지 시민들은 도로 위에서 하염없이 기다릴 수밖에 없을 것입니다.(영상취재 : 최진 / 영상디자인 : 신재훈 / 인턴기자 : 윤현지)이선화(lee.sunhwa@jtbc.co.kr) [영상취재: 이병구,전건구,김진광 / 영상편집: 김정은]▶ JTBC 기자들의 시청자 미션 수행? [뉴스 미션] / [뉴스룸 다시보기]▶ 확 달라진 '뉴스APP' 이슈부터 라이브까지 한눈에!Copyright by JTBC(http://jtbc.joins.com) and JTBC Content Hub Co., Ltd. All Rights Reserved. 무단 전재 및 재배포 금지"
5,2019-03-26,KBS,https://news.naver.com/main/read.nhn?mode=LSD&mid=shm&sid1=101&oid=056&aid=0010684782," [앵커]하늘을 뿌옇게 뒤덮은 미세먼지, 지하철 역에선 그 정도가 어떨까요?수도권 전체 전철역의  평균 미세먼지 농도가 처음으로 공식 집계됐습니다.공기가 가장 나쁜 곳은 어디였는지, 이슬기 기자가 취재했습니다. [리포트] 경기도 남부권의 유동 인구가 몰리는 분당선 야탑역. 역사 곳곳에 마스크를 쓴 승객들이 눈에 띕니다.[황경희/경기도 용인시 : ""먼지가 많아서 기침이 더 많은 것 같아요. 똑같아. 밖이나 여기나. (역 안이) 더 많다고 생각해요, 여기가.""] 운영사 코레일이 이 역의 공기 질을 측정한 결과 평균 미세먼지 농도는  117.4 마이크로그램. 환경 기준 100 마이크로그램을 초과했습니다. 코레일과 서울교통공사 등  열차 운영사업자가 공식 측정한  수도권 전체 역의  미세먼지 농도 수치를  KBS가 입수했습니다.조사 대상 426곳 중에 환경 기준 100 마이크로그램을 초과하는 역은 20곳이었습니다. 의정부역의  미세먼지 농도가 가장 높았고, 인천지하철은  가정중앙시장역, 서울지하철은 도곡역의 미세먼지 농도가 높게 나타났습니다. 대부분 서울 외곽이거나 혼잡도가 높은 환승역인 경우가 많았습니다. '미세먼지 예보' 기준으로 보면 상황은 더 심각합니다. '나쁨' 상태인 80 마이크로그램을 넘는 역이 2백여 곳,  전체의 절반에 달했습니다. 노선별로 보면, 지하철 1호선의 평균 미세먼지 농도가 가장 높았습니다. 역 한 곳을 제외한 모든 역이 '나쁨' 수준을 나타냈습니다. 그러나 수도권 전체 역사 가운데 공기청정기를 갖춘 곳은 10%도 채 되지 않았습니다.[이윤규/건설기술연구원 실내공기품질연구단장 : ""필터도 주기적으로 교환해 주거나 청소를 해 주거나 해야 하는데 필터가 제 성능을 못 한다고 하면 밖의 미세먼지를 걸러 주는 거나 실내에 신선한 공기를 공급해 주는 데 문제가 발생할 수 있기 때문에.""] 법적으로 반드시 갖춰야 하는  환기 설비가 없는 역도  8곳이나 됐습니다. KBS 뉴스 이슬기입니다.이슬기 기자 (wakeup@kbs.co.kr)▶ [만세 지도] 우리 동네 3.1운동 현장은?▶ 네이버 채널 KBS뉴스 구독! 시원하게 털어드립니다▶ ‘TV보다 ㄹㅇ’ 당신의 진짜 뉴스 ‘케이야’"
6,2019-03-26,연합뉴스,https://news.naver.com/main/read.nhn?mode=LSD&mid=shm&sid1=100&oid=001&aid=0010720421,"한-벨기에 국빈 만찬…문대통령 ""한국 평화 지켜준 벨기에 국민에 감사""'독립운동 한국인, 당당하게 행동' 1919년 駐日 벨기에 대사관 문서 선물받아건배하는 한-벨기에 정상(서울=연합뉴스) 한상균 기자 = 문재인 대통령과 벨기에 필리프 국왕이 26일 청와대 환영 만찬에서 건배하고 있다.     벨기에 국왕 방한은 1992년 보두앵 전 국왕 이후 27년 만이다.  xyz@yna.co.kr(서울=연합뉴스) 박경준 기자 = 문재인 대통령은 26일 ""벨기에는 한국전쟁에 참전해 함께 피 흘린 우리의 혈맹""이라고 말했다.    문 대통령은 이날 국빈방한 중인 필리프 벨기에 국왕을 청와대 영빈관으로 초청해 개최한 국빈만찬에서 만찬사를 통해 이같이 밝혔다.    문 대통령은 ""한국전에 참전한 벨기에 부대 중 제3공수대대는 국왕이 근무한 부대라고 들었다""며 ""한국의 평화와 자유를 지켜준 벨기에 국민에게 감사하다""고 했다.    그러면서 ""'어려울 때 친구가 진정한 친구'라는 말처럼 한국민들은 그 고마움을 결코 잊지 않을 것""이라고 했다.    문 대통령은 ""이번에 국왕이 양국의 오랜 우정을 보여주는 매우 귀한 선물을 가져오셨다""며 ""그중에서도 1919년 외교문서가 눈길을 끈다""고 언급했다.    주일본 벨기에 대사관이 본국에 보낸 이 문서에는 '한국에서 3·1독립운동이 일어났을 당시 한국인들은 자유를 원했으며 침착하고 당당하게 행동했다'는 내용이 담겼다.    문 대통령은 ""암울한 시기에 벨기에가 보여준 객관적이고 진실한 태도는 한국인들에게 큰 용기와 희망이 됐다""며 ""올해가 3·1운동 100주년이어서 매우 뜻깊다""고 강조했다.    문 대통령은 지난해 아셈(아시아유럽정상회의)이 열린 벨기에 방문 당시를 떠올리며 ""유럽의 가장 아름다운 도시 브뤼셀에서 나는 모든 사람이 자유롭고 모든 문화가 존중받는 벨기에의 모습을 봤다""고 말했다.청와대, 벨기에 국왕 환영 만찬(서울=연합뉴스) 한상균 기자 = 문재인 대통령과 벨기에 필리프 국왕이 26일 청와대 환영 만찬에서 국가를 듣고 있다. 왼쪽부터 마틸드 왕비, 문 대통령, 필리프 국왕, 김정숙 여사.    벨기에 국왕 방한은 1992년 보두앵 전 국왕 이후 27년 만이다.  xyz@yna.co.kr    이어 ""브뤼셀이 인류의 중심지가 된 것도, 아셈회의를 통해 세계가 글로벌 동반자임을 확인한 것도 벨기에가 가진 통합의 힘이라 생각한다""면서 ""언어·문화 차이를 넘어 통합과 화합의 길을 이룬 국왕님과 벨기에 국민에 경의를 표한다""고 밝혔다.    문 대통령은 ""1901년 수교 때부터 긴 시간 지속한 양국 인연은 해를 거듭할수록 깊어지고 있다""며 ""솔베이, 유니코아 등 벨기에 기업의 한국 투자가 늘고 우리 기업의 벨기에 투자도 꾸준히 확대되고 있다""고 설명했다.    문 대통령은 ""'인생의 어려움은 우정이 해결한다'는 벨기에 속담이 멋지다""면서 ""우리의 우정으로 어떤 어려움도 극복할 것이라고 확신한다""고 언급했다.    필리프 국왕은 ""벨기에 한국전쟁 참전 용사들의 공헌에 대한 대통령의 감사 말씀에 감동했다""며 문 대통령에 사의를 표했다.    필리프 국왕은 ""한반도의 평화와 안정을 위한 대통령의 불굴의 노력에 성원과 지지를 보낸다""며 ""대통령의 공로에 힘입은 최근 남북정상회담의 성공을 대단히 기쁘게 생각한다""고 말했다.    필리프 국왕은 ""방문할 때마다 저희를 놀라게 하는 것은 한국의 지속적인 발전""이라며 ""오랜 역사를 자랑하고 수 세기에 걸친 전통을 계승한 한국은 확고히 미래를 지향하고 있다""고 언급했다.    이어 ""역사 속 한국 국민은 많은 고난과 시련을 겪었지만 이를 슬기롭게 극복하는 용기를 보여주었다""면서 ""이런 내적 강인함이야말로 한국의 급속한 발전, 세계 무대 속 한국이 차지하는 현 위치의 비결이라고 믿는다""고도 했다.건배사 하는 문 대통령(서울=연합뉴스) 한상균 기자 = 문재인 대통령이 26일 청와대에서 열린 벨기에 필리프 국왕 환영 만찬에서 건배사를 하고 있다.    벨기에 국왕 방한은 1992년 보두앵 전 국왕 이후 27년 만이다.  xyz@yna.co.kr    필리프 국왕은 ""지난 수십 년 간 양국 관계는 견고하게 발전해 왔다""면서 경제·학술·문화 등의 분야에서 양국 교류가 더욱 증진하고 있는 데 각별한 의미를 부여했다.    필리프 국왕은 ""어제 가구박물관을 방문했을 때 느꼈듯 한국의 모든 문은 아름다움과 다양성을 발견하고 공유하기 위한 초대장과 같았다""면서 ""우리 마음의 문 또한 그와 같이 열리기를 희망한다""고 말했다.    필리프 국왕은 ""진정한 우정을 바탕으로 양국의 공동 번영을 기원한다""며 '양국의 우정을 위하여'라는 우리말로 건배를 제의했다.    이날 만찬에는 강경화 외교·정경두 국방·도종환 문화체육관광·성윤모 산업통상자원부 장관 등 정부 관계자와 윤종원 경제수석, 김유근 국가안보실 1차장, 박철민 외교정책비서관 등 청와대 관계자가 참석했다.    아울러, 허창수 전국경제인연합회 회장, 김영주 한국무역협회 회장, 공영운 현대자동차그룹 사장, 김기남 삼성전자 대표이사 부회장 등 경제계 인사도 자리했다.    또한 2014년 개교한 벨기에 겐트대 송도캠퍼스의 한태준 부총장, 2016년 한국전쟁 유엔군 참전 60주년 계기에 방한한 벨기에 참전용사들을 봉은사에서 맞이한 원명스님, 유니세프 특별대표인 배우 최시원 씨, 브뤼셀에서 열리는 '퀸 엘리자베스 콩쿠르'에서 2015년 바이올린 부문 1위를 한 임지영 씨, 벨기에 프로축구 리그 안더레흐트에서 뛰었던 설기현 씨 등도 참석했다.kjpark@yna.co.kr▶네이버 홈에서 [연합뉴스] 채널 구독하기▶뭐 하고 놀까? #흥  ▶쇼미더뉴스! 오늘 많이 본 뉴스영상"
7,2019-03-26,MBN,https://news.naver.com/main/read.nhn?mode=LSD&mid=shm&sid1=101&oid=057&aid=0001336836,"【 앵커멘트 】  한국토지주택공사 LH의 한 아파트 공사현장에서 건설폐기물이 나와 공사가 중단됐습니다.  폐기물 불법 매립과 관련해 지자체가 수사기관 고발도 고려하는 가운데, 문제의 폐기물 자체를 LH가 묻은 것 아니냐는 의혹도 제기됐습니다.  어떻게 된 일인지, 이병주 기자가 단독보도합니다.【 기자 】  경기 파주시의 한 아파트 공사장.  한켠에 콘크리트 구조물이 쌓여 있고, 작업자들이 땅속에 묻혀 있는 폐목과 폐기물을 정리중입니다.▶ 스탠딩 : 이병주 / 기자- ""터파기 공사 도중 건설폐기물이 나오면서 본 공사는 중지됐고, 주변 정리 작업정도만 이뤄지고 있습니다.""  건설폐기물은 일정한 절차를 통해 처리하도록 하고 있는데, 불법적으로 매립돼 있는 겁니다.  공사는 벌써 2주째 중단된 상황입니다.▶ 인터뷰 : 공사장 관계자- ""나름대로 계획은 저희들 두 달 정도 하면 거의 나갈 수 있지 않았나 했는데…. 한참 더 걸리겠죠.""  공사를 책임지고 있는 LH 측은 ""폐기물이 어떻게 묻혔는지 확인되지 않고, 다만 LH가 손을 대기 전부터 땅을 사용하던 개인들이 건설폐기물을 묻은 걸로 추정한다""고 밝혔습니다.  그런데 문제가 된 폐기물이 LH가 스스로 묻은 것 아니냐는 의혹이 제기됐습니다.  LH가 2012년 무렵 해당 부지의 흙을 인근 토목 공사장으로 옮겨 사용하고, 인근 아파트 공사 등을 하며 나온 폐기물을 여기에 묻었다는 겁니다.▶ 인터뷰 : 과거 공사 관계자- ""저희야 밑에 하청에서 시공사에서 시키니까 하는데, LH에서 지시가 없으면 못 하죠.""  파주시도 폐기물을 누가 묻었는지 확인하기 위해 수사기관에 통보하기로 했습니다.▶ 인터뷰(☎) : 파주시청 관계자- ""저희한테 중요한 건 폐기물이 나왔다는 거기 때문에, 거기에 따른 고발조치는 있을 겁니다.""  시는 또 조사결과 토양오염이 확인되면 토지 소유주인 LH측에 추가 행정처분을 내릴 방침이라고 밝혔습니다.  MBN뉴스 이병주입니다.[ freibj@mbn.co.kr ]  영상취재 : 유용규 기자  영상편집 : 이우주▶MBN의 실시간 방송을 고화질로 즐겨보세요▶MBN의 밀착취재! <ON마이크>< Copyright ⓒ MBN(www.mbn.co.kr) 무단전재 및 재배포 금지 >"
