,date,newsSource,newsLink,newsText
130,2019-03-26,연합뉴스,https://news.naver.com/main/read.nhn?mode=LSD&mid=shm&sid1=100&oid=001&aid=0010718630,"'막말 논란'에 ""저질발언에 경박하고 천박""…與 일부도 ""발언 신중해야""(서울=연합뉴스) 김연정 김효정 정빛나 기자 = 김연철 통일부 장관 후보자에 대한 국회 외교통일위원회의 26일 인사청문회에서 여야는 김 후보자의 과거 SNS '막말' 시비와 대북정책을 중심으로 한 이념편향성 논란을 두고 공방을 벌였다.선서하는 김연철 후보자(서울=연합뉴스) 이진욱 기자 = 김연철 통일부 장관 후보자가 26일 국회 외교통일위원회에서 열린 인사청문회에서 선서하고 있다. 2019.3.26 cityboy@yna.co.kr    김 후보자는 과거 ""박왕자 씨 피격은 통과의례"", ""남한의 NLL(북방한계선) 고수가 철회돼야 한다"", ""(천안함 사건의 후속 조치인) 5·24 제재는 지나친 대응이었다"" 같은 발언을 한 사실이 알려져 논란이 일었다.    여당인 더불어민주당은 정책검증 위주 질의를 이어가며 김 후보자를 엄호한 반면 문재인 대통령에게 이미 내정 철회를 요구한 제1야당 자유한국당은 김 후보자의 과거 발언, 이념편향성 문제를 집중적으로 거론하며 '자격 미달'이라고 몰아세웠다.    민주당은 이날 한국당의 총공세에 맞서기 위해 이해찬·박병석·진영 의원을 최재성·윤후덕·박경미 의원으로 바꿔 투입했다.    김 후보자는 자신의 과거 발언에 대한 공격을 예상한 듯 청문회 시작부터 ""마음의 상처를 준 부분에 대해 해당되는 분들께 깊은 사과 말씀을 드린다"", ""부적절한 표현을 깊이 반성한다""고 연신 고개를 숙였으나, 한국당과 바른미래당, 민주평화당 등 야당은 정도의 차이는 달랐으나 비판적 추궁을 지속했다.     한국당 정진석 의원은 ""장관이 되기에 턱없이 자질이 부족하다. 세상을 향해 내뱉는 언사가 거칠고 분노에 차 있다. 욕설에 가까운, 육성으로 옮기기 민망한 표현으로 일관하고 있다""며 ""저질 발언에 욕설에 가까운 경박하고 천박한 언사를 일삼았다""고 비판했다.     정 의원은 또 ""통일부 장관 후보자로서 북한을 대하는, 남북문제에 임하는 시각과 인식이 너무 북한편향""이라고 덧붙였다.바른미래당 정병국 의원은 금강산 관광객인 고(故) 박왕자 씨 피격 사건과 관련한 김 후보자의 글을 인용한 뒤 ""이 책 내용대로면 우발적 사고라는 건데 정부 발표를 부정하나. 이거야말로 북한 대변인 역할""이라며 ""이런 분이 통일정책, 남북정책을 총괄하는 장관으로서 가능하다고 보나""라고 쏘아붙였다.     정 의원은 인사청문회 증인 채택이 불발된 박왕자 씨 아들의 녹음을 공개하기도 했다.     박 씨의 아들은 ""진상규명과 재발방지를 원한다. 언론에 나왔던 일은 (김 후보자가) 어떤 사고와 의식을 갖고 그런 말을 한 건지, 저희 어머니 일을 앞으로 어떻게 처리해 갈 것인지 궁금하다""고 밝혔다.     이에 김 후보자는 ""유족에 대해 깊은 애도를 표한다""며 ""비극적 사건이 다시 없도록 재발 방지가 중요하다고 생각한다""고 답변했다.    민주평화당 천정배 의원은 ""'천안함, 연평도 사건은 우발적 사건이다' 등과 같은 발언은 경거망동이고 지나치게 북한 편향 인식을 가진 것으로 비판받아도 마땅하다""고 지적했다.    천 의원은 특히 ""천안함 사건 초기 6∼7년간 폭침설에 대해 의문을 제기하고 추가 조사 필요성을 제기해놓고, 문재인 정부 출범 후 돌변해 인식이 바뀌었다""고 짚었다.    반면 민주당 이석현 의원은 ""김 후보자는 청와대 인사검증 위배 기준 7가지 중 어디 하나에도 해당 안 되는 깨끗한 후보로, 전문성을 볼 때도 남북관계를 이렇게 투철하게 연구한 분이 또 있을까 싶다""고 말했다.    같은 당 원혜영 의원도 ""김 후보자는 이념에 갇혀 있지 않고 창의적이고 능동적인 한반도 문제 해법을 다각적으로 모색하는 실용주의자""라고 치켜세우고 ""후보자는 남북관계 발전과 평화공존, 공동번영을 위한 정책을 추진할 최고 전문가""라고 엄호했다.질의 듣는 김연철 통일부 장관 후보자(서울=연합뉴스) 이진욱 기자 = 김연철 통일부 장관 후보자가 26일 국회 외교통일위원회에서 열린 인사청문회에서 의원들의 질의를 듣고 있다.  cityboy@yna.co.kr    또 송영길 의원은 막말 논란과 관련, ""SNS 특성상 문제가 생길 수 있지만, 통일장관은 남북관계 모든 것을 고려해야 될 중요한 위치인 만큼 신중히 발언해야 한다""고 조언했다.     청문회에서는 김 후보자 부부의 부동산 차명 거래 의혹, 김 후보자 부인의 다운계약서 작성 의혹 등 도덕성 문제도 도마 위에 올랐다.    한국당 유기준 의원은 ""김 후보자가 1999년 서초동 아파트 분양권에 당첨돼 20일 만에 전매하고 이를 종잣돈으로 한 달 만에 방배동 아파트를 매수했고, 이 아파트를 2003년 4월 11일에 시세차액 없이 7천500만원에 되팔았다""며 ""이는 막대한 프리미엄을 노린 투기로, 김 후보자가 습관적으로 다운계약서를 작성해왔다""는 의혹을 제기했다.    같은 당 김재경 의원은 ""부동산 차명 거래 여부를 밝히기 위해 후보자 처제를 증인으로 신청했는데 여당이 거부했다""며 ""혐의가 있을 경우 고발이라는 불가피한 수단을 강구하지 않을 수 없다""고 했다.    한편 청문회에 앞서 여야는 박왕자 씨 아들의 증인 채택 문제를 놓고 공방을 벌였다.     정병국 의원은 ""여당이라고 후보자를 감싸는 건 옳지 않다""며 증인채택 불발에 유감의 뜻을 밝혔고, 민주당 이수혁 의원은 ""후보자의 능력·자질 검증과 관계없다는 결론을 내렸다. 청문회는 개인 신상털기 목적이 아니다""라고 말했다.    yjkim84@yna.co.kr▶네이버 홈에서 [연합뉴스] 채널 구독하기▶뭐 하고 놀까? #흥  ▶쇼미더뉴스! 오늘 많이 본 뉴스영상"
131,2019-03-26,머니투데이,https://news.naver.com/main/read.nhn?mode=LSD&mid=shm&sid1=101&oid=008&aid=0004194208,"[머니투데이 이건희 기자] [LPG차 구매·개조·중고매매 모두 가능해져…충전인프라 우려도 커져] 택시, 렌터카, 장애인용 등 용도가 한정된 액화석유가스(LPG) 차량을 26일부터 누구나 구입할 수 있게 됐다. 규제 완화로 LPG차가 2030년까지 80만대 가량 늘어날 거란 전망에 업계는 즉각 LPG차 일반판매 모델을 내놓는 등 분주하게 움직이고 있다. 26일 업계, 산업통상자원부에 따르면 수송용 LPG연료의 사용제한을 폐지하는 '액화석유가스의 안전관리 및 사업법' 일부개정법률이 이날 공포·시행됐다. 초미세먼지 주요 원인으로 꼽히는 질소산화물(NOx) 배출량이 상대적으로 적은 LPG차 보급을 확산하려는 취지다. 법 개정으로 △소형(1600cc 미만) △중형(1600~2000cc미만) △대형(2000cc 이상) 승용차에 LPG 연료 사용이 전면 허용됐다. 이에 오늘부터 일반인이 모든 신규·중고 LPG 차를 자유롭게 매매할 수 있게 됐다. 자동차 구조변경업체에서 기존에 보유한 휘발유차나 경유차를 LPG차로 개조하는 것도 가능해졌다.자동차 업계는 법 개정을 반겼다. 규제완화로 LPG차 판매량의 증가를 기대하고 있다. 한국자동차산업협회와 산업부에 따르면 지난해 약 204만대 등록된 LPG차의 숫자는 2030년까지 282만대 수준까지 늘어날 것으로 보인다. 10년 동안 약 80만대 정도 증가할 수 있다는 것이다. 국내 주요 완성차 업체들은 LPG차 일반판매에 즉각 나서는 모양새다. 주력 차종의 일반판매 모델을 내놓거나 신차 개발에도 LPG 일반판매 모델을 함께 준비하고 있다. 가장 발빠르게 움직인 건 르노삼성자동차다. 르노삼성은 LPG차 규제가 공식적으로 풀린 이날 세단인 SM6와 SM7 일반판매를 시작했다. 가격은 2000만원대로 책정됐다. 르노삼성 측은 SM6 LPG 모델의 경우 동일 배기량 가솔린 모델 대비 약 130만원~150만원 정도 낮은 가격이라고 알렸다. LPG차의 단점으로 꼽히던 트렁크 공간 활용성을 개선한 '도넛 탱크' 기술도 르노삼성이 속도를 낸 이유다. 르노삼성은 트렁크 바닥 비상용바퀴 자리에 도넛 모양 탱크를 넣어 공간을 기존 LPG차보다 40% 더 확보한 기술을 앞서 도입했다. 르노삼성자동차 SM7 LPG 모델에 탑재된 '도넛 탱크'. /사진제공=르노삼성여기에 아직 LPG차로는 출시되지 않은 SUV(다목적스포츠차량) 모델도 르노삼성이 준비하고 있다. 회사 관계자는 ""올해 상반기 QM6 LPG 모델 출시를 준비 중""이라며 ""규제 완화로 일반 소비자들의 LPG차 필요가 생길 것으로 예상한다""고 말했다. 최근 신형 쏘나타를 출시한 현대자동차도 조만간 LPG 일반판매 모델을 내놓기 위한 준비를 진행 중이다. 현대차는 차량 내 트렁크 공간도 확보하기 위해 이 모델에 도넛 형태의 탱크를 탑재할 예정이다. 기아차 역시 지난 12일 내놓은 2020년형 K5의 LPG 일반판매 모델 출시를 검토 중이다. 규제 완화 전 상황에 맞는 LPG 모델은 이미 출시했다. 당시 가격은 휘발유·경유 모델보다 상대적으로 저렴한 1900만원~2000만원대 중반으로 책정됐다.  그러나 LPG 보급을 장려하는 만큼 충전 인프라는 부족하다는 지적도 나온다. 전국 LPG 충전소는 1948곳으로 주유소 1만1540곳에 대비해 6분의 1 수준이다. 서울 LPG 충전소는 77곳(주유소 501곳)에 불과하다. 이런 문제를 고려할 때 LPG차 수요가 폭발적이 아닌 완만한 증가세를 보일 거라는 분석도 있다. 한 업계 관계자는 ""법 개정만으로 LPG차가 획기적으로 늘어나기는 어렵다""면서 ""소비자들은 휘발유·경유와 다른 LPG차의 경제성을 고려할 텐데 그런 이들을 사로잡을 경쟁력 있는 제품과 충전 인프라가 필요하다""고 지적했다.이건희 기자 kunheelee@mt.co.kr▶버닝썬 게이트▶조 변호사의 가정상담소 ▶'청담동 주식부자' 이희진 부모 피살 <저작권자 ⓒ '돈이 보이는 리얼타임 뉴스' 머니투데이, 무단전재 및 재배포 금지>"
132,2019-03-26,머니투데이,https://news.naver.com/main/read.nhn?mode=LSD&mid=shm&sid1=102&oid=008&aid=0004194167,"[머니투데이 세종=문영재 기자] [교육과정평가원, '2020학년도 수능시행 기본계획' 확정·발표] 사진=뉴스1올해 치러질 대학수학능력시험(수능)에서는 지난해와 마찬가지로 지진 발생에 대비해 예비문항이 별도로 마련된다.수능 출제기관인 한국교육과정평가원(평가원)은 26일 이런 내용의 '2020학년도 수능시행 기본계획'을 확정·발표했다. 올해 수능은 11월14일 목요일에 시행된다. 성적은 12월4일 수요일 수험생들에게 일제히 통보된다.평가원은 지난해와 같이 수능일 전후 지진 발생에 대비해 교육부와 협의를 거쳐 예비문항을 준비하기로 했다. 전 영역에 걸쳐 예비 문제를 마련할 경우 비상상황이 발생하더라도 1~2주 안에 시험을 다시 치를 수 있기 때문이다.출제 방향과 내용은 전년도와 동일하다. 영어·한국사 영역은 절대평가로 치러진다. 필수화 취지에 따라 한국사 미응시자는 수능 성적 전체가 무효 처리되며 성적통지표가 제공되지 않는다.교육방송(EBS) 수능 교재·강의와 수능 출제의 연계도 전년과 같이 영역·과목별 문항 수 기준으로 70% 수준이 유지된다. 영어영역의 경우 학생들이 한글 해석본을 암기하는 문제를 해소하기 위해 2016학년도부터 적용했던 EBS 연계방식을 올해에도 유지키로 했다.오는 11월 본수능의 출제 방향과 난이도를 점검할 수 있는 수능 모의평가는 6월4일 화요일과 9월4일 수요일 시행된다. 성기선 평가원장은 ""학생들이 학교교육을 충실히 받고 EBS 연계 교재와 강의로 보완하면 문제를 해결할 수 있는 수준으로 출제할 계획이다.평가원은 이를 위해 전 영역·과목에 걸쳐 2009 개정 교육과정의 내용·수준에 맞춰 출제하고 수능이 끝난 후 문항별 성취기준 등 교육과정 근거를 공개키로 했다.세종=문영재 기자 jw0404sh@mt.co.kr▶버닝썬 게이트▶조 변호사의 가정상담소 ▶'청담동 주식부자' 이희진 부모 피살 <저작권자 ⓒ '돈이 보이는 리얼타임 뉴스' 머니투데이, 무단전재 및 재배포 금지>"
133,2019-03-26,이데일리,https://news.naver.com/main/read.nhn?mode=LSD&mid=shm&sid1=105&oid=018&aid=0004338447,"4월 1일부터 가입 받아..일과후 데이터 사용량 등 고려이동통신 3사 병사전용 요금제 현황. 과학기술정보통신부 제공[이데일리 이재운 기자] 일반 병사에 대한 일과후 휴대전화 사용 전면확대에 따라 이들을 위한 전용 요금제 계획이 마련됐다.26일 과학기술정보통신부와 국방부는 일과 후 휴대전화 사용 시범운영이 모든 병사들로 확대되는 다음달 1일에 맞춰 현역 병사를 대상으로 하는 전용 요금제를 통신사들이 신고 완료했다고 밝혔다.이에 따라 현역 병사들은 현재의 고가 요금제에 가입하지 않아도 비교적 저렴한 요금(3만원대)으로 음성·데이터를 무제한(기본제공량 소진 후 속도제어) 사용할 수 있게 된다.그 동안 국방부는 ‘일과시간 후 휴대전화 사용’ 시범사업을 지난해 4월부터 시행하면서, 제한된 시간만 사용하되 자기계발을 위한 충분한 데이터가 요청되는 등 병영생활의 특성이 반영된 전용 요금제의 필요성을 제기해 왔다.이에 따라 과기정통부와 국방부, 통신사 등은 지난해 12월부터 협의를 시작해 전용 요금제를 마련했다.우선 이통3사는 병사들의 이용가능 시간, 경제적 능력과 전용 요금제 신설 취지를 고려해 3만원대에서 음성 및 데이터 기본제공량 소진 후에도 추가 부담없이 일정한 속도로 무제한 이용할 수 있는 요금제를 출시할 예정이다. 특히 장병들이 입대 전에 사용하던 본인 단말을 그대로 이용하는 경우 25% 선택 약정할인을 받게 되면 2만원대 이용이 가능해진다.알뜰폰 사업자는 9900원부터 시작해 보다 저렴한 요금구간에서 특화된 서비스를 제공할 예정이다. 참여사는 큰사람, 세종텔레콤, 코드모바일, 프리텔레콤, 머천드코리아, 위너스텔, 에넥스텔레콤, 인스코비, 에스원 등 9개 업체다.병사 전용 요금제에 가입을 원하는 경우, 4월 1일부터 통신사 대리점 및 고객센터 등을 통해 현역 병사 신분을 증명할 수 있는 구비서류(입영통지서, 입영사실확인서, 병적증명서 등)를 제출하면 가입할 수 있다.이러한 병사 전용 요금제를 통해 병역의 의무를 수행하고 있는 현역 장병들의 통신비 부담 경감 지원은 물론 사회와의 소통 확대 및 자기개발 활성화에 기여함으로써 자율적인 병영문화 정착과 사회와 군대 간의 정보 격차(Digital Divide) 해소에 크게 이바지할 것으로 정부 당국은 기대하고 있다.이재운 (jwlee@edaily.co.kr)총상금 1050만원, 사진 공모전 [나도 사진 기자다▶]이데일리 [구독하기▶] , 청춘뉘우스~ [스냅타임▶]＜ⓒ종합 경제정보 미디어 이데일리 - 무단전재 & 재배포 금지＞"
134,2019-03-26,뉴스1,https://news.naver.com/main/read.nhn?mode=LSD&mid=shm&sid1=102&oid=421&aid=0003901094,"인구 100만 이상 도시 특례시 부여김부겸 행정안전부장관(왼쪽 세번째)이 지난 14일 서울 여의도 국회 의원회관에서 열린 지방분권 및 주민참여 강화 관련 당정청협의에서 발언하고 있다. 2019.3.14/뉴스1 © News1 이종덕 기자(서울=뉴스1) 이재상 기자 = 지방의원의 윤리성과 책임성을 제고하기 위한 '윤리특별위원회' 설치가 의무화 되는 등 '지방자치법'이 전부 개정된다. 인구 100만이상 대도시에 대해서도 '특례시' 명칭을 부여해 자치행정과 재정 분야에서 폭넓은 재량권을 준다.행정안전부는 '지방자치법 전부개정법률안'이 26일 제12회 국무회의에서 의결돼 국회 제출을 앞두고 있다고 발표했다.정부는 지난해 10월30일 '제6회 지방자치의 날'을 통해 1988년 이후 30년 만에 지방자치법을 전부개정한다고 발표한 바 있다. 이후 입법예고, 법제처 심사, 관계 중앙행정기관과의 협의 등을 거쳐 지방자치법 전부개정법률안을 마련했다.지방자치법 전부개정법률안의 주요 내용으로는 Δ주민참여권 보장 및 주민참여제 실질화 Δ주민의 실질적인 자치권 확대 Δ자율성 강화 관련 투명성·책임성 확보 등이다. ◇ 주민참여권 보장 및 주민참여제도의 실질화정부는 지방자치법에 부족했던 '주민자치' 요소를 법 목적규정과 주민의 권리조문에 명시함으로써 강화했다. 이전까지는 중앙-지방간의 '단체자치'가 중심이었다.주민이 의회에 직접 조례를 발의할 수 있는 '주민조례발안제'를 도입해 주민조례발안, 주민감사, 주민소송의 기준연령을 19세에서 18세로 하향 조정해 폭넓은 주민참여를 촉진한다.자치단체의 기관구성 형태도 인구규모·재정여건 등에 따라 주민투표로 선택할 수 있게 해 주민의 선택권을 보장한다.정부는 이번 지방자치법 개정을 통해 근거만 마련하고, 국민적 공감대와 여건 성숙도 등을 감안해 구체적 기관구성 유형 및 필요 사항은 추후 별도의 법률로 규정할 예정이다.더 나아가 주민이 주도해 마을의제를 수립하고 선정된 마을계획을 이행할 수 있도록 지원하는 풀뿌리 주민자치기구인 '주민자치회'의 설치·운영에 관한 사항을 규정하고 자치단체의 지원근거도 마련한다.◇자치단체가 주민을 위해 일할 수 있는 실질적인 자치권 확대이번 전부개정안을 통해 정부는 중앙의 자의적인 사무배분을 막기 위해 보충성, 불경합성, 자기책임성의 사무배분 원칙을 명확화하고 국가와 자치단체의 준수의무를 부여한다.또 급증하는 행정수요에 탄력적으로 대응할 수 있도록 기존 법정 부단체장 외에 특정 업무를 수행하는 시·도 부단체장 1명(인구 500만 이상 2명)을 필요시 조례를 통해 자치단체가 둘 수 있도록 했다. 이를 통해 시·도 부단체장 직위 설치의 자율성을 강화한다는 방침이다.지방의회의 자율성과 역량도 개선한다. 시도지사가 가지던 시도의회 사무직원의 임용권을 시도 의회의장에게 부여해 의회사무처 운영의 독립성을 보장한다. 2018.12.17/뉴스1 © News1 민경석 기자◇ 자율성 강화에 상응하는 투명성·책임성 확보지방자치법을 통해 자율성이 커지는 만큼 이에 상응할 수 있는 투명성, 책임성 확보에 나선다. 먼저 지방의원의 윤리성과 책임성을 제고하기 위한 '윤리특별위원회' 설치를 의무화한다. 현재는 설치 여부가 재량적 판단에 달려 있었다. 민간위원으로 구성된 윤리심사 자문위원회를 설치하고 의원에 대한 징계 등을 논의할 때 의무적으로 의견을 수렴하도록 한다.또 위법한 사무처리로 인해 주민이 피해를 입지 않도록 국가가 시군구의 위법한 사무처리에 대해 보충적으로 시정·이행명령을 할 수 있도록 법적 근거를 마련한다.◇ 중앙-지방 협력관계 정립 및 자치단체 사무수행 능률성 향상대통령과 시도지사 간 간담회를 제도화하기 위해 '중앙-지방협력회의' 설치를 위한 법적 근거를 마련하고, 별도법 제정을 추진한다.아울러 교통이나 환경 등 광역적 행정수요에 효과적으로 대응할 수 있도록 자치단체 간 협력 활성화를 위한 중앙의 지원 근거를 마련하고, 특별지자체 설치·운영 등에 관한 법적 근거를 구체화한다는 계획이다.더 나아가 인구 100만이상 대도시에 대해서 '특례시' 행정적 명칭을 부여해 대도시에 대한 특례부여 촉진 등을 유도한다.김부겸 행정안전부 장관은 ""지방자치법 전부개정을 통해 자치분권의 최종 결실이 주민에게 돌아감으로써 국가의 새로운 성장과 발전으로 이어질 수 있도록 하겠다""고 말했다.한편 25일 국무회의에서 의결된 지방자치법 전부개정법률안은 곧 국회에 제출돼 본격 논의될 예정이다.alexei@news1.kr▶ [ 크립토허브 ]  [ 터닝포인트 2019 ] ▶ 네이버 메인에서 [뉴스1] 구독하기![© 뉴스1코리아(news1.kr), 무단 전재 및 재배포 금지]"
