,date,newsSource,newsLink,newsText
0,2019-03-13,MBC,https://news.naver.com/main/read.nhn?mode=LSD&mid=shm&sid1=101&oid=214&aid=0000931773,"[뉴스데스크]◀ 앵커 ▶시청자들의 소중한 제보로 만드는 '당신이 뉴스입니다'.ELS, ELT, 사모펀드 한번씩은 들어 보셨겠지만 이런 금융 상품들 종류도 워낙 많고 수익 구조도 복잡하다 보니까 은행 설명을 들어도 이해하기 쉽지 않은 게 사실입니다.그런데 올해 팔순인 할머니가 은행이 시키는대로 이름도 어려운 고위험 투자상품 수십 개에 전 재산 수억 원을 투자했다는 제보가 들어왔습니다.강나림 기자가 대체 무슨 일인지 직접 확인해봤습니다.◀ 리포트 ▶최태영 씨는 지난달 우연히 어머니의 은행 계좌를 들여다보고 화들짝 놀랐습니다. 특정금전신탁 ETF, ELS, 증권투자신탁, 전문사모펀드, 변액보험…10개가 넘는 금융상품에 가입했는데 모두 원금보호가 안 되는 위험등급 1등급.전 재산인 예금 4억5천만 원 가운데 95%가 넘는 4억 3천만 원이 초고위험상품에 묶여있었습니다.[최태영]""제가 이걸 보고 너무 어이가 없어가지고…총 자산 중에 예금자보호법으로 적용받는 건 입출금통장에 7백9만8천 원.""최 씨 어머니의 나이는 올해 팔순.현재 투자하는 상품만 13개, 이전에 했던 것까지 합치면 서른 개가 넘습니다.지난해엔 1월 ETF 두 개 2월과 3일에 각각 ETF 한 개씩, 4월과 5월에 ELS와 투자신탁 상품 등 거의 한 달에 한 번꼴로 가입했는데 이 모든 상품을 우리은행 지점 한 곳에서 판매했습니다.들어도 무슨 말인지는 모르지만 은행 직원이 어련히 잘해주겠거니 했다는 겁니다.[노00]""그쪽에서 뭐라고 뭐라고 하는데 그냥 네네만 하라고 해서 뭐가 뭔지도 모르고 그냥 네네네 하고 끝나는 거예요. 친절하게 잘 하니까 믿어야지 하고 한 거지.""잘 모르는 노인한테 어떻게 이런 무리한 투자를 권하느냐고 아들인 최 씨가 따지자, 은행 직원은 이득도 봤다고 반박했습니다.그럼 수익이 얼마나 났는지 그간 가입했던 투자상품의 원금과 수익률을 알려달라고 하자, 그건 또 알려줄 수 없다고 합니다.[우리은행 직원]""(투자) 이력 조회는 여기서 내부자료는 드릴 수 없어요. 자료를 다시 다 뽑아야해요. 고객님한테 제공해드릴 수는 없어요.""우리은행은 금융감독원 결정이 나오면 얘기하자는 입장만 되풀이하고 있습니다. 그러면서 최 씨 때문에 도저히 업무를 할 수 없다고 타박합니다. [우리은행 직원]""제가 이것 때문에 지금 노이로제가 걸릴 지경이에요. 고객님, 지금 오셔서 몇 시간째인 줄 아세요? 저희가 일을 못해요.""자식 생각에 평생을 아껴 모은 재산인데, 팔순 노모가 무슨 큰 욕심에 투자에 나섰겠냐고 이러다 큰 손해라도 나면 누가 책임지는 거냐고 최 씨는 묻습니다.[최태영]""저도 50인데 제가 봐도 이거 헷갈리고 어려워요. 하물며 어르신들은 어떠시겠어요. 당신 어머니한테는 이런 투자 하신다고 하면 권하시겠냐 했더니 유구무언이죠. 말을 못하죠.""MBC뉴스 강나림입니다. 강나림 기자 (allin@mbc.co.kr)[저작권자(c) MBC (http://imnews.imbc.com) 무단복제-재배포 금지]▶ 네이버 홈에서 [MBC뉴스] 채널 구독하기▶ [엠빅뉴스] '장자연 사건'의 유일한 목격자, 윤지오 씨의 눈물▶ [14F] 이번 꽃 축제 한방에 정리해드림!Copyright(c) Since 1996, MBC&iMBC All rights reserved."
1,2019-03-13,KBS,https://news.naver.com/main/read.nhn?mode=LSD&mid=shm&sid1=102&oid=056&aid=0010680234," [앵커] 미세먼지 관련 8개 법안이 오늘(13일) 국회 본회의를 통과했습니다. 수도권 공장들에만 적용하던 '먼지 배출 총량제'를 전국으로 확대하는 안도 이번에 문턱을 넘었습니다. 지금까지 수도권 이외 지역의 민간 사업장에는 미세먼지의 농도만 규제를 해왔는데 앞으로는 배출량을 제한하게 됐습니다. 이 민간 사업장들은 미세먼지 배출량이 많은 석탄화력발전소 못지 않게 미세먼지를 많이 내뿜습니다. 하지만 이번 규제도 실시간 배출감시 장치가 달린 큰 공장에만 해당할 뿐입니다. 김소영 기자가 취재했습니다. [리포트] 이 공단엔 중소 규모 공장 700여 개가 밀집해 있습니다. 가까이 다가가기만 해도 메케한 냄새가 코를 찌릅니다. [환경부 단속반원 : ""방지시설이 어디가 샌다든가 아니면  설치가 미흡하다는 거거든요.""] 굴뚝 배출 가스를 측정하는 감시 장치도 없습니다. 전국 민간 사업장의 1%, 대규모 공장에만 실시간 감시 장치가 설치돼 있습니다. 이런 작은 공장들은 오염 수치를 자체 측정해 자치단체에 보고하기만 하면 됩니다. [이영성/환경부 대기관리과 서기관 : ""관리 인원이 시·도에서 굉장히 부족하다고 지금 호소를 하고 있고. 소규모 사업장이 많다 보니까 인력으로 관리하는 데는 한계가 있어요.""] 환경부가 지난달 출범한 드론 감시팀입니다. 드론에 붙은 센서를 이용해 실시간으로 오염물질을 측정합니다. 이상 반응이 나타나면 굴뚝에서 시료를 직접 채취해 단속 차량에서 바로 분석합니다. [드론 감시팀 단속반원 : ""톨루엔이라든지 자일렌 같은 물질들이  해당 산단 지역 상공에서  높게 검출되고 있습니다.""] 새로운 기술과 시스템이라지만, 실제로는 유명무실합니다. 드론 감시팀이 운영하는 드론은 전국에 단 두 대뿐입니다. [유현숙/수도권대기환경청 기획과장 : ""아직은 2월에 발족된 상황이기 때문에  완벽한 팀은 구성되지 않았지만  6월 말 정도까지는 저희가 드론도  2세트 더 구매할 거고.""] 감시 장치가 없는 오염물질 배출 사업장은  전국에 5만 8천여 곳. 그 가운데 2만 곳 이상은 지난해 단 한 번도 점검을 받지 않았습니다. KBS 뉴스 김소영입니다.김소영 기자 (sos@kbs.co.kr)▶ [만세 지도] 우리 동네 3.1운동 현장은?▶ 네이버 채널 KBS뉴스 구독! 시원하게 털어드립니다▶ ‘TV보다 ㄹㅇ’ 당신의 진짜 뉴스 ‘케이야’"
2,2019-03-13,한국일보,https://news.naver.com/main/read.nhn?mode=LSD&mid=shm&sid1=104&oid=469&aid=0000371751,"EU에 탈퇴 연기 요청 가능성 높아… 집권당 조기총선 거론영국 하원이 12일 브렉시트 수정합의안을 표결하는 가운데, 테리사 메이(가운데) 총리가 의회에서 연설하고 있다. 이날 두번째 브렉시트 합의안 표결이 또 부결되자, 메이 총리는 즉각 “실망”이라고 입장을 밝혔다. 런던=AP 연합뉴스노 딜이냐, 연기냐, 아니면 총선이냐. 영국 브렉시트(영국의 유럽연합 탈퇴) 수정합의안이 12일(현지시간) 또다시 부결되면서 영국이 다시 한번 혼란에 빠졌다. 하원은 13일 아무런 합의 없이 EU를 떠나는 ‘노 딜’(no deal) 브렉시트 여부, 14일에는 ‘브렉시트 시기 연기’ 여부에 대해 각각 투표에 나선다. 워낙 상황이 유동적이지만 현재로서는 일단 ‘노 딜’을 피하고 탈퇴 시점이 연기될 가능성이 높다. 그러나 그렇게 돼도 혼란을 잠시 피할 뿐 그 이후가 더 문제라는 지적이 나온다.12일 2차 투표에서 하원은 149표 차이(반대 391표ㆍ찬성 242표)로 테리사 메이 총리의 합의안을 부결시켰다. 이번에도 발목을 잡은 건 안전장치(백스톱) 조항. 지난 1월 중순 1차 투표에서 브렉시트 강경파들은 백스톱 때문에 영국이 영구적으로 관세동맹에 갇힐 수 있다며 반대표를 던졌고, 이에 메이 총리는 재협상을 통해 영국이 원할 경우 일방적으로 종료할 수 있다는 수정안을 내놨다. 1차와 달리 가결 가능성이 점쳐지는 듯 했으나, 투표 직전 제프리 콕스 법무장관이 “영국이 유럽연합(EU) 동의 없이 합법적으로 백스톱에서 빠져나올 방법은 없다”는 법률 검토 결과를 내놓으면서 상황이 반전됐다. 메이 총리가 의회 설득에 또다시 실패해 정치력에 타격을 입으면서, 앞으로 브렉시트 향방은 의회 결정에 의해 좌우될 전망이다. 합의안 도출에는 실패했지만, 주요 외신들은 29일 예정대로 ‘노 딜 브렉시트’가 이뤄질 가능성은 낮은 것으로 보고 있다. 보수당 내 일부 강경파를 제외하고는 영국 정가에서 노 딜이 ‘최악의 시나리오’라는 공감대가 형성돼있다는 설명이다. 따라서 13일 투표를 통해 ‘노 딜’ 브렉시트를 선택지에서 제거하고, 다른 방안을 모색하기 위해 14일 투표에서 EU에 연기 요청을 할 가능성이 높다. 이와 관련 메이 총리는 투표를 앞둔 13일 하원에서 열린 총리 질의응답에서 “나는 좋은 합의안을 가지고 EU를 떠나고 싶다”며 ‘노 딜’에 반대표를 던질 것임을 분명히 했다. EU도 수십억 파운드의 재정분담금을 추가로 요구할 수는 있겠지만, 연기 요청 자체를 거부하지는 않을 것이라는 전망이다. 문제는 이렇게 시간을 번다고 한들 의회 다수 지지를 얻을만한 합의안을 만드는 게 어려울뿐더러, EU가 추가 협상에 응할지도 알 수 없다는 점이다. 장클로드 융커 EU집행위원장이 이미 “세 번째 협상은 없다”며 강경한 자세를 보였고, 부결 직후에도 EU는 브렉시트 재협상은 없을 것이라며 선을 그었다. 물론 메이 총리가 ‘노 딜’을 우려하는 보수당 내 온건파 및 노동당과 공조해 ‘소프트 브렉시트’ 안을 마련할 가능성도 없지는 않다. 대표적으로 언급되는 게 EU에서는 탈퇴하되 유럽자유무역연합 회원국으로 남아 경제협력은 유지하는 ‘노르웨이 모델’이다.영국 정치권에서는 조기총선도 유력한 방안으로 대두되고 있다. 브렉시트 방안을 두고 의회가 사분오열 하니 ‘협상안’ 대신 아예 ‘정치판’ 자체를 새로 짠다는 발상이다. BBC는 “집권당 내부에서도 조기총선 얘기가 오가고 있다. 의원들이 메이 총리의 사임을 요구할 수도 있다”고 전했다. 제1야당인 노동당의 제러미 코빈 대표 역시 부결 직후 “합의안에 명백히 사망선고가 내려졌다. 메이 총리는 단지 시간을 끌고 있다”면서 조기 총선을 요구했다. 한편 2차 국민투표에서 브렉시트 '철회' 여부를 물을 가능성도 제기되고는 있지만 실현 가능성은 낮다. 앞서 메이 총리는 여러 차례 2차 국민투표에 대한 거부 의사를 밝힌 바 있다. 안토니오 타이아니 유럽의회 의장도 “브렉시트를 최대한 연기하더라도 7월 초까지만 가능할 것”이라고 입장을 밝힌 만큼, 3개월이라는 짧은 시간 내 국민투표를 다시 실시하기는 어려울 전망이다.최나실 기자 verite@hankookilbo.com.▶한국일보 [페이스북] [카카오 친구맺기]▶네이버 채널에서 한국일보를 구독하세요!"
3,2019-03-13,SBS,https://news.naver.com/main/read.nhn?mode=LSD&mid=shm&sid1=102&oid=055&aid=0000716798,"<앵커>엊그제(11일) 광주 법정에 섰던 전두환 씨 곁에는 신뢰관계인 자격으로 부인 이순자 씨가 앉아 있었습니다. 이순자 씨는 법정에서는 별다른 말은 하지 않았는데 대신 꽤 두툼한 편지 1통을 재판장에게 건넸습니다.그 편지의 내용을 장민성 기자가 취재했습니다.<기자>재판 내내 전두환 씨 옆에서 신뢰관계인으로 자리를 지켰던 부인 이순자 씨는 별다른 공개발언은 하지 않았습니다.대신 재판이 끝나갈 무렵 돌연 편지 1통을 재판부에 제출했습니다.전 씨의 변호인도 예상 못 했던 일이었습니다.컴퓨터로 작성된 6장의 편지에는 먼저 재판의 발단이 된 회고록 집필 경위가 담겼습니다.1988년 11월 전 씨가 백담사에 머물면서 쓰기 시작해 오랜 기간 전 씨의 구술이나 녹취를 다듬어온 거라고 적었습니다.전 씨가 회고록까지 썼는데 알츠하이머에 걸렸다는 게 말이 되냐는 세간의 비판에 대해 반박한 것으로 풀이됩니다.또 건강상 이유로 재판에 불출석해 죄송하다며 자세를 낮추면서도 故 조비오 신부나 5·18 유족, 광주 시민에 대한 사죄나 유감은 표명하지 않은 것으로 알려졌습니다.특히 ""5·18 당시 헬기 사격은 없었다""며 ""재판장께서 현명하게 판단해 진실을 가려달라""고 거듭 호소했습니다.회고록 내용에 왜곡이 없고 재판 태도 역시 고의적으로 불성실했던 것이 아니라는 점을 강조하기 위한 것으로 보입니다.재판부는 이 편지를 법정 증거로 삼을 방침입니다.검찰은 편지 내용을 검토한 뒤 법리적 주장이 있다면 반박 의견서를 제출할 계획입니다.(영상편집 : 정성훈)   장민성 기자(ms@sbs.co.kr)▶[핫이슈] 클럽 '버닝썬' 전방위 수사▶[핫이슈] '최악의 미세먼지' 전국 비상▶네이버 메인에서 SBS뉴스 구독하기※ ⓒ SBS & SBS Digital News Lab. : 무단복제 및 재배포 금지"
4,2019-03-13,JTBC,https://news.naver.com/main/read.nhn?mode=LSD&mid=shm&sid1=104&oid=437&aid=0000204951,"[앵커]보잉사 여객기 운항을 중단시키는 나라가 계속 늘고 있습니다. 인도와 호주에 이어서 유럽 연합까지 40개 나라가 넘습니다. 5개월여 동안 2번이나 사고가 났기 때문인데, 이제 남은 것은 미국과 캐나다 뿐입니다. 아직은 안전하다고 밝혔지만 자동항법장치를 켜면 갑자기 고도가 낮아지는 문제가 있다는 보고서 내용도 공개됐습니다.백종훈 기자입니다.[기자]'보잉 737맥스 8의 자동항법장치를 켜면 비행기 앞 부분이 갑자기 곤두박질 쳤다.'AP통신 등이 보도한 미 항공우주국의 지난해 보고서 내용입니다.두 사람의 미국 조종사가 이런 결함을 진술했다는 것입니다.사고가 난 에티오피아항공의 최고경영자도 사고직전 조종사가 조종이 어렵다고 했다며 기체결함을 주장했습니다.지난해 10월 인도네시아에서 같은 기종의 비행기가 추락했을 때도 같은 증상이 사고원인으로 지목됐습니다.불안감이 커지자 중국을 시작으로 인도와 호주, 유럽연합 등 대부분 국가에서 이 기종의 운항을 중단시켰습니다.사우스웨스트항공 등 미국과 캐나다의 18개 항공사들만 이 기종을 계속 운항하고 있습니다.뉴욕타임스는 '연방항공청은 머뭇거리지 말라'는 칼럼을 싣고 즉각 이 비행기의 운항을 멈추라고 보도했습니다.미국 소비자단체인 플라이어스라이츠도 미 항공당국이 승객들을 위험에 빠뜨리고 있다고 비판했습니다.(영상디자인 : 신재훈)백종훈(iam100@jtbc.co.kr) [영상편집: 오원석]▶ JTBC 기자들의 시청자 미션 수행? [뉴스 미션] / [뉴스룸 다시보기]▶ 확 달라진 '뉴스APP' 이슈부터 라이브까지 한눈에!Copyright by JTBC(http://jtbc.joins.com) and JTBC Content Hub Co., Ltd. All Rights Reserved. 무단 전재 및 재배포 금지"
5,2019-03-13,SBS,https://news.naver.com/main/read.nhn?mode=LSD&mid=shm&sid1=102&oid=055&aid=0000716781,"증거 인멸 방식까지 구체적으로 설명<앵커>수요일 8시 뉴스는 정준영 씨 소식으로 시작하겠습니다. 저희가 지난 이틀 동안 전해드렸던 단체 대화방 안에서 성범죄와 추악한 이야기를 넘어서 오늘(13일)은 대중의 사랑으로 부와 인기를 거머쥔 연예인들이 우리 사회 공권력과도 유착돼 있다는 의혹을 집중적으로 짚어보겠습니다. 이번 사건에 앞서 지난 2016년 정준영 씨는 여성을 불법 촬영했다는 혐의로 경찰 수사를 받습니다. 결국은 무혐의로 결론 났는데 그 수사가 부실했다는 정황을 입증할 만한 결정적인 자료를 저희 취재진이 입수했습니다. 수사를 해야 할 경찰이 핵심 증거를 없애려 했다는 내용입니다.첫 소식 김지성 기자입니다.<기자>이번 사건을 국민권익위에 처음 신고한 방정현 변호사가 추가 제보를 받았다면서 SBS 끝까지 판다 팀을 만났습니다.[방정현 변호사/권익위 신고자 : 경찰이 (포렌식) 업체 측에 증거를 인멸해 달라고 하는, 증거 인멸을 교사하는 그런 내용이 담긴 녹음 파일이거든요.]지난 2016년 정준영 씨 사건을 수사한 경찰과 사설 포렌식 업체 간 전화 통화를 녹취한 것입니다.전화 통화가 이뤄진 시점은 2016년 8월 22일, 사설 포렌식 업체가 가수 정준영 씨 휴대전화에 대한 포렌식을 한창 진행하던 시점입니다.[2016년 정준영 사건 담당 경찰관 : 성동경찰서 00입니다. 아, 우리가 사건을 하다 보니까 약간 꼬이는 게 있어서, 여기가(정준영 씨가) 000(업체)에 데이터를 맡겨놨다고 그래서요, 시간이 좀 걸리잖아요?][사설 포렌식 업체 측 : 네 그렇죠, 아시다시피 담당자가 휴가 중이라.]포렌식 작업이 끝나지 않았다는 것을 알면서도 경찰은 정준영 씨 휴대전화의 데이터 복원이 불가능하다는 확인서를 써주면 안 되겠냐고 묻습니다.[2016년 정준영 사건 담당 경찰관 : 어차피 본인(정준영 씨)이 시인하니까 시간이 없어서 그러는데 차라리 000(업체)에서 데이터 확인해 본 바, 기계가 오래되고 노후되고 그래서 '데이터 복원 불가'로 확인서 하나 써주면 안 될까 해서요.]구체적인 증거 인멸의 방식까지 조목조목 설명합니다.[2016년 정준영 사건 담당 경찰관 : 그냥 데이터 복구 불가로 해서 확인서 하나 써주면 좋겠는데.]하지만 업체 측은 그런 경찰의 요구를 거부했습니다.[사설 포렌식 업체 측 : 저희도 어쨌든 하는 일이 그런 거라, 절차상 행위는 좀 있어야 되고요, 왜 안 되는지도 얘기해야 되니까, 좀 그렇습니다.]결국 경찰은 이틀 뒤 포렌식 결과를 받아보지 못하고 정 씨 사건을 검찰로 송치했습니다.포렌식 결과는 나중에 따로 송치하기로 했다는 겁니다.취재진이 전화 통화를 했던 경찰관에게 물어봤습니다.이 경찰관은 복원 불가 확인서를 요구한 사실이 없다고 말합니다.[2016년 정준영 사건 담당 경찰관 : (혹시 복원이 어렵다라는, 복원이 불가하다는 확인서를 하나 써달라 요구한 적이 있습니까?) 내가 지금 '복원 불가 확인'이라는 말은 용어도 처음 들어보는 말이고, 담당 수사관이 그런 얘기를 해달라고 사설 업체에다 의뢰한다는 건 말도 안 되죠. (그런 거 요구하면 안 되는 거죠?) 안 되죠. 왜냐면 (포렌식이) 진행 중인데.]전화 녹취의 존재를 나중에 이야기하자 전화 통화한 것은 맞지만, 그런 말을 한 기억은 없다고 말합니다.[2016년 정준영 사건 담당 경찰관 : 내가 통화한 건 맞지만 그렇게까지 그 당시에 할 상황이 아닌데, 그렇죠? 내가 상당히 난처한 입장이 된 거죠? 지금 제가.]이번에 드러난 정준영 씨와 지인들의 디지털 성범죄 행각이 당시 휴대전화에 고스란히 남아 있었지만, 경찰은 끝내 포렌식 결과를 받아보지 않았습니다.[2016년 정준영 사건 담당 경찰관 : (나중에라도 그 포렌식 사설 업체에서 결과를 받으셨어요?) 못 받았죠. (그럼 그 안에 뭐가 들어 있는지 모르겠네요?) 모르죠.][백성문/변호사 : 만약에 (범죄 증거가) 있다는 걸 알고서 그쪽에 없다고 해달라 라고 한다면 그건 증거인멸 문제가 될 수 있는 거고요, 그거는 사실 직무유기나 직권남용도 될 수 있는 부분이기 때문에.]경찰이 당시 포렌식 결과만 제대로 받아봤어도 정 씨의 수많은 디지털 성범죄는 지금보다 훨씬 이전에 낱낱이 공개될 수 있었습니다.(영상취재 : 조창현, 영상편집 : 김종우, VJ : 김준호)▶ 복구 결과 나오기 전 '사건 종결'…'뒷북 수사' 의미 있나(https://news.sbs.co.kr/news/endPage.do?news_id=N1005175359)▶ '몰카 성범죄' 엄벌한다는데…정준영 처벌 수위에 관심(https://news.sbs.co.kr/news/endPage.do?news_id=N1005175461)▶ 강경윤 기자 ""여론까지 움직이는 대형 기획사, 영향력 막강""(https://news.sbs.co.kr/news/endPage.do?news_id=N1005175462)김지성 기자(jisung@sbs.co.kr)▶[핫이슈] 클럽 '버닝썬' 전방위 수사▶[핫이슈] '최악의 미세먼지' 전국 비상▶네이버 메인에서 SBS뉴스 구독하기※ ⓒ SBS & SBS Digital News Lab. : 무단복제 및 재배포 금지"
6,2019-03-13,MBC,https://news.naver.com/main/read.nhn?mode=LSD&mid=shm&sid1=100&oid=214&aid=0000931760,"[뉴스데스크]◀ 앵커 ▶'버닝썬' 사건처럼 마약을 악용한 성범죄가 최근 급증하자 이런 성범죄에 대한 처벌을 대폭 강화하는, 이른바 '버닝썬 법'이 잇따라 발의되고 있습니다. 성범죄 중에서도 특히 악질적인 만큼 가중처벌이 필요하는 겁니다. 오현석 기자가 취재했습니다. ◀ 리포트 ▶강남 '큰 손'들이 많이 찾는다는 클럽 '버닝썬'에서 마약류가 사용된다는 것은 공공연한 비밀이었습니다.여성들에게 마약을 먹인 뒤 성폭행을 했다는 의혹도 끊이지 않고 있습니다.['버닝썬' 피해자] ""제 주량의 정말 조금밖에 미치지 않는 술을 먹고 제가 필름이 끊겼다는 거… (경찰이) '혹시 약물 의심하냐'고 물어봐서 '약물 의심한다'고 얘기했고…""실제로 마약류를 악용하는 성범죄는 최근 급증하는 추세입니다. 성범죄 사건과 관련된 국과수의 마약 감정 건수도 4년 새 2배나 늘었습니다.마약류가 사용된 성범죄는 피해자를 항거불능 상태에 빠트리는데다, 건강도 크게 해칠 수 있어 그 해악이 더욱 큽니다.하지만 법적으론 일반 성폭행 범죄의 형량이 적용돼, 처벌은 징역 2, 3년에 불과합니다.이에 따라 마약류를 이용한 성폭력 사건은 5년 이상의 징역에 처하도록, 처벌을 대폭 강화하는 이른바 '버닝썬 법'이 최근 잇따라 발의되고 있습니다.[박병석/더불어민주당 의원]""(피해자의) 의사와는 전혀 관계없이 피해를 당하게 되는 것입니다. 형벌을 강화함으로써 예방과 그리고 처벌을 함께 이룩하자는 (취지입니다.)""민주당 신경민 의원 역시 마약류를 사용한 성범죄는 물론, 강제로 약물을 섭취하게 한 경우에도, 법정 형량의 2분의 1까지 가중처벌하는 법안을 제출했습니다.MBC뉴스 오현석입니다.오현석 기자 (ohs@mbc.co.kr)[저작권자(c) MBC (http://imnews.imbc.com) 무단복제-재배포 금지]▶ 네이버 홈에서 [MBC뉴스] 채널 구독하기▶ [엠빅뉴스] '장자연 사건'의 유일한 목격자, 윤지오 씨의 눈물▶ [14F] 이번 꽃 축제 한방에 정리해드림!Copyright(c) Since 1996, MBC&iMBC All rights reserved."
