,date,newsSource,newsLink,newsText
0,2019-03-02,SBS,https://news.naver.com/main/read.nhn?mode=LSD&mid=shm&sid1=102&oid=055&aid=0000714185,"<앵커>일제 강점기 강제 징용의 상처가 남은 유산들이 여전히 우리 땅 곳곳에 남아 있습니다. 아픈 역사를 되짚는 교육의 현장으로 보존되어야 할 텐데 이 유산들 오히려 흉물로 방치돼 있습니다.깊이 있게 본다 강민우 기자가 직접 찾아가 봤습니다.<기자>일제강점기 근처 광산에서 캔 광물을 보관했던 전남 해남의 대형 콘크리트 구조물.강제 징용 노동자들이 일하던 광물저장창고시설 내부입니다.이곳에선 이 구멍을 통해 광물을 내린 뒤 바다에 도착한 수송선으로 옮기는 작업이 이뤄졌습니다.이 광산 지역에만 1천 명 넘게 강제 동원됐습니다.[김백운/강제징용 피해자 (징용 당시 16세) : 밥을 줬는데 밥을 못 먹었어. 배고프지만. 왜냐하면, 보리쌀 이런 건 하나도 없어. 수수에다가 껍질 덜 벗긴 걸 줘서… 그런 건 닭이나 돼지나 먹지.]조선 5대 구리광으로 꼽히던 부산 기장군의 한 광산 근처 마을엔 일본식 건축물이 곳곳에 남아 있습니다.일제강점기 시절, 이곳 광산을 관리하던 일본인들이 사무실로 사용했던 건물입니다.이 건물 안쪽을 자세히 살펴보면 일본식 건축 양식이 그대로 남아 있는 걸 찾아볼 수 있습니다.혹독한 근무 환경과 열악한 시설 탓에 당시 강제 징용 노동자들은 대부분 폐 질환으로 세상을 떠났습니다.미쓰비시 중공업 공장 노동자 1천 명이 모여 살았던 이곳의 이름은 아직도 미쓰비시, 삼릉 마을입니다.[송영신/강제징용 피해자 아들 : 죽는 사람도 부지기수였다고 하시고… 팔, 다리 다치고 머리가 깨지고 이러면 붕대조차도 제대로 안 감아주고.]국내 곳곳에 강제동원의 상흔이 그대로 남아 있지만 아픈 역사를 배우려는 모습은 찾기 힘듭니다.해남 저장창고와 폭약 창고 등은 70년 세월 동안 방치돼 여기저기 훼손됐고 기장군 광산마을도 근처 고속도로 개발 여파로 마을 전체가 소음과 분진에 시달리고 있습니다.[최원순/광산마을 이장 : 불법 건축물이니까 (아무것도) 해줄 수가 없다고… 옛날에도 억울하게 억압받고 산동네에….]강제 징용의 아픈 역사를 알려주는 건 표지판 하나가 전부 이마저도 한 대학 연구팀 주도로 만들어진 겁니다.인천 삼릉 마을도 재개발로 철거를 앞두고 있습니다.산 교육의 장으로 만들기 위해 학술 연구와 정부 차원의 조사, 지원이 필요하다는 지적이 이어지고 있지만 주무 기관인 문화재청이 국내 강제 징용 유적지를 대상으로 벌인 조사는 단 한 건도 없었습니다.[서경덕/성신여대 교양학부 교수 : 다음 세대에 물려줄 수 있는, 특히 이제 다크투어리즘이라고 해서 어두운 역사를 교육의 장으로 활용하는 (방식이 필요합니다.) 그들의 삶의 터전과 어떻게 자연스럽게 녹여낼 수 있을지 그런 대화를 (이어나가야 합니다.)]일본에 강제 징용 책임과 반성을 촉구하는 만큼 우리 스스로도 아픈 역사를 보존하고 제대로 배우려는 자세가 필요합니다.(영상취재 : 서진호, 영상편집 : 김중희, VJ : 김종갑) 강민우 기자(khanporter@sbs.co.kr)▶[노딜 하노이] 북미 관계 전망은?▶[SBS스페셜] 입시코디 김주영을 찾아서▶네이버 메인에서 SBS뉴스 구독하기※ ⓒ SBS & SBS Digital News Lab. : 무단복제 및 재배포 금지"
1,2019-03-02,JTBC,https://news.naver.com/main/read.nhn?mode=LSD&mid=shm&sid1=103&oid=437&aid=0000204080,"[앵커]시민들이 3·1 운동 하면 가장 떠오른다고 답한 인물, 유관순 열사입니다. 3·1절 100주년 기념식에서는 유관순 열사에 1급인 건국훈장 대한민국장이 추서됐습니다. 그런데 우리 역사 속에는 유관순 열사 못지않게 일제에 항거해 끈질기게 투쟁한 여러 여성독립운동가가 있습니다.연지환 기자가 보도합니다. [기자]소녀가 18살 되던 해에 만세운동이 일어났습니다.태극기를 들고 거리로 나섰고 유치장에도 갇혔습니다.'폭탄을 안고 일본으로 날아가겠다'는 각오로 중국비행학교에 간 권기옥 선생은 이후 한국 최초 여성 비행사가 됐습니다.하지만 선생이 제대로 알려진 것은 2005년이 지나서 입니다.[권혁/권기옥 선생 아들 : 30년 동안 독립운동을 꾸준히 하셨어요. (어머니께서는) 대한민국을 사랑하는 사람으로 기억되기를 바라셨어요.]춘천에 살던 여성은 일제의 침략을 두 눈으로 목격했습니다.직접 의병을 모았고, 노래를 지어 일본에 맞섰습니다.""조선 안사람이 경고한다""""우리도 뭉쳐지면 왜놈 잡기 쉬울세라""최초 여성의병장, 윤희순 의사 동상은 지금 작은 도서관 뒤뜰에 서 있습니다.[이복우/경기 안산시 단원구 : 설명문 보니까 그때서나 어떤 분인지 인지하게 됐죠.]중국에 있는 비석에는 다른 사람의 이름이 덧씌워지기도 했습니다.순국한 동풍신 열사와 3·1운동 기폭제 역할을 한 김마리아 선생.이처럼 독립을 염원하며 일제에 항거한 여성독립운동가는 많습니다.이들을 기억하는 행사가 열렸고 시민들은 다짐했습니다.[이학진/경기 안양시 비산동 : 함성 속에 묻혀 있는 여성들의 기운들이 조금 더 많이 밝혀져야 될 것 같고…]정부가 이번에 추서한 여성독립운동가는 75명.역대 최다지만 여성은 아직 전체 유공자의 2% 수준입니다.(화면제공 : 광복회·윤희순의사기념사업회·항일여성독립운동기념사업회)(영상디자인 : 황선미)연지환(yeon.jihwan1@jtbc.co.kr) [영상취재: 이동현,이완근 / 영상편집: 이휘수]▶ JTBC 기자들의 시청자 미션 수행? [뉴스 미션] / [뉴스룸 다시보기]▶ 확 달라진 '뉴스APP' 이슈부터 라이브까지 한눈에!Copyright by JTBC(http://jtbc.joins.com) and JTBC Content Hub Co., Ltd. All Rights Reserved. 무단 전재 및 재배포 금지"
2,2019-03-02,JTBC,https://news.naver.com/main/read.nhn?mode=LSD&mid=shm&sid1=102&oid=437&aid=0000204083,"[앵커]지금도 제주 주민들이 찬반으로 나뉘어 갈등을 빚고 있는 강정마을 해군기지에 처음으로 크루즈선이 들어왔습니다. 2000명 넘는 관광객이 찾아왔는데요. 아직도 기대와 우려가 엇갈리고 있습니다.최충일 기자입니다. [기자]축구장 3개 크기인 길이 345m, 14만8000t급 초대형 크루즈선 퀸메리2호가 항구로 들어옵니다.승객 2400여 명을 태웠는데 미국에서 출발해 일본을 들러 제주에 왔습니다.제주 강정 민군복합형 관광미항에 크루즈 관광객들이 내린 것은 시설이 완공된 지 3년 만에 처음입니다.제주를 찾은 관광객들은 배에서 내려 한국 전통 문화를 배우고 유명 관광지도 찾았습니다.[비오세타/크루즈 관광객 : 한국에 처음 왔는데 친절하고 따뜻한 느낌을 받아 행복하고 좋았습니다.]제주도 측은 크루즈선 입항이 지역 경제에 큰 도움이 될 것으로 보고 있습니다.하지만 크루즈 항 건설을 반대했던 주민들은 달갑지가 않습니다.관광객 방문이 마을에 도움이 전혀 안되는 일회성 이벤트일 뿐이라는 것입니다.[정선녀/마을 주민 : 단지 10시간 체류하기 위해서…여기 쓰레기 버리러 온 겁니까, 행사하러 온 겁니까.]앞으로 대형 크루즈선이 계속 입항할지 여부도 불투명한 상황입니다.사드 배치 갈등의 여파로 여전히 최대 고객인 중국 발 크루즈선의 입항이 끊겨 있기 때문입니다.최충일(choi.choongil@jtbc.co.kr) [영상취재: 문석빈 / 영상편집: 오원석]▶ JTBC 기자들의 시청자 미션 수행? [뉴스 미션] / [뉴스룸 다시보기]▶ 확 달라진 '뉴스APP' 이슈부터 라이브까지 한눈에!Copyright by JTBC(http://jtbc.joins.com) and JTBC Content Hub Co., Ltd. All Rights Reserved. 무단 전재 및 재배포 금지"
3,2019-03-02,MBC,https://news.naver.com/main/read.nhn?mode=LSD&mid=shm&sid1=102&oid=214&aid=0000928559,"[뉴스데스크]◀ 앵커 ▶일제시대 사할린으로 끌려갔던 강제징용 피해자와 그로 인해 운명이 바뀌어버린 그 후손들은 여전히 악몽같은 기억 속에서 살고 있습니다. 조사위원회가 있었지만 4년 전 활동을 종료했고, 생존해 있는 피해자 규모조차 아직 파악하지 못하고 있습니다. 조희형 기자가 취재했습니다. ◀ 리포트 ▶매주 화요일 청와대 앞 집회를 찾아가는 신윤순 할머니, 신 할머니의 아버지는 강제징용 피해잡니다.[신윤순(75살)]""나 사할린 유족, 신윤순은 아버지 얼굴도 이 세상에 나와서 본 적이 없는 유복자로 (태어나)…""아버지는 1943년 러시아 사할린으로 끌려갔습니다.당시 아직 태어나기 전이라 아버지 얼굴도 보지 못한 신 할머니, 유품이라곤 사할린에서 날아온 편지 한 장이 전부였습니다.[신윤순(75살)]""할아버지를 붙잡아다 진짜 죽도록 매를 때렸어요. 그랬는데 10월에 이게 (징용통지서) 또 나온 거야. 이제는 도망가면 '우리 아버지가 죽겠다'. (그래서 아버지가 사할린으로 가시게 됐다고…)""아버지의 유해라도 찾을 수 있을까.할머니는 편지 봉투에 적힌 주소를 들고 사할린으로 건너갔습니다.수소문 끝에 한 벌목장에서 아버지에 대한 인사기록부를 발견했지만, 그게 다였습니다.[신윤순(75살)]""우리 아버지가 1919년생이니까. 100살인데 살아있을 확률은 거의 없으니까.. 그럼 뼈라도 찾아달라. 내가 얘기하는 건 그거 거든요.""경기도 양주의 한 아파트에는 강제 징용 피해자 가족 50세대가 모여 살고 있습니다.[성기선/강제징용 피해자 유족]""(러시아에서) 버스 타고 이렇게 가면..그런 김치 냄새 난다, 마늘 냄새 난다…""꼭 고국으로 돌아가라는 부모님의 유언에 따라 지난 2014년 한국으로 건너온 김정희씨.[김정희(73살)/강제징용 피해자 유족]""아버님 그 말씀하시더라고. 나중이라도 조선으로 가게 되면 꼭 자기 고향을 찾아가봐라."" 일본군 비행장을 만드는 데 끌려가 고생만 하다 돌아가신 아버지를 생각하면 지금도 목이 메입니다.[김정희(73살)/강제징용 피해자 유족]""맞을 대로 맞아서 속에 안에 핏덩이가 생겨서..그 핏덩이가 곪아서 곪아서…(돌아가신 거예요)""일제 시대 러시아 사할린으로 끌려간 조선인 숫자는 3만 명 정도.이 가운데 1945년 이전에 태어난 1세대 피해자는 약 3,500명가 생존해 있는 것으로 추산됩니다.하지만, 이마저도 공식 통계는 아닙니다. 강제징용피해자 실태를 조사했던 대일항쟁기피해조사위원회가 4년전 활동을 종료하면서 정부차원의 조사가 중단됐기 때문입니다.[김정희(73살)/강제징용 피해자 유족]""(위로금) 신청을 못하고 있잖아요. 우리도 피해자인데 생각하면 그렇죠..그거라도 좀 받아서 (러시아에 있는) 애들도 도와주고 싶은 그런 욕심이 있죠…""국회는 3.1절 100주년을 맞아 뒤늦게 위원회 활동을 재개하는 법안을 마련하고 있습니다.[김동철 의원/바른미래당]""조사위원회를 만들어서 다시 실태조사부터 제대로 하자는 거죠. 지금은 현지에 있는 유족회라던가 일반 민간 기구들에 의해서 실태조사가 이뤄지고 있는데…""어디로 가는 줄도 모르고 타지에 끌려가 온갖 고초를 겪었던 강제징용 피해자들, 정확한 기록이라도 찾아 달라는 게 이들의 바람입니다. MBC뉴스 조희형입니다.조희형 기자 [저작권자(c) MBC (http://imnews.imbc.com) 무단복제-재배포 금지]▶ 네이버 홈에서 [MBC뉴스] 채널 구독하기▶ [엠빅뉴스] 북한 김정은 위원장의 평양에서 하노이까지..'길' 뮤직비디오 MV (feat.god)▶ [14F] 출산율 0명대, 이러다 인구 소멸? Copyright(c) Since 1996, MBC&iMBC All rights reserved."
4,2019-03-02,SBS,https://news.naver.com/main/read.nhn?mode=LSD&mid=shm&sid1=102&oid=055&aid=0000714177,"<앵커>오늘(2일) 낮에 날씨가 참 따뜻은 했는데 밖에 나가기는 주저할 수밖에 없었습니다. 마스크 없이 다녀보면 모래를 먹은 듯한 느낌이 들 정도였는데 수도권은 내일은 물론이고 다음 주도 이런 상태가 이어질 것 같습니다.정성진 기자입니다.<기자>서울 도심이 희뿌연 미세먼지에 갇혔습니다.도심 속 고층 건물들은 형체만 알아볼 수 있을 정도고 한강 이남 지역은 그마저도 보이질 않습니다.오늘 서울 가시거리는 맑은 날의 1/5 수준인 4km 정도까지 떨어졌습니다.나흘째 '나쁨·매우 나쁨' 수준이 계속되면서 오늘도 숨 막히는 연휴가 됐습니다.[전대진/서울 광진구 : 답답하죠. 사실은 좋은 공기 마시고, 아들하고 얘기도 하고 그러고 싶은데, 미세먼지 때문에 그럴 순 없으니까….]오늘같이 따뜻한 날씨에는 자전거를 타는 시민들이 찾는 한강공원도 다소 한산한 모습입니다.[장다원·정혜빈/경기 남양주시 : 자전거 타는 게 시원한 바람 막 맞고, 냄새 맡으려고 타는 거잖아요. 그런데 마스크 쓰고 있으니까 시원한 느낌도 사실 별로 안 들고….]오늘 수도권엔 오전 한때 초미세먼지 농도가 기준치의 8배가 넘는 214㎍까지 올랐습니다.전국적으로도 모두 '나쁨' 수준 이상이었습니다.기상청은 내일 남부지방엔 비가 오면서 미세먼지가 씻기겠지만, 수도권과 충청 지역 등은 여전히 '매우 나쁨' 또는 '나쁨' 수준을 유지할 걸로 내다봤습니다.게다가 올봄 중국 등 황사 발원지의 강수량이 평년보다 적어 황사까지 늘어날 걸로 예측돼 답답한 봄날이 잦을 전망입니다.(영상취재 : 설민환, 영상편집 : 전민규)   정성진 기자(captain@sbs.co.kr)▶[노딜 하노이] 북미 관계 전망은?▶[SBS스페셜] 입시코디 김주영을 찾아서▶네이버 메인에서 SBS뉴스 구독하기※ ⓒ SBS & SBS Digital News Lab. : 무단복제 및 재배포 금지"
5,2019-03-02,세계일보,https://news.naver.com/main/read.nhn?mode=LSD&mid=shm&sid1=102&oid=022&aid=0003343965,"봄철 날씨가 풀리면서 등산객들도 늘어 /겨우내 얼었던 땅이 녹으면서 붕괴 사고 종종 발생 / 샛길은 출입 사고 시 현장 구조가 지연돼 인명 피해 / '나 하나쯤이야 뭐! 괜찮아' 비뚤어진 얌체 꼴불견 / 최근 5년간 산악 안전사고 1080건 중 샛길에서만 32건 / 자신감 찬 '안전 불감증' / 봄철 산행 안전 수칙은 필수도봉산 탐방로에는 ""급경사지 낙석위험"" 경고 팻말이 나뭇가지에 걸려 있다.""에이 걸리겠어? 괜찮아! 괜찮아! 안 걸려.""이른 봄이 찾아왔다. 아침저녁으로는 조금 쌀쌀하지만, 낮에는 기온이 오르면서 살짝 봄기운 느낄 수 있다. 전국 명산은 향긋한 봄 내음을 풍기며 등산객들을 부르고 있다. 두꺼운 옷을 벗고 가벼운 옷차림의 등산객들이 몰리며 봄이 다가왔음을 실감케 한다. 산들산들 부는 봄바람과 청명하고 경쾌하게 흐르는 계곡 물소리. 따스하게 내리쬐는 봄 햇살에 산과 들은 서서히 푸른 옷으로 갈아입으며 등산객의 마음을 설레게 한다.봄철을 맞아 겨울 동안 움츠렸던 몸을 펴고 산을 찾는 사람들. 본격적인 등산 시즌을 알렸다. 지난달 28일 찾은 도봉산에는 벌써부터 등산객들로 붐비고 있었다.‘꼴불견’ 행동을 일삼는 등산객들 때문에 올해도 국립공원은 벌써부터 몸살을 앓기 시작했다. 일부 등산객의 비뚤어진 마음으로 ""안 걸려 걱정 마"", ""나만 따라와"", ""나쯤이야 뭐!"" 하는 '얌체 행각'이 눈에 띄기 시작했다.지난달 28일 서울 도봉산 국립공원을 찾은 등산객들이 가벼운 옷차림으로 등산을 하고 있다.이처럼 일부 등산객들의 꼴불견 행동이 문제가 된 것은 어제오늘의 일이 아니다. 실제로 등산객들이 활동하는 산악 동호회 카페에서는 '신 탐방로 개척'했다며 후기를 적은 글도 찾을 수 있다.도봉산 탐방로를 걷다 보면 '샛길 출입금지' 팻말이 눈에 잘 띄는 곳곳에 설치돼 있다. 위험한 샛길 산행은 해마다 반복되고 문제를 일으키고 있으나 공염불에 그치고 있다. 일부 등산객의 몰지각한 행동이 산을 즐기려는 등산객들의 기분을 망치고 어렵게 가꾼 산림마저 훼손하고 있다.샛길을 찾아 걷는 한 등산객은 ""괜찮으면 됐지 뭐!""라며 쏘아붙이며 무안하게 만들기까지 했다. 이 모습을 본 등산객은 ""경고 팻말을 왜 붙였겠어요. 위험하니깐 붙였죠. '샛길 출입금지'라고 하면 들어가지 말아야지. 왜 들어가는지 몰라""라며 이해할 수 없었다는 표정을 지었다.일부 등산객은 '샛길 출입금지' 팻말이 붙어 있는데도 불구하고 단속의 눈길을 피해 펜스를 넘거나 계곡에서 손을 씻는가 하면 인근에서 소변을 보는 몰지각한 등산객도 눈에 띄었다. 산불 발생 위험이 가장 높은 시기임에도 남들이 보지 않는 곳에서 준비해온 술과 담배를 피우는 사람들까지 눈에 띄었다.◆ ""해빙기, 얼음 사르르"" 위험한 샛길 ‘산행’날씨가 풀리는 해빙기. 해빙기 낙석은 겨우내 바위 면과 돌 틈 사이에 있는 물이 얼어 틈 사이가 팽창했던 물이 기온이 올라 녹으면서 암반 지지력이 없어져 발생한다. 따뜻한 봄 날씨에 보기에는 눈이 다 녹았다고 생각하기 쉽지만, 돌 윗부분에 살얼음처럼 살짝 덮여있는 경우도 많다. 또 녹아내린 물이 흙 속에 스며들면서 미끄러지기 쉽다.일부 탐방로에는 얼었던 물이 녹아 고여 있다. 노면에 남아있는 빙판으로 인한 안전사고에 각별한 주의가 필요하다.기존 탐방로가 아닌 샛길 산행은 매우 위험하다. 겨우내 얼었던 땅이 녹으면서 낙석이나 붕괴 사고가 발생할 수도 있다. 그뿐만 아니라 샛길 산행 시 자칫 미끄러져 급경사지나 절벽 아래 떨어 질 수도 있기 때문이다. 봄철 대부분의 사고는 낙상이나 추락으로 인한 골절 사고다.샛길은 기존 탐방로보다 좁고 급경사 구간이 많고, 낙석 위험지대를 지나는 경우가 많다. 얼고 녹기를 반복하면 얇게 살얼음이 남아 있을 가능성이 높기 때문에 예측이 거의 불가능하다.정식 탐방로는 일정 거리마다 위치 표지판이 있지만, 샛길에는 이런 표지판이 없어 위기상황 발생 시 현장을 찾고 구조하는 일이 쉽지 않다. 긴급구조위치 표지판의 번호를 알려주면 구조대원이 신속하게 현장에 도착할 수 있지만, 샛길 사고 시 정확한 위치 파악이 어렵다.한 등산객이 얼음이 언 구간을 지나고 있다. 노면에 남아있는 빙판으로 인한 안전사고에 각별한 주의가 필요하다.특히 휴대전화가 불통인 곳도 많을뿐더러 119로 신고해도 정확한 위치를 파악하는 시간이 걸린다. 샛길 불법 산행은 야생동물의 서식지 등 자연 생태계에 영향을 미칠 뿐 아니라 추락, 낙석 등 안전사고 발생 우려도 매우 높다.◆ 실족추락 1492건으로 유형별 최다…지반약화·과욕·과로·음주봄철인 요즘 전국 국립공원마다 등산객들이 발길이 이어지고 있는 가운데 입산 통제구역에 있는 샛길로 몰래 다니다가 적발되는 경우가 적지 않다.서울시내 주요 산(山) 중 북한산·도봉산·관악산·수락산 등에서 산악사고가 자주 발생하는 것으로 집계됐다.도봉산 등산로에 설치된 국립공원 내 산불조심 금지 현수막. 현수막에는 '취사 및 흡연 금지','샛길 출입금지','위반시 과태료 부과'등의 문구가 새겨져 있다.지난해 서울시 소방재난본부가 2015년부터 지난해까지 최근 3년간 서울 시계 주요 산에서 산행 중 발생한 산악사고 4518건을 분석한 결과 북한산이 1177건(998명 구조)으로 가장 많았다. 이어 도봉산 807건(682명 구조), 관악산 586건(550명 구조), 수락산 429건(333명 구조) 순이다.산악사고 유형별로는 실족추락이 1492건으로 가장 많았다. 이어 일반조난 667건, 개인질환 391건, 자살기도 92건, 암벽등반 77건 순이다.봄철(3~5월)에 주로 발생하는 산악사고 유형은 실족추락(421명)이다. 이어 일반조난 148명, 개인질환 89명, 자살기도 29명, 암벽등반 15명 순이다. 실족추락 사고가 많은 것은 지반약화, 과욕(만용), 과로, 음주 등 때문이다. 실족·추락 사고는 등산로에서 미끄러져 골절 부상을 당하는 경우가 대부분이다.일부 탐방로 구간은 녹아내린 물이 흙 속에 스며들어 미끄럽다.지난달 4일 도봉산에서 등산객이 추락해 사망하는 사고가 발생했다. 소방당국에 따르면 50대 여성이 서울 도봉구 도봉산 자운봉 인근 Y계곡에서 30m 아래로 추락해 사망했다. 사고 현장은 줄을 잡고 등산해야 하는 험한 지역. 소방당국 관계자는 ""'등산로의 줄을 잡고 있다 놓치며 추락했다'는 신고를 받았다""며 ""전날 내린 눈과 비가 얼어 바닥이 미끄러운 상태였다""고 설명했다.한 산악 전문가 ""봄철에는 동네 뒷산도 얕보면 안 된다"" 강조했다. 이어 ""안전사고 예방을 위해서는 기상정보 및 등산경로 사전 확인과 함께 큰 온도차에 대비한 방한복 준비, 등산 전 가벼운 준비운동, 보호대와 스틱 등 준비가 필요하다. 또 올바른 신고 방법을 기억하고 안전수칙도 준수해야 한다""고 덧붙였다.글·사진=김경호 기자 stillcut@segye.comⓒ 세상을 보는 눈, 글로벌 미디어 세계일보"
