,date,newsSource,newsLink,newsText
73,2019-03-13,아시아경제,https://news.naver.com/main/read.nhn?mode=LSD&mid=shm&sid1=101&oid=277&aid=0004429341,"[아시아경제 김혜원 기자] 현대자동차와 미국계 행동주의 헤지펀드 엘리엇매니지먼트가 오는 22일 열리는 현대차 주주총회에서 각종 안건을 놓고 표 대결을 예고한 가운데 양대 글로벌 의결권 자문사에 이어 한국기업지배구조원도 현대차에 힘을 싣는 의견을 냈다. 기업지배구조원은 특히 현대차의 2대 주주인 국민연금과 자문 계약을 맺고 있어 국민연금 표심에 영향을 미칠지 관심을 끈다.13일 업계에 따르면 국내 대표 의결권 자문 기관 기업지배구조원은 최근 보고서를 통해 현대차 사외이사 선임 안건에 대해 회사 측 제안은 모두 찬성, 엘리엇 제안은 모두 반대를 권고했다.현금배당 안건에 대해서는 회사 측 안에 찬성, 엘리엇 제안에 '불행사 권고'하며 실질적으로 회사 측 안을 추천했다. 기업지배구조원은 ""작성 시스템의 구조적인 문제로 불행사 권고 사항에 대해 찬성으로 표기되는 점을 양해해달라""고 밝혔다.기업지배구조원은 현대모비스에 대해서도 현대차와 동일하게 사외이사 선임 안건은 회사 측 제안에 모두 찬성, 엘리엇 제안에 모두 반대했다. 기업지배구조원은 ""(엘리엇이) 단기적인 기업가치 제고 방안에 관심을 둘 여지가 크다고 판단된다""면서 ""주주 제안자가 제안한 사외이사 후보가 장기적인 주주가치 제고에 부합할 것이라고 보지 않는다""고 명시했다.현대모비스 배당안 관련해서는 회사 측 안은 찬성, 엘리엇 안은 역시 '불행사 권고'를 했다. 기업지배구조원은 ""배당은 장기적인 배당 정책에 따라 안정적인 추세로 지급되는 것이 타당하다""며 ""회사가 제시한 주주환원 정책은 이에 부합하는 측면이 있다""고 강조했다.기업지배구조원의 합류로 국내외 주요 의결권 자문사의 권고는 상당 부분 '현대차, 현대모비스 이사회 안건 찬성'으로 방향이 모아졌다.서스틴베스트도 엘리엇이 모비스에 제기한 배당 안건에 반대했다. 서스틴베스트는 ""지나치게 과도한 배당으로 기업의 중장기적 가치가 훼손될 수 있다""며 ""주주 제안의 배당 정책이 회사의 실적에 적절히 연동되지 않았다""고 지적했다. 서스틴베스트는 엘리엇이 현대모비스에 제안한 로버트 앨런 크루즈 후보와 관련해 ""회사와 거래 관계가 있는 회사의 임원으로 재직하면서 독립적인 업무 수행이 어렵다고 판단된다""며 이해상충 가능성에 주목했다.대신지배구조연구소는 ""(엘리엇의 배당 요구가) 과도하다""며 현대차와 현대모비스 회사 측 현금배당 안에 동의했다. 현대차 사외이사와 관련해서는 회사 측과 엘리엇 제안에 모두 찬성했으나, 회사 측 안건에 대해 더 긍정적인 평가인 '추천'을 권고했다. 현대모비스 사외이사 안건의 경우 회사 측 후보는 모두 찬성했으며 엘리엇 후보는 루돌프 윌리엄 본 마이스트 후보는 찬성, 로버트 앨런 크루즈 후보는 반대했다.앞서 글로벌 의결권 자문사 ISS(Institutional Shareholder Services)는 엘리엇이 제안한 현대차와 현대모비스 배당 안건에 반대를 권고했다. 향후 연구개발(R&D;)이나 공장 투자를 위한 자본 요건 충족에 어려움이 생길 수 있다는 판단에서다. 엘리엇이 요구한 배당은 현대차 보통주 1주당 2만1976원, 현대모비스 보통주 1주당 2만6399원 등 총 7조원에 육박한다.미국 의결권 자문사 글래스루이스도 현대차 주주총회에서 엘리엇의 제안에는 반대하고 회사 측 제안에는 찬성표를 행사할 것을 주주에게 권고했다. 글래스루이스는 보고서에서 ""이번처럼 대규모 일회성 배당금을 지급해달라는 제안에 주주들의 지지를 권고하는 것은 가능하지 않다""면서 ""빠르게 진화하고 있는 자동차 산업의 특성을 고려할 때 현대차가 경쟁력 향상과 장기적 수익률 제고를 달성하기 위해 상당한 R&D; 비용과 잠재적 인수합병(M&A;) 활동이 요구될 것""이라고 진단했다.사외이사 선임 안건에 대해서는 양측의 의견이 엇갈렸다. 글래스루이스는 현대차가 제시한 세 명의 후보에 모두 찬성했지만 엘리엇이 제안한 후보에는 반대 의사를 나타냈다. 반면 ISS는 엘리엇이 현대차 사외이사와 감사위원으로 추천한 후보 3명 중 2명에 대해 찬성표를 행사할 것을 주주에게 권고했다. ISS가 지지한 후보 2명은 존 Y 류 베이징사범대 교육기금이사회 구성원 및 투자위원회 의장, 로버트 랜들 매큐언 발라드파워시스템 회장이다. ISS는 현대모비스 주총에서도 이사회 구성을 9명에서 11명으로 늘리도록 권고하고 엘리엇이 추천한 후보 2명에 대해서도 지지 의사를 밝혔다. 뉴욕에 본부를 둔 운용 자산 규모 350억달러(약 39조7000억원)의 헤지펀드 엘리엇은 지난해 4월 현대차와 기아차, 현대모비스 3사의 주식을 매입한 이후 지난달 처음으로 주총 안건으로 주주 제안을 냈다.김혜원 기자 kimhye@asiae.co.kr▶ 아시아경제 채널 추가하고 에어팟, 해외여행비 받자!▶ 재미와 신기 '과학을읽다' ▶ 꿀잼 '인기만화'<ⓒ경제를 보는 눈, 세계를 보는 창 아시아경제 무단전재 배포금지>"
75,2019-03-13,뉴시스,https://news.naver.com/main/read.nhn?mode=LSD&mid=shm&sid1=100&oid=003&aid=0009111068,"단란·유흥주점 집행 없어…지난해부턴 기타주점도 금지고급일식점 2794만원, 백화점 9238만원, 오락 243만원허위 증빙자료 없고, 50만원 초과 사용은 상세 입증돼【서울=뉴시스】박미소 수습기자 = 최성호(오른쪽) 공직감찰 본부장이 12일 오전 서울 종로구 감사원에서 기획재정부, 대통령비서실 등 11개 기관의 업무추진비 집행실태 점검 감사결과를 발표하고 있다. 이날 감사원은 심야·휴일 사용 등 업무추진비 집행 점검대상 19,679건 중 1,764건이 적정하지 않았고 이를 바탕으로 총 35건의 위법·부당사항을 지적했다. 2019.03.13.  misocamera@newsis.com【서울=뉴시스】김지현 기자 = 감사원은 대통령비서실 등 청와대 업무추진비가 심야·휴일 또는 주점·백화점에 사용된 사실은 있으나 공무상 불가피한 집행으로 판단했다.지난해 국정감사에서 심재철 자유한국당 의원이 중점적으로 제기한 문제점은 업무추진비 사용 시간대와 업종의 적정성이다.  감사원은 이를 감사 중점으로 설정해 청와대 업무추진비 집행실태를 점검했다.우선 업종과 관련, 청와대에서는 2017년 1월~2018년 9월 사이 ▲주점 81건 ▲오락 54건 ▲백화점 698건의 업무추진비 집행 사실이 나타났다. ▲50만원을 초과한 고급 일식점 43건 ▲심야·휴일 2461건도 집행 드러났다.감사원은 그러나 금지업종에서 업무추진비를 집행하거나, 불가피하게 심야·휴일 등에 업무추진비가 쓰인 사유가 입증됐다고 밝혔다. 주점에서 사용된 81건의 업무추진비의 경우, 모두 업무추진비 사용이 금지된 단란·유흥주점이 아닌 기타주점 등 집행이 허용되는 업종에서 사용된 것으로 확인됐다대통령비서실은 심야·휴일 사용에 대해 내역, 장소, 목적, 참석자 등이 상세 기재된 증빙서류를 관리하고 있었고 영수증을 허위 작성한 사례가 없었다.업무추진비 문제가 제기되기 전인 지난해 1월, 대통비서실은 내부 지침을 개정해 기타주점에서도 업무추진비를 집행할 수 없도록 규정을 강화했다. 2018년 이후 주점 업종에서 사용된 33건 중 식사 대체 목적으로 치킨집 등에서 사용한 11건을 제외한 나머지 업무추진비는 반납 처리된 것으로 조사됐다.주점은 아니지만 고급일식점에서 50만원 이상 업무추진비가 사용된 사례도 43건(2794만원) 나타났다. 일부 사례에서는 메뉴당 금액이 10만원에 가까운 음식점에서 집행되기도 했다.그러나 감사원은 업무추진비 사용 건당 상한액을 별도로 정한 지침이 없는데다, 건당 50만원을 초과하는 경우 증빙서류도 규정에 맞게 작성돼 있어 문제가 있다고 보기 어렵다고 밝혔다.【서울=뉴시스】박미소 수습기자 = 최성호 공직감찰 본부장이 12일 오전 서울 종로구 감사원에서 기획재정부, 대통령비서실 등 11개 기관의 업무추진비 집행실태 점검 감사결과를 발표하고 있다. 이날 감사원은 심야·휴일 사용 등 업무추진비 집행 점검대상 19,679건 중 1,764건이 적정하지 않았고 이를 바탕으로 총 35건의 위법·부당사항을 지적했다. 2019.03.13.  misocamera@newsis.com이런 판단에는 대통령비서실은 업무 특성상 보안 유지가 필요해 손님들이 공간을 따로 쓰는 구조가 많은 일식점을 업무 협의 장소로 주로 활용하고 있는 점도 고려됐다고 감사원은 전했다. 백화점업종에서 집행된 업무추진비 액수는 총 9238만원, 698건으로 나타났다. 감사원 관계자에 따르면 행사 물품에 7500여만원, 업무 협의 등에 1700만원이 사용됐다.백화점에서 평창올림픽 기념품을 구입하거나 백화점 내 음식점에서 업무간담회를 하는 데 업무추진비가 사용됐으며 사적으로 사용한 사례는 확인하지 않았다. 오락업종에서 사용된 243여만원의 경우, 영화관이나 음료·다과에 지출됐다. 문재인 대통령이 민주화운동 인사들과 영화 '택시운전사', '1987' 관람행사를 하는 데 사용된 게 대부분이었다. 이외에도 업종이 누락돼 내역을 확인할 수 없는 집행도 있었다.감사원은 카드사 자체관리코드(4자리)를 한국표준산업분류코드(6자리)로 변환하지 않고 전송하거나 공백으로 전송하면서 누락이 발생한 것으로 파악했다. 2개 카드사에서 결제된 업무추진비 8274건(전체의 44%) 정도가 누락된 것으로 나타났다.한국재정정보원은 이를 개선하기 위해 지난해 9월부터 카드사에 6자리 업종코드로 전송하도록 조치할 것을 요청한 상황이라고 감사원은 설명했다.fine@newsis.com▶ 네이버에서 뉴시스 채널 구독하기▶ 뉴시스 빅데이터 MSI 주가시세표 바로가기 <저작권자ⓒ 공감언론 뉴시스통신사. 무단전재-재배포 금지.>"
76,2019-03-13,뉴시스,https://news.naver.com/main/read.nhn?mode=LSD&mid=shm&sid1=102&oid=003&aid=0009111135,"법무부, '2019년 주요 업무 보고 계획' 발표수사권조정 등 검찰개혁안 국회 통과 목표포토라인·피의사실 공표 관행 개선안 마련검찰 심야 조사 실태조사…준칙 개정 검토【서울=뉴시스】김진아 기자 = 박상기 법무부 장관이 지난달 26일 서울 종로구 정부서울청사에서 3·1운동 100주년을 기념해 특별사면 및 복권 대상자를 발표하고 있다. 2019.02.26.  bluesoda@newsis.com【서울=뉴시스】강진아 기자 = 법무부가 올해 검경 수사권 조정과 고위공직자범죄수사처(공수처) 등 검찰개혁을 실현하겠다고 재차 의지를 밝혔다. 최근 이른바 '사법농단' 수사로 다시 수면 위에 떠오른 검찰 포토라인과 피의사실공표 문제 등 인권보호 개선방안도 마련하겠다고 강조했다.법무부는 13일 오후 정부과천청사에서 이 같은 내용의 '2019년 주요업무보고 계획'을 발표했다. 주 내용은 ▲검찰개혁의 제도화 ▲인권보호 정책 강화 ▲공정경제 법안의 조속한 입법 등이다.우선 법무부는 검찰개혁의 최우선 과제로 꼽히는 검경 수사권 조정과 공수처 설치를 실현하겠다는 계획이다. 이를 위해 현재 진행 중인 국회 논의를 적극 지원하고, 법안이 신속히 통과될 수 있도록 법안심사를 지원하는 등 최선을 다하겠다고 밝혔다.공수처는 대통령과 총리, 국회의원, 판·검사 등 고위공직자의 부패 근절을 위한 독립적 수사기구로 관련 법안이 국회 사법개혁특별위원회에 상정돼 있다. 검경 수사권 조정 관련 법안도 사개특위에 상정돼 심사 중이다.법무부는 또 검찰의 포토라인과 피의사실공표, 심야조사 관행을 개선하겠다고 밝혔다. 올해 상반기에 공청회와 심포지엄 등을 추진해 공론화하고, 7월 이후 그 연구결과와 여론 등을 수렴해 개선방안을 마련하겠다는 계획이다.그동안 검찰 포토라인 등의 문제는 피의자 인권 보호와 국민의 알 권리를 두고 의견이 갈렸다. 최근에는 양승태 전 대법원장 등 사법행정권 남용 수사로 다시 화두에 올랐다.이와 관련해 법무부는 훈령으로 규정된 '인권보호를 위한 수사공보준칙'을 엄격히 준수하겠다고 밝혔다. 원칙적으로는 비공개 소환을 하고, 공보준칙상 공개 소환의 예외 규정을 엄격히 해석한다는 방침이다. 수갑이나 수의 등 신병과 관련된 장면에 대한 초상권 보호를 위해 유관기관과 공동으로 구체적인 가이드라인 마련도 추진할 예정이다.또 기소 전 피의사실공표를 막고자 수사관계자의 개별 언론 접촉을 제한하고, 기소 전 수사상황 공개에 관한 구체적 기준 마련도 검토할 계획이다.자정 이후의 심야조사 현황도 파악해 최소화한다는 입장이다. 법무부는 지난해 9~12월에 인권감독관이 있는 12개 지검에서 실태조사를 한 데 이어 올해 1~3월에 전국청으로 확대해 파악 중이다.【서울=뉴시스】고범준 기자 = 양승태 전 대법원장의 검찰 출석을 하루 앞둔 지난 1월10일 오후 서울 서초구 서울중앙지검에서 기자들이 포토라인을 설치하고 있다. 2019.01.10. photo@newsis.com지난해 10월부터는 9개 지검에서 '자발적 신청'이 있는 경우에만 심야조사를 하는 등 최소화를 위한 다양한 방안을 자율적으로 시범실시하고 있다. 올해 상반기까지 이 같은 결과를 분석하고 해외사례 등을 종합해 실효성 있는 개선방안을 마련, 인권보호수사준칙 개정을 검토할 계획이다.이와 함께 법무부는 국민의 이동권이 과도하게 제한되지 않도록 출국금지 심사를 강화하고, 수용자 인권 보장을 위해 교정시설 과밀수용도 해소한다는 방침이다. 이를 위해 출국금지심의위원회의 심의대상과 절차를 구체화하고 위원장을 출입국·외국인정책본부장에서 법무부 차관으로 격상할 예정이다. 환자·고령자나 생계형 범죄자 등의 가석방 신청기준을 완화하고 취업 조건부 가석방을 전국으로 확대하는 등 가석방을 활용해 수용인원을 조절하고, 수용공간 확충을 위한 리모델링과 이전·신축사업도 추진한다.이 밖에 다중대표소송 도입과 전자투표제·집중투표제 의무화, 감사위원 분리선출 등 기업의 지배구조를 개선하기 위한 상법 개정도 추진할 예정이다. 가습기 살균제 사건 등 다수 피해자를 효율적으로 구제하기 위한 '집단소송제' 확대 법안도 입법할 계획이다.akang@newsis.com▶ 네이버에서 뉴시스 채널 구독하기▶ 뉴시스 빅데이터 MSI 주가시세표 바로가기 <저작권자ⓒ 공감언론 뉴시스통신사. 무단전재-재배포 금지.>"
77,2019-03-13,연합뉴스,https://news.naver.com/main/read.nhn?mode=LSD&mid=shm&sid1=100&oid=001&aid=0010692344,"재판부 ""이팔성 불출석 사유, 정당하지 않아"" 경고검찰, 김윤옥 여사·MB 사위 증인 신청이팔성 전 우리금융지주 회장 [연합뉴스 자료사진](서울=연합뉴스) 송진원 이보배 기자 = 법원이 이명박 전 대통령 재판에 증인으로 소환된 이팔성 전 우리금융지주 회장에 대해 구인장을 발부했다. 정당한 사유 없이 증인 소환을 피했다는 판단이다.    이에 맞서 검찰은 수사 단계에서 끝내 조사에 불응한 이 전 대통령 부인 김윤옥 여사를 증인으로 신청했다.     증인 신문이 제대로 이뤄지지 않아 답보 상태였던 이 전 대통령 재판이 그의 보석을 기점으로 활기를 띠는 모양새다.     서울고법 형사1부(정준영 부장판사)는 13일 이 전 대통령의 항소심 속행 공판에 증인으로 소환한 이 전 회장에 대해 구인장을 발부했다.     재판부는 이날 오후 이 전 회장을 증인으로 신문할 계획이었지만 그는 불출석 사유서를 내고 나오지 않았다.     이 전 회장은 사유서에서 ""부정맥 등 지병이 있어 몸 상태가 좋지 않고, 이 전 대통령 앞에서 진술하는 데에 불안감이 있다""고 주장했다.    재판부는 그러나 ""이팔성이 제시한 불출석 사유만으로는 정당한 사유로 볼 수 없다""고 판단했다.     증인이 법정에 출석하지 못할 정도로 건강이 좋지 않다면 법정 밖이나 증인 주소지에서 신문이 가능하고, 이 전 대통령 앞에서 진술하는 게 불안하면 차폐 시설을 설치하거나 증인 지원 서비스를 받는 등 방법은 여러 가지라는 게 재판부 설명이다.     재판부는 결국 ""이팔성에 대해선 구인을 위한 구속영장을 발부한다""며 ""법원은 이팔성에 대해 안전하게 법정에 출석하고 증언을 마친 후 돌아가도록 증인 보호 지원을 할 것""이라고 설명했다.     재판부는 이 전 회장의 증인 신문 기일을 4월 5일로 다시 지정했다.    재판부는 이 전 회장 외에 증인으로 소환된 이학수 전 삼성그룹 부회장 등도 이 전 대통령을 대면하는 게 부담스럽다면 적절한 조치를 취해주겠다고 안내했다.    검찰은 그러나 재판부의 강제 구인 절차에 다소 의문을 표했다.     검찰은 ""소환장을 법원 홈페이지에 게시한 것이 구인장 발부 조건을 충족하는지 의문""이라며 ""구인장 발부를 최종 결정하기에 앞서 다시 한번 심도 있게 검토를 해달라""고 요구했다.보석 후 첫 재판 출석하는 이명박 전 대통령(서울=연합뉴스) 최재구 기자 = 이명박 전 대통령이 13일 서울 서초구 서울고법에서 열린 보석 후 첫 항소심 재판에 출석하고 있다. 2019.3.13 jjaeck9@yna.co.kr검찰은 아울러 이날 재판부에 이 전 대통령의 부인 김윤옥 여사와 사위 이상주 변호사를 증인으로 신청했다.     앞서 이 전 대통령의 구속 만기를 염두에 두고 증인신청을 보류했는데, 이제 기한에 구애받을 필요가 없어졌으니 증인으로 부르겠다는 취지다.     검찰은 특히 김 여사에 대해 ""소환 조사에 불응해 조사에 이르지 못한 사실도 참고해 달라""고 강조했다. 김 여사와 이 변호사는 이 전 회장 등에게서 자리 대가로 뒷돈을 받는 데 관여한 것으로 검찰은 보고 있다.      이 전 대통령 측은 그러나 이 전 대통령의 무죄 부분을 탄핵하는 데에 두 사람의 증언이 꼭 필요한 게 아니라며 증인 채택에 반대 의견을 냈다.재판부는 두 사람의 증인 채택 여부는 추후 결정하기로 했다.     지난 6일 보석으로 풀려난 이 전 대통령은 이날 일주일 만에 법정에 출석하며 모습을 드러냈다.    검은 양복 차림으로 출석한 이 전 대통령은 보석 후 심경을 묻는 취재진에 아무 말도 하지 않았다. 김윤옥 여사(PG)[제작 최자윤] 사진합성    san@yna.co.kr▶네이버 홈에서 [연합뉴스] 채널 구독하기▶뭐 하고 놀까? #흥  ▶쇼미더뉴스! 오늘 많이 본 뉴스영상"
78,2019-03-13,세계일보,https://news.naver.com/main/read.nhn?mode=LSD&mid=shm&sid1=102&oid=022&aid=0003346432,"강남서 소속… 부적절한 접대 있었는지 등 조사 / ‘버닝썬-경찰 유착 고리’ 前경찰관 구속영장 청구   서울 강남의 유명 클럽 ‘버닝썬’과 경찰 간 유착 의혹을 수사 중인 경찰이 이 클럽에 들락거린 강남경찰서 소속 한 현직 경찰관을 내사 중인 것으로 확인됐다. 이 경찰관은 버닝썬에 경찰 신분을 밝히고 들어가는 등 각종 편의를 제공받았다는 의혹을 받고 있다. 버닝썬과 경찰 사이의 ‘유착 고리’로 지목된 전직 경찰관에 대해서는 구속영장이 청구됐다.   13일 경찰에 따르면 서울경찰청 광역수사대는 강남경찰서 경찰관 A(37)씨가 버닝썬에 경찰 신분증을 제시하고 입장했다는 첩보를 입수, 내사에 착수했다. 버닝썬에 들어갈 땐 클럽 MD(영업 직원)를 통해 예약을 하거나 그렇지 않을 경우 입장료를 내야 하는데, A씨는 이런 과정을 거치지 않은 것이다.   일각에서는 A씨 외에 비슷한 행위를 한 경찰관이 더 있다는 이야기도 나오고 있다. A씨는 의혹을 부인하고 있는 것으로 알려졌다. 경찰은 클럽 관계자들을 상대로 A씨가 부적절한 접대를 받았는지 등을 조사하는 한편, ‘아레나’ 등 강남 지역 다른 클럽들에서도 비슷한 일이 있었는지를 살필 방침이다.   경찰은 유착 의혹 수사에도 속도를 내고 있다. 서울경찰청 광역수사대는 최근 특정범죄가중처벌법상 알선수재 혐의로 전직 경찰관 강모씨에 대해 재신청한 구속영장을 검찰이 청구했다고 이날 밝혔다. 강씨는 지난해 7월 버닝썬에서 ‘미성년자 출입사건’이 터지자 이를 무마해주겠다는 명목으로 클럽 측으로부터 금품을 받아 뿌린 혐의를 받고 있다.   모 화장품 회사 임원이기도 한 강씨는 당시 버닝썬에서 계획 중이던 대규모 홍보행사를 앞두고 행사 차질을 우려해 미성년자 출입사건을 무마하려 했다는 의혹의 당사자다. 앞서 경찰은 강씨의 부하직원 이모씨의 ‘지시를 받고 돈을 받아 배포했다’는 진술을 토대로 강씨에 대한 구속영장을 신청했으나 검찰은 영장을 청구하지 않고 보완을 지휘했다.    경찰은 이후 강씨와 이씨, 뇌물 공여자로 거론된 버닝썬 이모 공동대표 등을 잇따라 소환해 조사했다. 이 과정에서 경찰 수사에 협조적이던 이씨가 돌연 의혹을 전면 부인하면서 유착 의혹 수사가 난항을 겪고 있다는 관측이 나오기도 했으나 경찰은 자신감을 내비쳤다. 특히 이 공동대표는 강씨 측에 2000만원을 건넨 사실을 인정한 것으로 전해졌다.   강씨에 대한 구속영장이 발부되면 그는 버닝썬과 경찰 간 유착 의혹이 불거진 이래 구속되는 첫 사례가 된다. 이 의혹과 관련해 입건된 현직 경찰관은 아직까지 없는 것으로 알려졌다. 원경환 서울경찰청장은 얼마 전 “경찰관이 유흥업소와 유착됐다는 것은 용서할 수 없는 일”이라며 “많은 직원이 관여됐어도 모두 처벌할 것”이라고 강조한 바 있다.   김주영·김청윤 기자 bueno@segye.comⓒ 세상을 보는 눈, 글로벌 미디어 세계일보"
