,date,newsSource,newsLink,newsText
0,2019-03-19,KBS,https://news.naver.com/main/read.nhn?mode=LSD&mid=shm&sid1=100&oid=056&aid=0010682284," [앵커]불법 병역 면제, 한국 사회의 고질적인 문제 중 하나가  아닐까 싶습니다. 이번엔, 고의로 청각을  일시 마비시켜 병역을  면제받은 전직 국가대표  사이클 선수와  브로커 등이 적발됐습니다.박민철 기자의 보도입니다. [리포트] 4년 전 국가대표 사이클 선수 A씨는 병역 면제 판정을 받았습니다. 청력에 심각한 문제가 있다는 진단 때문이었지만 가짜였습니다. 밀폐된 차 안에서 2시간 가량 응원용 나팔과 자전거 경적을 사용해 일시적으로 청각을 마비시켜 장애 진단서를 발급 받은 겁니다. 같은 수법으로 병역 면제를 받았던 브로커 32살 이 모 씨가 천5백만 원을 받고 이런 수법을 알려줬습니다.이들은 병역을 면제받기 위해 이런 도구를 이용해 소음을 유발시켜 고의로 청력을 떨어뜨렸습니다. 구독자 100만 명을 넘긴 인터넷 게임방송 BJ도 5천만 원을 주고 수법을 배워 범행을 시도했습니다. 병무청은 2011년부터 7년동안 이런 수법으로 병역을 기피한 혐의 등으로 브로커 이 씨를 구속하고 7명을 불구속 입건했습니다. 최근 7년간 청각장애로 군 면제를 받은 천5백 명에 대한 자료도 들여다볼 예정입니다. [김태화/병무청 차장 : ""중앙 신체검사소의 정밀 검사를 강화해 일시적으로 청력을 마비시켰는지 여부를 확인하는 등 검사 시스템을 개선하기로 했습니다.""] 지난 2012년부터 2018년까지 신검을 통해 병역 면제를 받은 사람은 6천9백58명. 같은 기간 병역법 위반 혐의로 적발된 피의자는 326명입니다. 체중을 속이는 경우가 97건으로 가장 많았고, 정신질환 위장과 고의 문신, 안과질환 위장 등이 뒤를 이었습니다. 여기에 청각 장애 위장이라는 신종 수법까지 발견된만큼, 병무청은 신체검사 전반을 재점검할 계획입니다. KBS 뉴스 박민철입니다.  박민철 기자 (mcpark@kbs.co.kr)▶ [만세 지도] 우리 동네 3.1운동 현장은?▶ 네이버 채널 KBS뉴스 구독! 시원하게 털어드립니다▶ ‘TV보다 ㄹㅇ’ 당신의 진짜 뉴스 ‘케이야’"
1,2019-03-19,JTBC,https://news.naver.com/main/read.nhn?mode=LSD&mid=shm&sid1=102&oid=437&aid=0000205431,"[앵커]올해는 3·1운동 100주년입니다. 정부는 그동안 알려지지 않았던 독립운동가들을 발굴해서 대대적인 포상을 추진하겠다고 밝혔습니다. 그런데 기존에 사적지로 등록돼 있는 독립유공자들의 생가는 그대로 방치되고 있습니다.밀착카메라 이선화 기자입니다.[기자]이곳은 최초의 여성의병장이었던 윤희순 선생의 생가가 있는 곳입니다.들어가는 길목에는 유적지 안내도가 있고요.보시다시피 옛 집터라고 표시가 되어 있는데 생가의 모습은 어떨지 안쪽으로 들어가 보겠습니다.'ㅁ'자 모양이었던 집은 현재 2곳으로 분리돼 있습니다.안가가 있던 자리에는 현대식 집이 들어섰습니다.현재 윤희순 선생의 후손이 살고 있습니다.마구간과 함께 남아 있는 사랑채는 기존 초가집을 보수한 상태.윤희순 선생이 생활했던 2칸짜리 사랑채입니다.이곳에서 직접 쓴 자료랑 그리고 각종 옷가지들이 발견되기도 했는데요.그런데 지금은 문을 열어서 안쪽을 보시면 포대가 쌓여 있고 장화랑 빈 상자들이 널브러져 있어서 창고처럼 쓰이고 있는 모습입니다.해마다 봄이면 이곳을 찾는 사람들이 많습니다.[유희문/윤희순 선생 고손자 : 다 와서 그래요. '아 이게 생가냐' 그럼 제 입장에서도 집 안에서 같이 살고 그랬는데도 괜히 또 미안하고 창피하고.]100년 전 3월 18일 진주에서 만세운동을 지휘했던 김재화 선생의 집터입니다.보시다시피 아무런 표시가 없어서 마을의 여느 집들과 다를 바가 없는데요.이곳은 진주에 남아있는 유일한 독립유공자의 생가이기도 합니다.진주만세운동을 처음 논의한 장소도 이 곳입니다.지금은 김재화 선생과 관련 없는 마을 주민이 살고 있습니다.[강우달/김재화 선생 생가 현 거주인 : 이 동네 사람들이 살다 가고. (김재화 선생 집인지는) 몰랐지. 비 세울 때 알았지.]마을회관 앞에 세워진 작은 기념비만이 항일운동 유적지임을 짐작케 합니다.[경남 진주시 관계자 : 예산이나 그런 부분도 있으니까 지정문화재로 등록이 돼야 집행이 가능하니까요. 아니면 동이나 이런 차원에서 주변 정리는 할 수 있을 것 같은데.]수원에서 독립만세운동을 주도했던 차병혁 선생의 집입니다.이렇게 문앞에는 독립유공자의 집이라고 쓰여진 명패가 눈에 띄는데요.이 안쪽으로 들어가보시면, 입구부터 각종 집기와 쓰레기들이 널려있습니다.여기는 이렇게 페트병과 목장갑도 볼 수 있는데요.지붕으로 쓰였던 자재들은 이렇게 낡아서 바닥에 떨어져있습니다.오랫동안 사람이 살지 않은 데다가 따로 관리하는 사람도 없다보니 폐가처럼 변한 것입니다.[경기도 문화유산정책팀 관계자 : 그때 당시 터였다는 것만 입증될 뿐이지. 그때 건물을 재현해 낼 정도의 실태조사는 안 되고요.]경기도 화성에서 독립운동을 벌였던 이순모 선생의 생가도 상황은 비슷합니다.아무 흔적이 남아있지 않은 채 방치되고 있습니다.아예 사라진 곳도 있습니다.경기도 의왕시에 있는 한 5층짜리 건물.지난해까지 독립선언문을 한글로 풀었던 이희승 박사의 생가가 있던 자리입니다.[임대섭/이희승 박사 집터 현 거주인 : 저도 여기가 생가인지는 모르고 들어왔어요. 짓고 나니까 나중에 옆에 분들이 여기가 이희승 박사님 생가다.]지금은 신축빌라를 분양한다는 현수막만 휘날리고 있습니다.[최진영/경기 의왕시 포일동 : 한 번도 들어본 적 없는데…(여기가 생가였어요.) 아 그래요? 건물은 본 기억이 있어요.]전국 134곳의 독립운동가 사적지 중 국가보훈처가 직접 관리하고 있는 곳은 45곳뿐입니다.현충 시설이 되기 위해서는 빈집인 상태로 형태가 잘 보존돼야 하고, 소유권자가 보훈처에 직접 신청해야 합니다.정부가 기존 독립운동가 사적지에 대해 더 적극적인 관리가 필요하다는 지적이 나옵니다.항일운동은 특별한 곳에서 시작된 것이 아닙니다.바로 선조들이 앉았던 이 자리에서 시작됐습니다.우리가 기억해야 할 그 정신이 이곳에 서려 있다면, 제대로 관리해야 할 것입니다.이선화(lee.sunhwa@jtbc.co.kr) [영상취재: 김장헌 / 영상편집: 김정은]▶ JTBC 기자들의 시청자 미션 수행? [뉴스 미션] / [뉴스룸 다시보기]▶ 확 달라진 '뉴스APP' 이슈부터 라이브까지 한눈에!Copyright by JTBC(http://jtbc.joins.com) and JTBC Content Hub Co., Ltd. All Rights Reserved. 무단 전재 및 재배포 금지"
2,2019-03-19,MBN,https://news.naver.com/main/read.nhn?mode=LSD&mid=shm&sid1=102&oid=057&aid=0001335002,"【 앵커멘트 】  허가받지 않은 곳에서 미세먼지 마스크를 만들어 판 업체를 MBN이 보도해 드렸는데요.  취재를 더 해보니 한 업체만의 문제가 아니었습니다.  이재호 기자가 단독 보도합니다.【 기자 】  경기도의 한 부업장입니다.  떡하니 황사 마스크 부업을 한다는 문구가 붙어 있습니다.  안에서는 마스크 끈을 붙이는 작업을 하고 있습니다.  몇 주 뒤, 이번에는 단속반과 함께 다시 찾아가 봤습니다.  여전히 작업이 한창입니다.- ""마스크가 요즘 일이 많나 봐요?""- ""예.""- ""하나당 얼마나 받는 거예요?"" - ""8원.""   허가받지 않은 곳에서 미세먼지 마스크를 만드는 건, 엄연히 약사법 위반입니다.  일을 맡긴 업체를 찾아가봤습니다.  업체 간 경쟁이 심해 인건비를 줄이고, 밀려드는 주문을 소화하려 했다고 시인합니다.▶ 인터뷰 : 업체 관계자- ""사실 (업체들이) 많이 생기고 그렇다 보니까…. 서로 경쟁이 되잖아요? 최대한 절약해서 하려다가 잘못한 건데….""▶ 스탠딩 : 이재호 / 기자- ""모든 작업 공정은 이 안에서 진행돼야 하지만, 주문량이 폭주하자 다른 곳에 일감을 준 겁니다.""  주먹구구식으로 만들어지는 해당 제품은 국내 대형 제약회사에도 납품되고 있습니다.  인터넷상에서 마스크 포장 재택 부업을 대놓고 광고하는 것부터 단속이 필요해 보입니다.  MBN뉴스 이재호입니다.  영상취재 : 박세준 기자  영상편집 : 오광환▶MBN의 실시간 방송을 고화질로 즐겨보세요▶MBN의 밀착취재! <ON마이크>< Copyright ⓒ MBN(www.mbn.co.kr) 무단전재 및 재배포 금지 >"
3,2019-03-19,JTBC,https://news.naver.com/main/read.nhn?mode=LSD&mid=shm&sid1=100&oid=437&aid=0000205407,"[앵커]지난달 북·미 정상회담이 결렬된 것은 강경파인 볼턴 때문이라는 것이 그동안의 정설이었습니다. 그런데 오늘 의외의 취재결과가 나왔습니다. 저희 JTBC 취재결과, 회담 직전 폼페이오 미 국무장관이 '결렬 카드'를 트럼프 대통령에게 적극적으로 내밀었던 것으로 파악됐습니다.박현주 기자입니다.[기자]북·미 정상회담 결렬 직후 열렸던 트럼프 대통령의 기자회견.1년 전 싱가포르 회담과는 달리 폼페이오 장관이 함께 단상에 올랐습니다.[도널드 트럼프/미국 대통령 (지난달 28일 기자회견) : 저뿐 아니라 폼페이오 장관도 합의문에 서명하지 않는 게 좋다고 생각했습니다.]최근 미국 행정부 관계자들을 만나고 온 외교 소식통은 ""회담 결렬은 폼페이오 장관이 트럼프 대통령에게 제안한 것으로 들었다""고 말했습니다.그는 ""폼페이오 장관이 존 볼턴 국가안보보좌관보다 더 적극적인 역할을 했다""고도 했습니다.[도널드 트럼프/미국 대통령 (지난달 28일 기자회견) : 합의문이 준비돼 있었지만 서명하기 적절하지 않다고 생각했습니다.]북·미 협상팀은 합의문을 작성해놓았지만 미국측은 회담장에 원샷 해결법, 단계적 해법, 노딜 카드를 모두 들고 들어간 것으로도 확인됐습니다.하노이 회담 직전 워싱턴에서 열린 관료 회의에서는 '결렬' 옵션도 실제 논의된 것으로 전해졌습니다.북한도 회담 이후 이런 정황을 파악하고 폼페이오 장관에 대한 책임론을 들고나왔습니다.최선희 부상은 지난 15일 기자회견에서 ""폼페이오 장관과 볼턴 보좌관이 적대감과 불신의 분위기를 만들었다""고 말했습니다.폼페이오 장관이 결렬 카드를 내민 배경에는 미국 국내 정치적 상황이 작용했다는 분석이 나옵니다.[신범철/아산정책연구원 안보통일센터장 : 트럼프 대통령이 코언 청문회로 인해서 정치적 어려움을 겪는 가운데 북한 문제 관련해서도 잘못된 거래를 했을 경우 정치적 타격이 예상되는 거죠.]상원의원 출마를 준비중인 폼페이오 장관과 트럼프 대통령 모두 단계적 해법은 정치적으로 도움이 되지 않는다는데 뜻을 같이했을 가능성이 나옵니다.(영상디자인 : 정수임)박현주(park.hyunju@jtbc.co.kr) [영상편집: 이지혜]▶ JTBC 기자들의 시청자 미션 수행? [뉴스 미션] / [뉴스룸 다시보기]▶ 확 달라진 '뉴스APP' 이슈부터 라이브까지 한눈에!Copyright by JTBC(http://jtbc.joins.com) and JTBC Content Hub Co., Ltd. All Rights Reserved. 무단 전재 및 재배포 금지"
4,2019-03-19,SBS,https://news.naver.com/main/read.nhn?mode=LSD&mid=shm&sid1=102&oid=055&aid=0000718222,"<앵커>지진이 일어난 뒤 포항에서는 아직도 집에 돌아가지 못한 사람들이 있습니다. 일부 시민들은 국가를 상대로 손해 배상 소송도 냈는데 내일(20일) 구체적인 발표 내용을 지켜봐야겠지만, 지열 발전소가 지진에 영향을 준 것으로 나오면 소송에도 역시 영향을 미칠 것으로 보입니다.계속해서 소환욱 기자입니다.<기자>2017년 11월 15일, 규모 5.4의 강진으로 135명의 인명피해가 났고 공식 재산피해도 850억 원에 달했습니다.집을 잃은 이재민은 1천800명이나 됐습니다.정부는 포항을 특별재난지역으로 선포하고 1천8백억 원을 복구 비용으로 투입했습니다.1년 4개월이 지난 지금 당시 8백여 명의 이재민이 머물렀던 포항 흥해 체육관에는 아직도 90세대, 200여 명이 텐트 생활을 하고 있습니다.[윤성일/이재민 : 집안 사정은 비가 오면 위에 천장이 석고보드이기 때문에 떨어지고, 바닥이 동파이프이기 때문에 잘 못 건들면 아랫집까지 물어줘야 해요.]정부는 1년 동안의 정부 조사단 조사 결과에 따라 추가 보상 등을 검토하기로 했습니다.하지만, 지난해 9월 '국가배상 책임 가능성이 낮다'는 내부 보고서가 공개되면서 조사 결과도 나오기 전에 조사단에 지침을 내린 것이라는 논란이 일었습니다.포항 시민 71명은 지난해 10월 국가를 상대로 정신적 손해배상 집단 소송을 냈고 올해 초 2차 소송에도 1천1백 명 넘는 시민이 추가로 참여했습니다.[이경우/소송 담당 변호사 : 주택이라던가 이런 것이 전파나 반파의 경우 하루에 만원을 청구했고, 소파나 재산상 손해가 없는 경우에는 1일 오천 원을 청구했습니다.]지열 발전소가 지진에 큰 영향을 미쳤다는 결론이 나오면 소송 결과에 영향을 미칠 뿐 아니라 유사소송까지 잇따를 것으로 보입니다.포항 시민 300여 명은 내일 서울 프레스센터에서 정부 조사단의 발표를 지켜본 뒤 입장을 발표하기로 했습니다.(영상취재 : 정경문, 영상편집 : 박진훈)       ▶ ""지열발전소, 포항 지진에 영향""…정부, 20일 공식 발표(https://news.sbs.co.kr/news/endPage.do?news_id=N1005183441) 소환욱 기자(cowboy@sbs.co.kr)▶[핫이슈] '승리·정준영 카톡방' 전방위 수사▶[핫이슈] '최악의 미세먼지' 전국 비상▶네이버 메인에서 SBS뉴스 구독하기※ ⓒ SBS & SBS Digital News Lab. : 무단복제 및 재배포 금지"
5,2019-03-19,MBC,https://news.naver.com/main/read.nhn?mode=LSD&mid=shm&sid1=101&oid=214&aid=0000933452,"[뉴스데스크]◀ 앵커 ▶베이징 공장의 가동을 중단하면서 시작된 현대차의 인력감축 움직임이, 이제 국내로까지 옮겨 붙고 있습니다. 앞으로 정년퇴직 인원만큼 충원하던 관행을 중단해서 인력을 줄이겠다는 방침을 노조에 전달했는데요.노조는 매년 수천 명이 퇴직하는 상황에서 사실상 대규모 구조조정이라면서 최소한 만 명은 충원해야 한다고 맞서고 있는 상황입니다. 이게 사실 미래차인 수소, 전기차와 관련된 문제인데요. 이준희 기자가 취재했습니다.◀ 리포트 ▶3만 5천 명이 일하는 현대자동차 생산라인.1960년을 전후해 태어난 베이비붐 세대가 정년을 맞으면서 올해만 1천4백 명이 작업복을 벗습니다.그동안은 '직원 정년퇴직 시 대체 인원을 정규직으로 뽑는다'는 노사 협약에 따라 퇴직한 숫자만큼 채용이 이뤄졌습니다.그러나 현대차 사측은 이달 초 노사위원회에서 '퇴직자 대체 채용'을 중단한다는 방침을 내놨습니다.2025년까지 국내 공장 조립차량의 4분의 1인 45만대를 친환경차로 만든다는 계획인데, 친환경차는 부품이 기존 내연기관차보다 단순해 필요한 인력도 적다는 겁니다.현대차 관계자는 ""2025년까지 현재 생산직 일자리 중 7천 개는 필요 없어진다""며 ""이대로 가다간 유휴인력 문제가 심각해진다""고 말했습니다.해고는 하지 않되 퇴직자의 빈자리를 채우지 않는 방식으로 인력을 줄이는, 폭스바겐의 노사 협약을 모델로 삼았다는 설명입니다. 노조 측은 회사의 방침이 사실상 대규모 구조조정이라고 반발하고 있습니다. 2025년까지 정년 퇴직하는 인원이 1만 7천 명인데 신규인력을 아예 뽑지 않으면 회사가 불필요하다고 밝힌 7천 명보다 훨씬 많이 감원하는 셈이라며, 최소한 1만 명은 충원해야 공장이 정상적으로 가동될 수 있다는 겁니다. 회사가 자연감소분 모두를 줄일지, 일부 신규채용을 할지 입장을 내놓지 않은 상황이어서 앞으로 노사간 갈등이 예상됩니다.MBC뉴스 이준희입니다.이준희 기자 (letswin@mbc.co.kr )[저작권자(c) MBC (http://imnews.imbc.com) 무단복제-재배포 금지]▶ 네이버 홈에서 [MBC뉴스] 채널 구독하기▶ [엠빅뉴스] '청담동 주식부자' 이희진 부모 살해 사건, 풀리지 않는 미스터리▶ [14F] 서비스 이용약관, 이래도 안 읽을 거야?Copyright(c) Since 1996, MBC&iMBC All rights reserved."
