,date,newsSource,newsLink,newsText
46,2019-03-02,MBC,https://news.naver.com/main/read.nhn?mode=LSD&mid=shm&sid1=102&oid=214&aid=0000928550,"[뉴스데스크]◀ 앵커 ▶한유총이 왜 이런 가짜뉴스까지 유포하면서 대응하는건지, 또 한유총 집단행동의 피해자라고 할 수 있는 유치원 학부모들의 움직임까지 방금 보도한 임상재 기자와 좀 더 자세히 알아보겠습니다.임 기자, 원래 한유총은 국가관리 회계시스템이죠, 에듀파인을 거부한다고 했다가 이건 또 받아들이겠다고 했잖아요.그럼 지금은 또 왜 개학연기라는 무리수를 두면서 반발하는 건가요.◀ 기자 ▶앞서 설명드린대로 한유총은 교육부 시행령이 '사립유치원 말살 정책'이라는 주장이구요.특히 '사립유치원이 폐원하려면 학부모 2/3이상 동의를 받아야 한다', 이 내용을 가장 강하게 반대하고 있는데요.유치원은 원래 사유재산인데, 국가가 왜 '이래라 저래라 하냐', 이겁니다.이런 생각을 단적으로 보여주는 발언이 지난달 26일 대규모 집회때 나왔는데 ""치킨집 문 닫는데 치킨집 종업원 2/3이상 동의 받으라는 꼴이다""고 했습니다.◀ 앵커 ▶유치원을 치킨집에 비유한 거군요.◀ 기자 ▶네, 또 유치원 학부모들은 치킨집 종업원에 비유한 거구요.그러니까 한유총은 유치원을 폐원하든, 휴업을 하든, '사장 맘대로 할 수 있는 거 아니냐' 이런 의식을 갖고 있는 겁니다.하지만 아시다시피 사립유치원엔 지원되는 국가세금이 매년 2조원에 달하구요.그래서 유은혜 부총리는 공적 책임을 가져야할 교육기관이 치킨집이냐며 타협은 없다 이게 정부 입장입니다.◀ 앵커 ▶이런 한유총의 집단행동에 가장 피해를 보고, 또 반발하고 있는 분들이 바로 학부모들일텐데요.◀ 기자 ▶그렇습니다.사실 폐원이나 휴원, 개학연기, 이런 집단행동은 결국 아이들과 학부모들을 볼모로 삼고 피해를 주는 겁니다.정부와의 싸움이기 이전에 한유총과 학부모와의 싸움이 되고 있는거죠.이게 전국유치원학부모 비상대책위원회, 성명서인데요.""한유총이 해괴망칙한 색깔론까지 외친다, ""유치원을 사익추구의 도구로만 생각한다""고 비판하면서 ""학습권 침해에 대해 민형사상 고발하겠다""고 하면서 강력 비난했습니다.이런 상황에서도 오늘 자유한국당은 이낙연 총리의 강경대응 방침에 ""교육부장관을 먼저 질타하고 한유총과 대화하라""고 했죠.이렇게 한유총을 비호하는 정치인들은 ""134만 학부모들이 총선에서 심판하겠다""고도 했습니다.이 학부모 단체는 인내심이 한계에 달했다며 조만간 대규모 한유총 규탄 집회를 열겠다는 계획을 전하기도 했습니다.◀ 앵커 ▶만약 한유총이 개학연기를 강행하면 당장 월요일부터죠, 아이 보낼 다른 곳을 찾아야 하나요?어떻게 해야 합니까.◀ 기자 ▶일단 내일 오전 한유총이 기자회견을 한다고 해서 통화를 해봤는데, 아직까지는 '개학연기 방침엔 변화가 없다'고 합니다.정부와 강대강 평행선을 달리자는 건데 이럴 경우 이번엔 정말 정부가 밝힌대로 즉시 형사 고발하고 수사와 처벌이 이뤄질지 지켜봐야겠구요.참여 유치원이 예상보다 적고, 학부모 반발에다 정부도 강경한 입장인 사면초가 속에서 계속 개학 연기 방침을 고수할 수 있을지도 봐야할 상황입니다.그래도 강행한다고 하면, 일단 학부모들이 당장 내일부터 각 지역 교육청에 대체 돌봄센터를 알아봐야 하고, 낯선 장소에 아이를 맡겨야 하는 불편과 혼란은 불가피해 보입니다.◀ 앵커 ▶네, 임상재 기자, 수고하셨습니다.임상재 기자 [저작권자(c) MBC (http://imnews.imbc.com) 무단복제-재배포 금지]▶ 네이버 홈에서 [MBC뉴스] 채널 구독하기▶ [엠빅뉴스] 북한 김정은 위원장의 평양에서 하노이까지..'길' 뮤직비디오 MV (feat.god)▶ [14F] 출산율 0명대, 이러다 인구 소멸? Copyright(c) Since 1996, MBC&iMBC All rights reserved."
47,2019-03-02,MBC,https://news.naver.com/main/read.nhn?mode=LSD&mid=shm&sid1=102&oid=214&aid=0000928557,"[뉴스데스크]◀ 앵커 ▶1년 전 취업을 선택한 고 3 이민호 군이 현장 실습에서 목숨을 잃었던 안타까운 사고, 기억하십니까.사고 직후 각종 정부 대책이 나왔습니다만, 1년 만에 슬그머니 원점으로 돌아가고 있습니다.자식을 잃은 부모들이 다시 나섰습니다.소수의견, 곽승규 기자가 들어봤습니다.◀ 리포트 ▶지난 2017년 말 음료공장에서 실습하던 고 3 이민호 군이 기계에 몸이 끼는 사고를 당했습니다.이 군은 병원으로 옮겨졌지만 끝내 열흘만에 숨졌습니다.""잘거라 사랑한다 내 친구 민호야, 기억하겠다 내 친구 민호야""당시 사건의 파장은 컸습니다.정부는 산업 현장에서 일하는 실습 고등학생들의 안전을 보장하겠다며 부랴부랴 대책을 내놨는데요.이 대책 지금은 잘 시행되고 있을까요?이 군의 사망 이후 열린 사회관계장관회의를 한 번 보시죠.[김상곤(당시 사회부총리)/지난 2017년 12월] ""학생을 노동력 제공 수단으로 활용하는 조기취업형태의 운영방식을 2018년부터 전면 폐지하겠습니다.""취업 중심 현장실습을 학습 중심으로 바꾼다며 실습 기간을 최대3개월로 제한하고 학생들을 보내는 기업을 선정하는 절차도 강화했습니다.하지만 대책은 길지 않았습니다.강화된 규제에 못 맞추겠다며 기업들이 실습에서 잇따라 빠지자 불과 1년만에 기업 선정 절차를 다시 간소화하기로 했습니다.최대 실습 기간도 다시 6개월로 늘렸습니다.[유은혜/사회부총리]""현장실습이 위축돼 취업률의 급격한 저하로 이어지고 있다는 현장의 많은 우려를 수용해서 조기에 현장실습제도를 보완하고 개선해가고자 합니다.""안전을 이유로 개선했던 제도를 불과 1년 만에 되돌릴 만큼 그 사이 현장 환경이 개선됐을까요.숨진 이민호 군은 원예 전공이었지만 전혀 상관 없는 기계 수리 업무를 맡았습니다.이런 일이 없도록 교육부는 전담 노무사를 지정하고 실습 업체 직원 중 기업현장교사를 선정해 학생들을 관리하겠다고 밝혔습니다.하지만 현장에서 자신의 업무를 하기에도 바쁜 직원이 학생들의 안전을 도맡아 챙길 수 있을지 의문입니다.재해 발생시 처벌 규정도 여전히 약합니다.고 이민호 군 사망사고는 사업주에게 겨우 집행유예가 선고됐습니다.현장실습 도중 자녀를 잃은 유가족들이 최근 모임을 만들어 목소리를 높이고 있는 이유입니다.[이상영/故 이민호 군 아버지]""학생들의 안전 보장과 그런 것을 다 책임지는 인증제를 하겠다는데 인증을 누가 해주겠다는 것이냐 물으니 대답을 못합니다.""이들이 바라는 건 단 하나.아이들을 또다시 위험한 현장으로 내몰지 말라는 것입니다.[이상영/故 이민호 군 아버지]""내가 이러는 건 딱 하나에요. 나같은 아픔을 더 이상 다른 부모들이 갖지 않기 위해서, 민호 같은 똑같은 죽음이 되풀이되지 않기 위해서 정말 이것뿐입니다.""지금까지 소수의견이었습니다.곽승규 기자 (heartist@mbc.co.kr)[저작권자(c) MBC (http://imnews.imbc.com) 무단복제-재배포 금지]▶ 네이버 홈에서 [MBC뉴스] 채널 구독하기▶ [엠빅뉴스] 북한 김정은 위원장의 평양에서 하노이까지..'길' 뮤직비디오 MV (feat.god)▶ [14F] 출산율 0명대, 이러다 인구 소멸? Copyright(c) Since 1996, MBC&iMBC All rights reserved."
48,2019-03-02,연합뉴스,https://news.naver.com/main/read.nhn?mode=LSD&mid=shm&sid1=104&oid=001&aid=0010668997,"印조종사 송환으로 갈등 수위↓…지상충돌은 계속돼 민간인 사망 속출 인도령 카슈미르(잠무-카슈미르주) 스리나가르에서경계활동을 하는 인도 군인. [신화=연합뉴스] (뉴델리=연합뉴스) 김영현 특파원 = 핵보유국 인도와 파키스탄이 인도 조종사 송환을 통해 갈등 해결의 실마리를 찾았지만, 접경지대에서는 여전히 포격전이 계속되는 등 불씨가 좀처럼 가라앉지 않는 양상이라고 AP통신 등 외신과 힌두스탄타임스 등 현지 언론이 2일 보도했다.    지난달 26일 인도 공군의 파키스탄령 공습으로 촉발된 양국의 군사충돌 사태는 지난 1일 파키스탄이 억류했던 인도 조종사를 돌려보내면서 극적으로 완화되는 분위기다.    파키스탄군은 지난달 27일 공중전을 벌이다 격추된 미그21 전투기 조종사 아비난단 바르타만을 사로잡은 뒤 이틀 만에 인도로 송환했다.    그러면서 임란 칸 파키스탄 총리는 갈등이 더 고조되는 것을 원하지 않는다며 ""평화의 제스처로 조종사를 송환한다""고 강조했다.    이를 계기로 일촉즉발 위기 상황으로 치닫던 양국 간 갈등은 차츰 가라앉는 모양새다.    지난달 27일 양국이 1971년 카슈미르 3차 전쟁 이후 48년 만에 처음으로 전투기까지 동원해 공중전을 벌일 때만 하더라도 핵전쟁 우려까지 제기됐었다.    실제로 칸 총리는 보복을 다짐하며 자국의 핵전력을 관할하는 국가지휘국을 소집하기까지 했다.    하지만 이후 미국 등 국제사회는 군사충돌을 자제하라는 메시지를 강력하게 제시했고, 이에 양국은 조금씩 물러난 끝에 조종사 송환까지 이뤄졌다.파키스탄군의 포격으로 파괴된 인도 민간인 주택. [힌두스탄타임스 홈페이지 캡처]그런데도 분쟁지 카슈미르의 사실상 국경인 통제선(LoC) 인근에서는 2일 포격전과 총격전이 계속됐다.    특히 파키스탄군의 포탄이 인도령 카슈미르(잠무-카슈미르주) 내 푼치 지역의 민간인 거주지에 떨어지면서 주택 여러 채가 파괴됐다.    인도 경찰은 ""1일부터 계속된 이 폭격으로 민간인 3명이 사망했고 1명이 중상을 입었다""고 밝혔다.    파키스탄 쪽도 피해가 발생했다.    파키스탄령 카슈미르(아자드-카슈미르) 당국 관계자는 ""중화기로 무장한 인도군이 국경 인근 마을을 겨냥해 무차별 폭격을 가했다""며 ""이로 인해 소년 1명이 사망했고 주택 여러 채가 부서졌다""고 말했다.    양측 모두 ""상대 공격에 따라 이에 상응하는 대응을 한 것""이며 정전협정을 위반한 것은 상대편이라고 주장했다.    다만, 이처럼 갈등 촉발 불씨는 살아있지만, 지난달처럼 전투기를 동원한 대규모 충돌 가능성은 크지 않은 것으로 언론은 분석했다.    가디언은 ""지난해 7월 총선 승리로 막 정부를 출범시킨 데다 경제난을 겪는 칸 총리나 총선을 앞둔 나렌드라 모디 총리 모두 전면전을 벌일 여력이 없다""고 지적했다.    특히 오는 4∼5월 총선을 앞두고 지지율 하락에 시달리던 모디 총리는 이번 군사충돌로 보수층 결집 등의 성과를 거둔 만큼 확전을 벌일 가능성은 작은 것으로 전문가들은 내다봤다.     cool@yna.co.kr▶네이버 홈에서 [연합뉴스] 채널 구독하기▶뭐 하고 놀까? #흥  ▶쇼미더뉴스! 오늘 많이 본 뉴스영상"
49,2019-03-02,뉴시스,https://news.naver.com/main/read.nhn?mode=LSD&mid=shm&sid1=102&oid=003&aid=0009089612,"【광주=뉴시스】류형근 기자 = 광주·전남지역 유일 일본 위안부 피해자 였던 곽예남 할머니가 2일 별세했다. 향년 96세. 2019.03.02. (사진=뉴시스 DB) photo@newsis.com【광주=뉴시스】변재훈 기자 = 3·1만세운동 100주년이 하루 지난 2일 눈을 감은 곽예남 할머니의 마지막 소원은 일본의 사과를 받는 것이었다.하지만 곽 할머니는 끝내 소원을 이루지 못한 채 가슴에 한을 품고 94세의 일기로 별세했다. 광주·전남지역 유일한 일본 위안부 피해자인 곽 할머니는 1925년 전남 담양에서 태어났다. 나라가 어수선한 상황 속에서도 곽 할머니는 친구들과 함께 나물을 캐며 즐겁게 생활했다. 그러나 1944년 19세 때 ""돈을 벌 수 있는 공장에 취직시켜 주겠다""는 일본 순사(순경)의 말을 듣고 친구 10여명과 함께 끌려갔다. 곽 할머니가 도착한 곳은 중국의 한 종군위안소였다. 이 곳에서 동물이하의 취급을 받으며 1년 반 가량 일본군 위안부 생활을 했다. ""하루 빨리 고향집으로 돌아가 아버지·어머니·오빠를 만나고 싶다""는 희망을 품고 버텼지만 이미 몸과 마음을 다친 곽 할머니는 고향으로 돌아가지 못했다. 중국 곳곳을 떠돌아 다니다가 안휘성 숙주에 정착해 60여 년을 살았다. 곽 할머니는 중국에 사는 동안에도 한국 국적을 포기하지 않았으며, 지난 2004년 한 방송사 공익예능프로그램과 한국정신대연구소의 도움으로 귀국했다. 이어 막내 여동생의 아들인 이종 조카의 보살핌을 받으며 고향인 담양에서 지냈다. 하지만 몸과 마음에 병을 얻은 곽 할머니는 세포암·폐암 4기·치매 진단을 받았다. 곽 할머니의 기억은 10대 시절 고향에서 친구들과 어울렸던 모습과 위안부에 끌려가던 당시에 머물렀다.  또 드문드문 기억이 돌아오면 ""일본의 사과를 받고 눈을 감고 싶다""는 말을 주변 지인들에게 하기도 했다. 곽 할머니는 최근 호흡기 질환 등 증상이 악화돼 병원 치료를 받았지만 끝내 눈을 감았다. 일본군 성노예 문제 해결을 위해 결성된 광주나비 관계자는 ""곽 할머니의 별세로 이제 위안부 피해 할머니는 22명이 남았다""며 ""이들이 고령인 데다 기억도 온전치 않아 더 늦기 전에 일본의 사죄와 배상을 받을 수 있도록 노력해야 한다""고 밝혔다. 곽 할머니의 빈소는 전주병원 장례식장 VIP실 별관 특실에 마련됐다. 발인은 4일 오전 8시이며 장지는 충남 천안 망향의 동산이다. wisdom21@newsis.com▶ 네이버에서 뉴시스 채널 구독하기▶ 뉴시스 빅데이터 MSI 주가시세표 바로가기 <저작권자ⓒ 공감언론 뉴시스통신사. 무단전재-재배포 금지.>"
50,2019-03-02,아시아경제,https://news.naver.com/main/read.nhn?mode=LSD&mid=shm&sid1=102&oid=277&aid=0004422159,"지난 28일 오후 10시께 서울역 광장 한쪽 자리서 잠을 청하고 있는 노숙인들. 사진=한승곤 기자 asiae.co.kr[아시아경제 한승곤 기자] “아니야 아니야 아니야”지난 28일 오후 10시께 서울역 광장 인근서 여성 노숙인에게 기자가 다가가 인사를 건네자, 그는 이 같은 말을 남기고 황급히 짐을 챙겨 자리를 떴다. 남성에 대한 공포감, 적개심 등 분노로 가득 찬 표정이 엿보였다.이 노숙인은 서울역 인근서 서너 시간 동안 찾다 겨우 만난 여성 노숙인이였지만 황급히 떠나는 모습에 왜 노숙을 할 수밖에 없는지, 노숙 과정서 불편하고 힘든점은 없는지 질문할 수 없었다.보건복지부(이하 복지부)에 따르면 지난해 기준 여성 노숙인은 전체 11,340명 중 26%에 달한다. 하지만 이들을 거리에서 보기는 쉽지 않다. 여성 노숙인들은 대형마트 주차장, 백화점 공중화장실, 인근 공원 등 사람들의 눈에 잘 띄지 않는 곳에서 생활하는 경우가 많기 때문이다.서울역 인근서 장사하며 수많은 노숙인들을 만나고 또 대화도 해봤다고 밝힌 50대 상인 A 씨는 “(여성 노숙인들은) 집에서 각종 폭력적인 상황에 있다 보니 차라리 집 밖으로 나오는 경우가 많은 것 같다”며 “모두 마음의 상처가 있는 것 같다”고 말했다.그러면서 “그런데 여성이다 보니 아무래도 성추행 등 위험에 노출된 것 같다”며 “이런 이유로 여성 노숙인들은 다 숨어버린다. 길에서 쉽게 볼 수 없는 이유다”라고 설명했다.서울시가 노숙인을 성별로 나눠 조사한 ‘서울시 노숙인 정책의 성별 영향평가 보고서’에 따르면 여성 노숙인은 가정폭력과 아동학대, 정신질환에 의한 갈등을 포함한 가족 문제(43%)로 노숙을 시작하는 것으로 나타났다. 노숙인 자활·재활 시설에 입소한 여성의 경우 약 60%가 비경제적 어려움인 가족 관계의 어려움을 들었다.서울역 주변 지하도에서 겨울을 나고 있는 노숙인들.사진=연합뉴스이들은 노숙인 관련 통계에서도 쉽게 찾아볼 수 없다. 복지부가 발표한 ‘2016년 노숙인 등의 실태조사 결과 및 향후 대책’에 따르면 그해 10월 기준 노숙인은 1만1340명으로 집계됐다.이 가운데 최근 5년간 여성 노숙인 현황을 보면 2013년 3204명(25%), 2014년 2929명(24%), 2015년 2883명(25%), 2016년 2899명(26%), 2017년 2814명(26%)으로 여성 노숙인 비율이 현저히 낮다.통계의 이런 배경에는 거리 노숙을 최대한 피할 수밖에 없는 여성 노숙인의 특성이 있다는 게 전문가의 지적이다. 한 활동가는 “여성의 경우 거리서 혼자 잠을 자거나 노숙을 하기가 쉽지 않다”고 강조했다.실제로 지난 2017년 4월 대전광역시의 한 공터에서 한 여성 노숙인이 숨진 채 발견됐다. 평소 알고 지내던 남성과 술을 마시는 과정에서 말다툼이 벌어졌고, 격분한 남성에 의해 이 같은 변을 당한 것으로 밝혀졌다.이날 서울역 인근서 만난 남성 노숙인들도 여성 노숙인들이 처한 상황에 잘 알고 있었다.서울역 광장 한쪽에서 만난 50대 노숙인 B 씨는 “최근 여성 노숙인들의 모습을 본 적 있냐”라는 기자의 질문에 “(여성 노숙인들을 못 본 게)최근뿐만 아니라 내 기억에는 한 5년 정도 된 것 같다”며 “여성 노숙인은 길에 나오는 순간 온갖 성희롱을 당한다. 그래서 다 숨어버렸다”고 강조했다.그는 성희롱하는 모습을 직접 보기도 했다면서 “한 남성 노숙인이 여성 노숙인과 함께 인근 허름한 여인숙으로 들어가는 모습을 봤다”며 “이런 일이 많았다, 말로도 성추행을 많이 하고 그래서 다들 눈에 보이지 않게 숨어버린 것”이라고 말했다.또 다른 남성 노숙인 C 씨 역시 “성희롱이 너무 심하다”며 말끝을 흐렸다.사진=연합뉴스복지부의 2017년 노숙인의 실태조사 결과 여성 노숙인에 대한 성추행, 성폭행이 심각한 것으로 나타났다. 노숙 생활 중 성추행, 성폭행 피해 경험 비율은 여성이 7.2%로 남성 0.5%보다 매우 높았다. 구타와 가혹 행위 경험도 여성이 10.7%로 남성 7.3%보다 높은 것으로 나타났다.여성 노숙인이 성추행, 성폭력, 가혹 행위 등 각종 범죄에 노출돼 있다는 사실이 통계로 입증된 셈이다.하지만 여성 노숙인들이 마음을 기대고 편히 쉴 수 있는 공간은 적다. 전국의 여성 노숙인 전용시설은 2017년 12월 기준으로 15군데에 불과하다. 이들 시설의 정원은 961명으로 여성 노숙인의 34.2%만이 수용할 수 있다.전국 노숙인 시설은 118군데, 정원이 10,359명인데 반해 여성 노숙인을 위한 전용시설은 정원대비 9.3%에 불과하다. 여성노숙인 전용시설의 확충 필요성이 제기되는 이유다. 전문가는 여성 노숙인 중심의 새로운 복지 서비스가 필요하다고 강조했다. 서울도시연구 논문 ‘여성노숙인의 자립준비도에 영향을 미치는 요인(신원우·황운성·김유경)’에서 전문가는 “여성 노숙인들은 가정폭력, 정신장애 등 비경제적 요인이 경제적 요인에 비해 더 중요한 원인으로 파악되고 있다”며 “노숙으로 인한 심리사회적 부적응은 자립을 더욱더 어렵게 하고 있다”고 강조했다.이들에 대한 복지에 대해서는 “여성노숙은 기존의 남성노숙과는 다른 새로운 사회복지서비스 대상으로 이해되어야 하며, 그들의 경험에 대해서 또한 새로운 시각과 분석이 필요하다. 여성노숙인의 특수성을 반영한 사회복지서비스의 개선이 필요하다”고 제언했다.한승곤 기자 hsg@asiae.co.kr▶ 아시아경제 채널 추가하고 에어팟, 해외여행비 받자!▶ 재미와 신기 '과학을읽다' ▶ 꿀잼 '인기만화'<ⓒ경제를 보는 눈, 세계를 보는 창 아시아경제 무단전재 배포금지>"
51,2019-03-02,연합뉴스,https://news.naver.com/main/read.nhn?mode=LSD&mid=shm&sid1=102&oid=001&aid=0010668907,"참여율 애초 목표 60%보다 훨씬 낮은 10% 안팎…한유총 내일 기자회견유치원 개학연기 대응 긴급회의 소집한 이낙연 총리(서울=연합뉴스) 김현태 기자 = 2일 오전 종로구 정부서울청사에서 열린 한국유치원총연합회 개학연기 대응 긴급 관계부처·지자체 회의에서 이낙연 국무총리가 발언하고 있다. 2019.3.2 mtkht@yna.co.kr    (서울=연합뉴스) 황희경 기자 = 정부가 한국유치원총연합회(한유총)의 유치원 개학 연기 투쟁에 대해 2일 범정부 차원에서 엄정 대응을 재차 경고하며 압박에 나섰다.    그러나 한유총은 ""군사독재 시절에도 볼 수 없는 교육공안정국 조성""이라며 물러서지 않겠다는 태도를 보여 '강대강' 대치가 계속되고 있다.     정부는 전날 유은혜 부총리 주재로 대책회의를 연 데 이어 이날은 국무총리 주재로 급을 높여 각 부처와 지방자치단체장, 교육감 등이 참석한 가운데 대응방안을 논의하는 등 압박을 계속했다.    이낙연 국무총리는 법령에 따라 엄정대처하겠다는 입장을 밝히며 교육부에 법적 조치까지 포함한 단계별 대책을 적극적으로 이행하라고 지시했다. 특히 개학을 무단 연기한 유치원에 대해서는 시정명령을 거쳐 형사고발 조치하는 등 '무관용 원칙'으로 대응하겠다고 밝혔다.에듀파인은 수용, 개학은 연기(서울=연합뉴스) 홍해인 기자 = 이덕선 한국유치원단체총연합회(한유총) 이사장이 28일 오후 서울 용산구 한유총 사무실에서 에듀파인 수용 및 다가온 유치원 개학을 무기한 연기하는 것과 관련해 기자회견을 하기 위해 입장하고 있다. 2019.2.28 hihong@yna.co.kr    한유총도 강경 입장을 고수하고 있다.     한유총은 이날 보도자료에서 ""걸핏하면 국세청장, 경찰청장, 공정거래위원장 등 권력기관을 동원한 사립유치원 죽이기 겁박과 탄압정책은 군사독재 시절에도 볼 수 없는 교육 공안정국을 조성하여 사회불안을 증폭하는 것으로써 매우 부적절한 태도""라고 주장했다.     개학연기 결정이 학교 운영위원회를 거치지 않아 불법이라는 정부 지적에도 ""변호사 자문 결과 문제가 없다""며 반박했다.     과거 한유총의 집단행동 때와는 다르게 이번에는 협상 가능성도 별로 크지 않은 편이다.     한유총은 유치원 문제를 원자력발전소 폐기 사안처럼 '공론화 과정'을 통해 해결하자며 정부에 '대화와 소통'을 요청하고 있지만, 정부는 한유총의 본질적인 태도 변화 없이는 소통의 의미가 없다는 입장이다.    이런 가운데 실제 개학연기에 참여하는 유치원 수가 한유총 예상보다는 적을 것으로 나타나 사태 향방에 어떤 식으로든 영향을 미칠 것으로 보인다.      이날 각 교육청이 개학 연기 유치원 명단을 공개한 결과 개학 연기 참여 의사를 명확히 밝힌 유치원은 190곳이었다. 한유총 전체 회원 대비 동참률은 6.7% 수준으로 집계됐다. 정부 조사에 응하지 않거나 답변하지 않은 유치원까지 포함해도 10% 미만으로, 한유총이 당초 예상했던 60% 수준과는 큰 차이가 있다.    '학부모와 아이들을 볼모로 잡고 있다'는 부정적인 여론이 우세한 상황에서 경찰과 검찰, 공정위까지 나서 유치원들을 전방위로 압박하고 있는 만큼 유치원들의 태도 변화도 주목된다.     한유총은 3일 오전 기자회견을 열어 최종 입장을 밝힐 예정이다. zitrone@yna.co.kr▶네이버 홈에서 [연합뉴스] 채널 구독하기▶뭐 하고 놀까? #흥  ▶쇼미더뉴스! 오늘 많이 본 뉴스영상"
